,0
Adapting Software Fault Isolation to Contemporary CPU Architectures.," Software Fault Isolation (SFI) is an effective approach to sandboxing binary code of questionable provenance, an interesting use case for native plugins in a Web browser. We present software fault isolation schemes for ARM and x86-64 that provide control-flow and memory integrity with average performance overhead of under 5% on ARM and 7% on x86-64. We believe these are the best known SFI implementations for these architectures, with significantly lower overhead than previous systems for similar architectures. Our experience suggests that these SFI implementations benefit from instruction-level parallelism, and have particularly small impact for workloads that are data memory-bound, both properties that tend to reduce the impact of our SFI systems for future CPU implementations.  "
Making Linux Protection Mechanisms Egalitarian with UserFS.,"  UserFS provides egalitarian OS protection mechanisms in Linux. UserFS allows any user—not just the system administrator—to allocate Unix user IDs, to use chroot, and to set up firewall rules in order to confine untrusted code. One key idea in UserFS is representing user IDs as files in a /proc-like file system, thus allowing applications to manage user IDs like any other files, by setting permissions and passing file descriptors over Unix domain sockets. UserFS addresses several challenges in making user IDs egalitarian, including accountability, resource allocation, persistence, and UID reuse. We have ported several applications to take advantage of UserFS; by changing just tens to hundreds of lines of code, we prevented attackers from exploiting application-level vulnerabilities, such as code injection or missing ACL checks in a PHP-based wiki application. Implementing UserFS requires minimal changes to the Linux kernel—a single 3,000-line kernel module—and incurs no performance overhead for most operations, making it practical to deploy on real systems.  "
Capsicum: Practical Capabilities for UNIX.," Capsicum is a lightweight operating system capability and sandbox framework planned for inclusion in FreeBSD 9. Capsicum extends, rather than replaces, UNIX APIs, providing new kernel primitives (sandboxed capability mode and capabilities) and a userspace sandbox API. These tools support compartmentalisation of monolithic UNIX applications into logical applications, an increasingly common goal supported poorly by discretionary and mandatory access control. We demonstrate our approach by adapting core FreeBSD utilities and Google’s Chromium web browser to use Capsicum primitives, and compare the complexity and robustness of Capsicum with other sandboxing techniques.  "
Structuring Protocol Implementations to Protect Sensitive Data.," In a bid to limit the harm caused by ubiquitous remotely exploitable software vulnerabilities, the computer systems security community has proposed primitives to allow execution of application code with reduced privilege. In this paper, we identify and address the vital and largely unexamined problem of how to structure implementations of cryptographic protocols to protect sensitive data despite exploits. As evidence that this problem is poorly understood, we first identify two attacks that lead to disclosure of sensitive data in two published state-of-the-art designs for exploit-resistant cryptographic protocol implementations: privilege-separated OpenSSH, and the HiStar/DStar DIFC-based SSL web server. We then describe how to structure protocol implementations on UNIX- and DIFC-based systems to defend against these two attacks and protect sensitive information from disclosure. We demonstrate the practicality and generality of this approach by applying it to protect sensitive data in the implementations of both the server and client sides of OpenSSH and of the OpenSSL library.  "
PrETP: Privacy-Preserving Electronic Toll Pricing.,"  Current Electronic Toll Pricing (ETP) implementations rely on on-board units sending fine-grained location data to the service provider. We present PrETP, a privacy-preserving ETP system in which on-board units can prove that they use genuine data and perform correct operations while disclosing the minimum amount of location data. PrETP employs a cryptographic protocol, Optimistic Payment, which we define in the ideal world / real-world paradigm, construct, and prove secure under standard assumptions. We provide an efficient implementation of this construction and build an on-board unit on an embedded microcontroller which is, to the best of our knowledge, the first self-contained prototype that supports remote auditing. We thoroughly analyze our system from a security, legal and performance perspective and demonstrate that PrETP is suitable for low-cost commercial applications.  "
An Analysis of Private Browsing Modes in Modern Browsers.,"  We study the security and privacy of private browsing modes recently added to all major browsers. We first propose a clean definition of the goals of private browsing and survey its implementation in different browsers. We conduct a measurement study to determine how often it is used and on what categories of sites. Our results suggest that private browsing is used differently from how it is marketed. We then describe an automated technique for testing the security of private browsing modes and report on a few weaknesses found in the Firefox browser. Finally, we show that many popular browser extensions and plugins undermine the security of private browsing. We propose and experiment with a workable policy that lets users safely run extensions in private browsing mode.  "
BotGrep: Finding P2P Bots with Structured Graph Analysis.,"  A key feature that distinguishes modern botnets from earlier counterparts is their increasing use of structured overlay topologies. This lets them carry out sophisticated coordinated activities while being resilient to churn, but it can also be used as a point of detection. In this work, we devise techniques to localize botnet members based on the unique communication patterns arising from their overlay topologies used for command and control. Experimental results on synthetic topologies embedded within Internet traffic traces from an ISP’s backbone network indicate that our techniques (i) can localize the majority of bots with low false positive rate, and (ii) are resilient to incomplete visibility arising from partial deployment of monitoring systems and measurement inaccuracies from dynamics of background traffic.  "
Fast Regular Expression Matching Using Small TCAMs for Network Intrusion Detection and Prevention Systems.,"  Regular expression (RE) matching is a core component of deep packet inspection in modern networking and security devices. In this paper, we propose the first hardware-based RE matching approach that uses Ternary Content Addressable Memories (TCAMs), which are off-the-shelf chips and have been widely deployed in modern networking devices for packet classification. We propose three novel techniques to reduce TCAM space and improve RE matching speed: transition sharing, table consolidation, and variable striding. We tested our techniques on 8 real-world RE sets, and our results show that small TCAMs can be used to store large DFAs and achieve potentially high RE matching throughtput. For space, we were able to store each of the corresponding 8 DFAs with as many as 25,000 states in a 0.59Mb TCAM chip where the number of TCAM bits required per DFA state were 12, 12, 12, 13, 14, 26, 28, and 42. Using a different TCAM encoding scheme that facilitates processing multiple characters per transition, we were able to achieve potential RE matching throughputs of between 10 and 19 Gbps for each of the 8 DFAs using only a single 2.36 Mb TCAM chip.  "
Searching the Searchers with SearchAudit.,"  Search engines not only assist normal users, but also provide information that hackers and other malicious entities can exploit in their nefarious activities. With carefully crafted search queries, attackers can gather information such as email addresses and misconfigured or even vulnerable servers. We present SearchAudit, a framework that identifies malicious queries from massive search engine logs in order to uncover their relationship with potential attacks. SearchAudit takes in a small set of malicious queries as seed, expands the set using search logs, and generates regular expressions for detecting new malicious queries. For instance, we show that, relying on just 500 malicious queries as seed, SearchAudit discovers an additional 4 million distinct malicious queries and thousands of vulnerable Web sites. In addition, SearchAudit reveals a series of phishing attacks from more than 400 phishing domains that compromised a large number of Windows Live Messenger user credentials. Thus, we believe that SearchAudit can serve as a useful tool for identifying and preventing a wide class of attacks in their early phases.  "
Toward Automated Detection of Logic Vulnerabilities in Web Applications.," Web applications are the most common way to make services and data available on the Internet. Unfortunately, with the increase in the number and complexity of these applications, there has also been an increase in the number and complexity of vulnerabilities. Current techniques to identify security problems in web applications have mostly focused on input validation flaws, such as cross site scripting and SQL injection, with much less attention devoted to application logic vulnerabilities. Application logic vulnerabilities are an important class of defects that are the result of faulty application logic. These vulnerabilities are specific to the functionality of particular web applications, and, thus, they are extremely difficult to characterize and identify. In this paper, we propose a first step toward the automated detection of application logic vulnerabilities. To this end, we first use dynamic analysis and observe the normal operation of a web application to infer a simple set of behavioral specifications. Then, leveraging the knowledge about the typical execution paradigm of web applications, we filter the learned specifications to reduce false positives, and we use model checking over symbolic input to identify program paths that are likely to violate these specifications under specific conditions, indicating the presence of a certain type of web application logic flaws. We developed a tool, called Waler, based on our ideas, and we applied it to a number of web applications, finding previously-unknown logic vulnerabilities.  "
Baaz: A System for Detecting Access Control Misconfigurations.," Maintaining correct access control to shared resources such as file servers, wikis, and databases is an important part of enterprise network management. A combination of many factors, including high rates of churn in organizational roles, policy changes, and dynamic informationsharing scenarios, can trigger frequent updates to user permissions, leading to potential inconsistencies. With Baaz, we present a distributed system that monitors updates to access control metadata, analyzes this information to alert administrators about potential security and accessibility issues, and recommends suitable changes. Baaz detects misconfigurations that manifest as small inconsistencies in user permissions that are different from what their peers are entitled to, and prevents integrity and confidentiality vulnerabilities that could lead to insider attacks. In a deployment of our system on an organizational file server that stored confidential data, we found 10 high level security issues that impacted 1639 out of 105682 directories. These were promptly rectified.  "
Cling: A Memory Allocator to Mitigate Dangling Pointers.," Use-after-free vulnerabilities exploiting so-called dangling pointers to deallocated objects are just as dangerous as buffer overflows: they may enable arbitrary code execution. Unfortunately, state-of-the-art defenses against use-after-free vulnerabilities require compiler support, pervasive source code modifications, or incur high performance overheads. This paper presents and evaluates Cling, a memory allocator designed to thwart these attacks at runtime. Cling utilizes more address space, a plentiful resource on modern machines, to prevent type unsafe address space reuse among objects of different types. It infers type information about allocated objects at runtime by inspecting the call stack of memory allocation routines. Cling disrupts a large class of attacks against use-after-free vulnerabilities, notably including those hijacking the C++ virtual function dispatch mechanism, with low CPU and physical memory overhead even for allocation intensive applications.  "
ZKPDL: A Language-Based System for Efficient Zero-Knowledge Proofs and Electronic Cash.," In recent years, many advances have been made in cryptography, as well as in the performance of communication networks and processors. As a result, many advanced cryptographic protocols are now efficient enough to be considered practical, yet research in the area remains largely theoretical and little work has been done to use these protocols in practice, despite a wealth of potential applications. This paper introduces a simple description language, ZKPDL, and an interpreter for this language. ZKPDL implements non-interactive zero-knowledge proofs of knowledge, a primitive which has received much attention in recent years. Using our language, a single program may specify the computation required by both the prover and verifier of a zero-knowledge protocol, while our interpreter performs a number of optimizations to lower both computational and space overhead. Our motivating application for ZKPDL has been the efficient implementation of electronic cash. As such, we have used our language to develop a cryptographic library, Cashlib, that provides an interface for using ecash and fair exchange protocols without requiring expert knowledge from the programmer.  "
P4P: Practical Large-Scale Privacy-Preserving Distributed Computation Robust against Malicious Users.," In this paper we introduce a framework for privacy preserving distributed computation that is practical for many real-world applications. The framework is called Peers for Privacy (P4P) and features a novel heterogeneous architecture and a number of efficient tools for performing private computation and ensuring security at large scale. It maintains the following properties: (1) Provably strong privacy; (2) Adequate efficiency at reasonably large scale; and (3) Robustness against realistic adversaries. The framework gains its practicality by decomposing data mining algorithms into a sequence of vector addition steps that can be privately evaluated using a new verifiable secret sharing (VSS) scheme over small field (e.g., 32 or 64 bits), which has the same cost as regular, non-private arithmetic. This paradigm supports a large number of statistical learning algorithms including SVD, PCA, k-means, ID3, EM-based machine learning algorithms, etc., and all algorithms in the statistical query model [36]. As a concrete example, we show how singular value decomposition (SVD), which is an extremely useful algorithm and the core of many data mining tasks, can be done efficiently with privacy in P4P. Using real-world data and actual implementation we demonstrate that P4P is orders of magnitude faster than existing solutions.  "
SEPIA: Privacy-Preserving Aggregation of Multi-Domain Network Events and Statistics.," Secure multiparty computation (MPC) allows joint privacy-preserving computations on data of multiple parties. Although MPC has been studied substantially, building solutions that are practical in terms of computation and communication cost is still a major challenge. In this paper, we investigate the practical usefulness of MPC for multi-domain network security and monitoring. We first optimize MPC comparison operations for processing high volume data in near real-time. We then design privacy-preserving protocols for event correlation and aggregation of network traffic statistics, such as addition of volume metrics, computation of feature entropy, and distinct item count. Optimizing performance of parallel invocations, we implement our protocols along with a complete set of basic operations in a library called SEPIA. We evaluate the running time and bandwidth requirements of our protocols in realistic settings on a local cluster as well as on PlanetLab and show that they work in near real-time for up to 140 input providers and 9 computation nodes. Compared to implementations using existing general-purpose MPC frameworks, our protocols are significantly faster, requiring, for example, 3 minutes for a task that takes 2 days with general-purpose frameworks. This improvement paves the way for new applications of MPC in the area of networking. Finally, we run SEPIA’s protocols on real traffic traces of 17 networks and show how they provide new possibilities for distributed troubleshooting and early anomaly detection.  "
"Dude, Where's That IP? Circumventing Measurement-based IP Geolocation."," Many applications of IP geolocation can benefit from geolocation that is robust to adversarial clients. These include applications that limit access to online content to a specific geographic region and cloud computing, where some organizations must ensure their virtual machines stay in an appropriate geographic region. This paper studies the applicability of current IP geolocation techniques against an adversary who tries to subvert the techniques into returning a forged result. We propose and evaluate attacks on both delay-based IP geolocation techniques and more advanced topology-aware techniques. Against delay-based techniques, we find that the adversary has a clear trade-off between the accuracy and the detectability of an attack. In contrast, we observe that more sophisticated topology-aware techniques actually fare worse against an adversary because they give the adversary more inputs to manipulate through their use of topology and delay information.  "
Building a Dynamic Reputation System for DNS.," The Domain Name System (DNS) is an essential protocol used by both legitimate Internet applications and cyber attacks. For example, botnets rely on DNS to support agile command and control infrastructures. An effective way to disrupt these attacks is to place malicious domains on a “blocklist” (or “blacklist”) or to add a filtering rule in a firewall or network intrusion detection system. To evade such security countermeasures, attackers have used DNS agility, e.g., by using new domains daily to evade static blacklists and firewalls. In this paper we propose Notos, a dynamic reputation system for DNS. The premise of this system is that malicious, agile use of DNS has unique characteristics and can be distinguished from legitimate, professionally provisioned DNS services. Notos uses passive DNS query data and analyzes the network and zone features of domains. It builds models of known legitimate domains and malicious domains, and uses these models to compute a reputation score for a new domain indicative of whether the domain is malicious or legitimate. We have evaluated Notos in a large ISP’s network with DNS traffic from 1.4 million users. Our results show that Notos can identify malicious domains with high accuracy (true positive rate of 96.8%) and low false positive rate (0.38%), and can identify these domains weeks or even months before they appear in public blacklists.  "
Scantegrity II Municipal Election at Takoma Park: The First E2E Binding Governmental Election with Ballot Privacy.,"  On November 3, 2009, voters in Takoma Park, Maryland, cast ballots for the mayor and city council members using the Scantegrity II voting system—the first time any end-to-end (E2E) voting system with ballot privacy has been used in a binding governmental election. This case study describes the various efforts that went into the election—including the improved design and implementation of the voting system, streamlined procedures, agreements with the city, and assessments of the experiences of voters and poll workers. The election, with 1728 voters from six wards, involved paper ballots with invisible-ink confirmation codes, instant-runoff voting with write-ins, early and absentee (mail-in) voting, dual-language ballots, provisional ballots, privacy sleeves, any-which-way scanning with parallel conventional desktop scanners, end-to-end verifiability based on optional web-based voter verification of votes cast, a full hand recount, thresholded authorities, three independent outside auditors, fully-disclosed software, and exit surveys for voters and pollworkers. Despite some glitches, the use of Scantegrity II was a success, demonstrating that E2E cryptographic voting systems can be effectively used and accepted by the general public.  "
Acoustic Side-Channel Attacks on Printers.,"  We examine the problem of acoustic emanations of printers. We present a novel attack that recovers what a dotmatrix printer processing English text is printing based on a record of the sound it makes, if the microphone is close enough to the printer. In our experiments, the attack recovers up to 72 % of printed words, and up to 95 % if we assume contextual knowledge about the text, with a microphone at a distance of 10cm from the printer. After an upfront training phase, the attack is fully automated and uses a combination of machine learning, audio processing, and speech recognition techniques, including spectrum features, Hidden Markov Models and linear classification; moreover, it allows for feedbackbased incremental learning. We evaluate the effectiveness of countermeasures, and we describe how we successfully mounted the attack in-field (with appropriate privacy protections) in a doctor’s practice to recover the content of medical prescriptions.  "
Security and Privacy Vulnerabilities of In-Car Wireless Networks: A Tire Pressure Monitoring System Case Study.," Wireless networks are being integrated into the modern automobile. The security and privacy implications of such in-car networks, however, have are not well understood as their transmissions propagate beyond the confines of a car’s body. To understand the risks associated with these wireless systems, this paper presents a privacy and security evaluation of wireless Tire Pressure Monitoring Systems using both laboratory experiments with isolated tire pressure sensor modules and experiments with a complete vehicle system. We show that eavesdropping is easily possible at a distance of roughly 40m from a passing vehicle. Further, reverse-engineering of the underlying protocols revealed static 32 bit identifiers and that messages can be easily triggered remotely, which raises privacy concerns as vehicles can be tracked through these identifiers. Further, current protocols do not employ authentication and vehicle implementations do not perform basic input validation, thereby allowing for remote spoofing of sensor messages. We validated this experimentally by triggering tire pressure warning messages in a moving vehicle from a customized software radio attack platform located in a nearby vehicle. Finally, the paper concludes with a set of recommendations for improving the privacy and security of tire pressure monitoring systems and other forthcoming in-car wireless sensor networks.  "
VEX: Vetting Browser Extensions for Security Vulnerabilities.," The browser has become the de facto platform for everyday computation. Among the many potential attacks that target or exploit browsers, vulnerabilities in browser extensions have received relatively little attention. Currently, extensions are vetted by manual inspection, which does not scale well and is subject to human error. In this paper, we present V EX, a framework for highlighting potential security vulnerabilities in browser extensions by applying static information-flow analysis to the JavaScript code used to implement extensions. We describe several patterns of flows as well as unsafe programming practices that may lead to privilege escalations in Firefox extensions. V EX analyzes Firefox extensions for such flow patterns using high-precision, context-sensitive, flow-sensitive static analysis. We analyze thousands of browser extensions, and V EX finds six exploitable vulnerabilities, three of which were previously unknown. V EX also finds hundreds of examples of bad programming practices that may lead to security vulnerabilities. We show that compared to current Mozilla extension review tools, V EX greatly reduces the human burden for manually vetting extensions when looking for key types of dangerous flows.  "
