,0
Securing Script-Based Extensibility in Web Browsers.," Web browsers are increasingly designed to be extensible to keep up with the Web’s rapid pace of change. This extensibility is typically implemented using script-based extensions. Script extensions have access to sensitive browser APIs and content from untrusted web pages. Unfortunately, this powerful combination creates the threat of privilege escalation attacks that grant web page scripts the full privileges of extensions and control over the entire browser process. This paper makes two contributions. First, it describes the pitfalls of script-based extensibility based on our study of the Firefox web browser. We find that script-based extensions can lead to arbitrary code injection and execution control, the same types of vulnerabilities found in unsafe code. Second, we propose a taint-based system to track the spread of untrusted data in the browser and to detect the characteristic signatures of privilege escalation attacks. We evaluate this approach by using exploits from the Firefox bug database and show that our system detects the vast majority of attacks with almost no false alarms.  "
AdJail: Practical Enforcement of Confidentiality and Integrity Policies on Web Advertisements.," Web publishers frequently integrate third-party advertisements into web pages that also contain sensitive publisher data and end-user personal data. This practice exposes sensitive page content to confidentiality and integrity attacks launched by advertisements. In this paper, we propose a novel framework for addressing security threats posed by third-party advertisements. The heart of our framework is an innovative isolation mechanism that enables publishers to transparently interpose between advertisements and end users. The mechanism supports finegrained policy specification and enforcement, and does not affect the user experience of interactive ads. Evaluation of our framework suggests compatibility with several mainstream ad networks, security from many threats from advertisements and acceptable performance overheads.  "
Realization of RF Distance Bounding.,"  One of the main obstacles for the wider deployment of radio (RF) distance bounding is the lack of platforms that implement these protocols. We address this problem and we build a prototype system that demonstrates that radio distance bounding protocols can be implemented to match the strict processing that these protocols require. Our system implements a prover that is able to receive, process and transmit signals in less than 1ns. The security guarantee that a distance bounding protocol built on top of this system therefore provides is that a malicious prover can, at most, pretend to be about 15cm closer to the verifier than it really is. To enable such fast processing at the prover, we use specially implemented concatenation as the prover’s processing function and show how it can be integrated into a distance bounding protocol. Finally, we show that functions such as XOR and the comparison function, that were used in a number of previously proposed distance bounding protocols, are not best suited for the implementation of radio distance bounding.  "
The Case for Ubiquitous Transport-Level Encryption.," Today, Internet traffic is encrypted only when deemed necessary. Yet modern CPUs could feasibly encrypt most traffic. Moreover, the cost of doing so will only drop over time. Tcpcrypt is a TCP extension designed to make end-to-end encryption of TCP traffic the default, not the exception. To facilitate adoption tcpcrypt provides backwards compatibility with legacy TCP stacks and middleboxes. Because it is implemented in the transport layer, it protects legacy applications. However, it also provides a hook for integration with application-layer authentication, largely obviating the need for applications to encrypt their own network traffic and minimizing the need for duplication of functionality. Finally, tcpcrypt minimizes the cost of key negotiation on servers; a server using tcpcrypt can accept connections at 36 times the rate achieved using SSL.  "
Automatic Generation of Remediation Procedures for Malware Infections.,"  Despite the widespread deployment of malware detection software, in many situations it is difficult to preemptively block a malicious program from infecting a system. Rather, signatures for detection are usually available only after malware have started to infect a large group of systems. Ideally, infected systems should be reinstalled from scratch. However, due to the high cost of reinstallation, users may prefer to rely on the remediation capabilities of malware detectors to revert the effects of an infection. Unfortunately, current malware detectors perform this task poorly, leaving users’ systems in an unsafe or unstable state. This paper presents an architecture to automatically generate remediation procedures from malicious programs—procedures that can be used to remediate all and only the effects of the malware’s execution in any infected system. We have implemented a prototype of this architecture and used it to generate remediation procedures for a corpus of more than 200 malware binaries. Our evaluation demonstrates that the algorithm outperforms the remediation capabilities of top-rated commercial malware detectors.  "
Re: CAPTCHAs-Understanding CAPTCHA-Solving Services in an Economic Context.," Reverse Turing tests, or CAPTCHAs, have become an ubiquitous defense used to protect open Web resources from being exploited at scale. An effective CAPTCHA resists existing mechanistic software solving, yet can be solved with high probability by a human being. In response, a robust solving ecosystem has emerged, reselling both automated solving technology and realtime human labor to bypass these protections. Thus, CAPTCHA s can increasingly be understood and evaluated in purely economic terms; the market price of a solution vs the monetizable value of the asset being protected. We examine the market-side of this question in depth, analyzing the behavior and dynamics of CAPTCHA-solving service providers, their price performance, and the underlying labor markets driving this economy.  "
Chipping Away at Censorship Firewalls with User-Generated Content.," Oppressive regimes and even democratic governments restrict Internet access. Existing anti-censorship systems often require users to connect through proxies, but these systems are relatively easy for a censor to discover and block. This paper offers a possible next step in the censorship arms race: rather than relying on a single system or set of proxies to circumvent censorship firewalls, we explore whether the vast deployment of sites that host user-generated content can breach these firewalls. To explore this possibility, we have developed Collage, which allows users to exchange messages through hidden channels in sites that host user-generated content. Collage has two components: a message vector layer for embedding content in cover traffic; and a rendezvous mechanism to allow parties to publish and retrieve messages in the cover traffic. Collage uses user-generated content (e.g., photo-sharing sites) as “drop sites” for hidden messages. To send a message, a user embeds it into cover traffic and posts the content on some site, where receivers retrieve this content using a sequence of tasks. Collage makes it difficult for a censor to monitor or block these messages by exploiting the sheer number of sites where users can exchange messages and the variety of ways that a message can be hidden. Our evaluation of Collage shows that the performance overhead is acceptable for sending small messages (e.g., Web articles, email). We show how Collage can be used to build two applications: a direct messaging application, and a Web content delivery system.  "
Fighting Coercion Attacks in Key Generation using Skin Conductance.," Many techniques have been proposed to generate keys including text passwords, graphical passwords, biometric data and etc. Most of these techniques are not resistant to coercion attacks in which the user is forcefully asked by an attacker to generate the key to gain access to the system or to decrypt the encrypted file. We present a novel approach in generating cryptographic keys to fight against coercion attacks. Our novel technique incorporates the user’s emotional status, which changes when the user is under coercion, into the key generation through measurements of the user’s skin conductance. We present a model that generates cryptographic keys with one’s voice and skin conductance. In order to explore more, a preliminary user study with 39 subjects was done which shows that our approach has moderate falsepositive and false-negative rates. We also present the attacker’s strategy in guessing the cryptographic keys, and show that the resulting change in the password space under such attacks is small.  "
