,0
"Detection, Alert and Response to Malicious Behavior in Mobile Devices: Knowledge-Based Approach","In this research, we evaluate a knowledge-based approach for detecting instances of known classes of mobile devices malware based on their temporal behavior. The framework relies on lightweight agent that continuously monitors time-stamped security data within the mobile device and then processes the data using a light version of the Knowledge-Based Temporal Abstraction (KBTA) methodology. The new approach was applied for detecting malware on Google Android powered-devices. Evaluation results demonstrated the effectiveness of the proposed approach."
Autonomic Intrusion Detection System,"We propose a novel framework of autonomic intrusion detection that fulfills online and adaptive intrusion detection in unlabeled audit data streams. The framework owns ability of self-managing: self-labeling, self-updating and self-adapting. Affinity Propagation (AP) uses the framework to learn a subject’s behavior through dynamical clustering of the streaming data. The testing results with a large real HTTP log stream demonstrate the effectiveness and efficiency of the method."
ALICE@home: Distributed Framework for Detecting Malicious Sites,"Malware silently infects millions of systems every year through drive-by downloads, i.e., client-side exploits against web browsers or browser helper objects that are triggered when unsuspecting users visit a page containing malicious content. Identifying and blacklisting websites that distribute malicious content or redirect to a distributing page is an important part of our defense strategy against such attacks. However, building such lists is fraught with challenges of scale, timeliness and deception due to evasive strategies employed by adversaries. In this work, we describe alice@home, a distributed approach to overcoming these challenges and actively identifying malware distribution sites."
Packet Space Analysis of Intrusion Detection Signatures,"It is often the case that more than one signature is triggered on a given group of packets, depending on the signature database used by the IDS. For performance reasons, network IDSs often impose an alert limit (i.e., they restrict) on the number of signatures that can be triggered on a given group of packets. Thus, it is possible that some signatures that should be triggered to properly identify attacks are not verified by the IDS and lead to an IDS Evasion attack. In this poster, we introduce the concept of packet space analysis as a solution to address these problems."
Traffic Behaviour Characterization Using NetMate,"Previous studies have shown the feasibility of deriving simple indicators of file transfers, human-interactivity, and other important behavioural characteristics. We are proposing a practical implementation and use of such indicators with NetMate. In its current state as a work in progress, our extended version of NetMate will already be of interest to network security practitioners conducting incident analysis. The tool can be used to post-process traffic traces containing suspicious flows in order to obtain a behavioural description of the incident and surrounding traffic activities. With further development, the approach has great potential for other use cases such as intrusion detection, insider threat detection, and traffic classification."
On the Inefficient Use of Entropy for Anomaly Detection,"Entropy-based measures have been widely deployed in anomaly detection systems (ADSes) to quantify behavioral patterns. The entropy measure has shown significant promise in detecting diverse set of anomalies present in networks and end-hosts. We argue that the full potential of entropy-based anomaly detection is currently not being exploited because of its inefficient use. In support of this argument, we highlight three important shortcomings of existing entropy-based ADSes. We then propose efficient entropy usage – supported by preliminary evaluations – to mitigate these shortcomings."
Browser-Based Intrusion Prevention System,"This work proposes a novel intrusion prevention technique that leverages information located in the browser in order to mitigate client-side web attacks such as login cross-site request forgery, session hijacking, etc. The browser intrusion prevention system enforces a new fine-grained policy, which complements the same-origin policy, that restricts interaction between authenticated and unauthenticated regions of a page or its associated stored data objects. The browser intrusion prevention system monitors page interactions that occur through script processing or URL fetches. The outcome of this technique is a system that can prevent attacks that are perpetuated by exploiting a user’s browser into making malicious request."
Using Formal Grammar and Genetic Operators to Evolve Malware,"In this paper, we leverage the concepts of formal grammar and genetic operators to evolve malware. As a case study, we take COM infectors and design their formal grammar with production rules in the BNF form. The chromosome (abstract representation) of an infector consists of genes (production rules). The code generator uses these production rules to derive the source code. The standard genetic operators – crossover and mutation – are applied to evolve population. The results of our experiments show that the evolved population contains a significant proportion of valid COM infectors. Moreover, approximately 7% of the evolved malware evade detection by COTS anti-virus software."
Method for Detecting Unknown Malicious Executables,"We present a method for detecting new malicious executables, which comprises the steps of: (a) in a training phase, finding a collection of system call sequences that are characteristic only to malicious files, and storing said sequences in a database; (b) in a runtime phase, for each running executable, continuously monitoring its issued run-time system calls and comparing with the stored sequences within the database, and when a match is found, declaring said executable as malicious."
Brave New World: Pervasive Insecurity of Embedded Network Devices,"Embedded network devices have become an ubiquitous fixture in the modern home, office as well as in the global communication infrastructure. Devices like routers, NAS appliances, home entertainment appliances, wifi access points, web cams, VoIP appliances, print servers and video conferencing units reside on the same networks as our personal computers and enterprise servers and together form our world-wide communication infrastructure. Widely deployed and often misconfigured, they constitute highly attractive targets for exploitation. In this study we present the results of a vulnerability assessment of embedded network devices within the world’s largest ISPs and civilian networks, spanning North America, Europe and Asia. The observed data confirms the intuition that these devices are indeed vulnerable to trivial attacks and that such devices can be found throughout the world in large numbers."
DAEDALUS: Novel Application of Large-Scale Darknet Monitoring for Practical Protection of Live Networks,"Large-scale darknet monitoring is an effective approach to grasp a global trend of malicious activities on the Internet, such as the world-wide spread of malwares. There, however, have been a gap between the darknet monitoring and actual security operations on live networks, namely the global trend has less direct contribution to protect the live networks. Therefore, we propose a novel application of large-scale darknet monitoring that significantly contributes to the security of live networks. In contrast to the conventional method, wherein the packets received from the outside are observed, we employ a large-scale distributed darknet that consists of several organizations that mutually observe the malicious packets transmitted from the inside of the organizations. Based on this approach, we have developed an alert system called DAEDALUS (direct alert environment for darknet and livenet unified security). We present the primary experimental results obtained from the actual deployment of DAEDALUS."
