,0
SoK: Secure Data Deletion - IEEE Conference Publication,"Secure data deletion is the task of deleting data irrecoverably from a physical medium. In the digital world, data is not securely deleted by default; instead, many approaches add secure deletion to existing physical medium interfaces. Interfaces to the physical medium exist at different layers, such as user-level applications, the file system, the device driver, etc. Depending on which interface is used, the properties of an approach can differ significantly. In this paper, we survey the related work in detail and organize existing approaches in terms of their interfaces to physical media. We further present a taxonomy of adversaries differing in their capabilities as well as a systematization for the characteristics of secure deletion approaches. Characteristics include environmental assumptions, such as how the interface's use affects the physical medium, as well as behavioural properties of the approach such as the deletion latency and physical wear. We perform experiments to test a selection of approaches on a variety of file systems and analyze the assumptions made in practice."
Anon-Pass: Practical Anonymous Subscriptions - IEEE Conference Publication,"We present the design, security proof, and implementation of an anonymous subscription service. Users register for the service by providing some form of identity, which might or might not be linked to a real-world identity such as a credit card, a web login, or a public key. A user logs on to the system by presenting a credential derived from information received at registration. Each credential allows only a single login in any authentication window, or epoch. Logins are anonymous in the sense that the service cannot distinguish which user is logging in any better than random guessing. This implies unlinkability of a user across different logins. We find that a central tension in an anonymous subscription service is the service provider's desire for a long epoch (to reduce server-side computation) versus users' desire for a short epoch (so they can repeatedly \""re-anonymize\"" their sessions). We balance this tension by having short epochs, but adding an efficient operation for clients who do not need unlinkability to cheaply re-authenticate themselves for the next time period. We measure performance of a research prototype of our protocol that allows an independent service to offer anonymous access to existing services. We implement a music service, an Android-based subway-pass application, and a web proxy, and show that adding anonymity adds minimal client latency and only requires 33 KB of server memory per active user."
Privacy-Preserving Ridge Regression on Hundreds of Millions of Records - IEEE Conference Publication,"Ridge regression is an algorithm that takes as input a large number of data points and finds the best-fit linear curve through these points. The algorithm is a building block for many machine-learning operations. We present a system for privacy-preserving ridge regression. The system outputs the best-fit curve in the clear, but exposes no other information about the input data. Our approach combines both homomorphic encryption and Yao garbled circuits, where each is used in a different part of the algorithm to obtain the best performance. We implement the complete system and experiment with it on real data-sets, and show that it significantly outperforms pure implementations based only on homomorphic encryption or Yao circuits."
A Scanner Darkly: Protecting User Privacy from Perceptual Applications - IEEE Conference Publication,"Perceptual, \""context-aware\"" applications that observe their environment and interact with users via cameras and other sensors are becoming ubiquitous on personal computers, mobile phones, gaming platforms, household robots, and augmented-reality devices. This raises new privacy risks. We describe the design and implementation of DARKLY, a practical privacy protection system for the increasingly common scenario where an untrusted, third-party perceptual application is running on a trusted device. DARKLY is integrated with OpenCV, a popular computer vision library used by such applications to access visual inputs. It deploys multiple privacy protection mechanisms, including access control, algorithmic privacy transforms, and user audit. We evaluate DARKLY on 20 perceptual applications that perform diverse tasks such as image recognition, object tracking, security surveillance, and face detection. These applications run on DARKLY unmodified or with very few modifications and minimal performance overheads vs. native OpenCV. In most cases, privacy enforcement does not reduce the applications' functionality or accuracy. For the rest, we quantify the tradeoff between privacy and utility and demonstrate that utility remains acceptable even with strong privacy protection."
Caveat Coercitor: Coercion-Evidence in Electronic Voting - IEEE Conference Publication,"The balance between coercion-resistance, election verifiability and usability remains unresolved in remote electronic voting despite significant research over the last few years. We propose a change of perspective, replacing the requirement of coercion-resistance with a new requirement of coercion-evidence: there should be public evidence of the amount of coercion that has taken place during a particular execution of the voting system. We provide a formal definition of coercion-evidence that has two parts. Firstly, there should be a coercion-evidence test that can be performed against the bulletin board to accurately determine the degree of coercion that has taken place in any given run. Secondly, we require coercer independence, that is the ability of the voter to follow the protocol without being detected by the coercer. To show how coercion-evidence can be achieved, we propose a new remote voting scheme, Caveat Coercitor, and we prove that it satisfies coercion-evidence. Moreover, Caveat Coercitor makes weaker trust assumptions than other remote voting systems, such as JCJ/Civitas and Helios, and has better usability properties."
SoK: The Evolution of Sybil Defense via Social Networks - IEEE Conference Publication,"Sybil attacks in which an adversary forges a potentially unbounded number of identities are a danger to distributed systems and online social networks. The goal of sybil defense is to accurately identify sybil identities. This paper surveys the evolution of sybil defense protocols that leverage the structural properties of the social graph underlying a distributed system to identify sybil identities. We make two main contributions. First, we clarify the deep connection between sybil defense and the theory of random walks. This leads us to identify a community detection algorithm that, for the first time, offers provable guarantees in the context of sybil defense. Second, we advocate a new goal for sybil defense that addresses the more limited, but practically useful, goal of securely white-listing a local region of the graph."
Zerocoin: Anonymous Distributed E-Cash from Bitcoin - IEEE Conference Publication,"Bitcoin is the first e-cash system to see widespread adoption. While Bitcoin offers the potential for new types of financial interaction, it has significant limitations regarding privacy. Specifically, because the Bitcoin transaction log is completely public, users' privacy is protected only through the use of pseudonyms. In this paper we propose Zerocoin, a cryptographic extension to Bitcoin that augments the protocol to allow for fully anonymous currency transactions. Our system uses standard cryptographic assumptions and does not introduce new trusted parties or otherwise change the security model of Bitcoin. We detail Zerocoin's cryptographic construction, its integration into Bitcoin, and examine its performance both in terms of computation and impact on the Bitcoin protocol."
seL4: From General Purpose to a Proof of Information Flow Enforcement - IEEE Conference Publication,"In contrast to testing, mathematical reasoning and formal verification can show the absence of whole classes of security vulnerabilities. We present the, to our knowledge, first complete, formal, machine-checked verification of information flow security for the implementation of a general-purpose microkernel; namely seL4. Unlike previous proofs of information flow security for operating system kernels, ours applies to the actual 8, 830 lines of C code that implement seL4, and so rules out the possibility of invalidation by implementation errors in this code. We assume correctness of compiler, assembly code, hardware, and boot code. We prove everything else. This proof is strong evidence of seL4's utility as a separation kernel, and describes precisely how the general purpose kernel should be configured to enforce isolation and mandatory information flow control. We describe the information flow security statement we proved (a variant of intransitive noninterference), including the assumptions on which it rests, as well as the modifications that had to be made to seL4 to ensure it was enforced. We discuss the practical limitations and implications of this result, including covert channels not covered by the formal proof."
"Design, Implementation and Verification of an eXtensible and Modular Hypervisor Framework - IEEE Conference Publication","We present the design, implementation, and verification of XMHF- an eXtensible and Modular Hypervisor Framework. XMHF is designed to achieve three goals -- modular extensibility, automated verification, and high performance. XMHF includes a core that provides functionality common to many hypervisor-based security architectures and supports extensions that augment the core with additional security or functional properties while preserving the fundamental hypervisor security property of memory integrity (i.e., ensuring that the hypervisor's memory is not modified by software running at a lower privilege level). We verify the memory integrity of the XMHF core -- 6018 lines of code -- using a combination of automated and manual techniques. The model checker CBMC automatically verifies 5208 lines of C code in about 80 seconds using less than 2GB of RAM. We manually audit the remaining 422 lines of C code and 388 lines of assembly language code that are stable and unlikely to change as development proceeds. Our experiments indicate that XMHF's performance is comparable to popular high-performance general-purpose hypervisors for the single guest that it supports."
Implementing TLS with Verified Cryptographic Security - IEEE Conference Publication,"TLS is possibly the most used protocol for secure communications, with a 18-year history of flaws and fixes, ranging from its protocol logic to its cryptographic design, and from the Internet standard to its diverse implementations. We develop a verified reference implementation of TLS 1.2. Our code fully supports its wire formats, ciphersuites, sessions and connections, re-handshakes and resumptions, alerts and errors, and data fragmentation, as prescribed in the RFCs; it interoperates with mainstream web browsers and servers. At the same time, our code is carefully structured to enable its modular, automated verification, from its main API down to computational assumptions on its cryptographic algorithms. Our implementation is written in F# and specified in F7. We present security specifications for its main components, such as authenticated stream encryption for the record layer and key establishment for the handshake. We describe their verification using the F7 typechecker. To this end, we equip each cryptographic primitive and construction of TLS with a new typed interface that captures its security properties, and we gradually replace concrete implementations with ideal functionalities. We finally typecheck the protocol state machine, and obtain precise security theorems for TLS, as it is implemented and deployed. We also revisit classic attacks and report a few new ones."
An Ideal-Security Protocol for Order-Preserving Encoding - IEEE Conference Publication,"Order-preserving encryption - an encryption scheme where the sort order of ciphertexts matches the sort order of the corresponding plaintexts - allows databases and other applications to process queries involving order over encrypted data efficiently. The ideal security guarantee for order-preserving encryption put forth in the literature is for the ciphertexts to reveal no information about the plaintexts besides order. Even though more than a dozen schemes were proposed, all these schemes leak more information than order. This paper presents the first order-preserving scheme that achieves ideal security. Our main technique is mutable ciphertexts, meaning that over time, the ciphertexts for a small number of plaintext values change, and we prove that mutable ciphertexts are needed for ideal security. Our resulting protocol is interactive, with a small number of interactions. We implemented our scheme and evaluated it on microbenchmarks and in the context of an encrypted MySQL database application. We show that in addition to providing ideal security, our scheme achieves 1 - 2 orders of magnitude higher performance than the state-of-the-art order-preserving encryption scheme, which is less secure than our scheme."
Efficient Garbling from a Fixed-Key Blockcipher - IEEE Conference Publication,"We advocate schemes based on fixed-key AES as the best route to highly efficient circuit-garbling. We provide such schemes making only one AES call per garbled-gate evaluation. On the theoretical side, we justify the security of these methods in the random-permutation model, where parties have access to a public random permutation. On the practical side, we provide the Just Garble system, which implements our schemes. Just Garble evaluates moderate-sized garbled-circuits at an amortized cost of 23.2 cycles per gate (7.25 nsec), far faster than any prior reported results."
Circuit Structures for Improving Efficiency of Security and Privacy Tools - IEEE Conference Publication,"Several techniques in computer security, including generic protocols for secure computation and symbolic execution, depend on implementing algorithms in static circuits. Despite substantial improvements in recent years, tools built using these techniques remain too slow for most practical uses. They require transforming arbitrary programs into either Boolean logic circuits, constraint sets on Boolean variables, or other equivalent representations, and the costs of using these tools scale directly with the size of the input circuit. Hence, techniques for more efficient circuit constructions have benefits across these tools. We show efficient circuit constructions for various simple but commonly used data structures including stacks, queues, and associative maps. While current practice requires effectively copying the entire structure for each operation, our techniques take advantage of locality and batching to provide amortized costs that scale polylogarithmically in the size of the structure. We demonstrate how many common array usage patterns can be significantly improved with the help of these circuit structures. We report on experiments using our circuit structures for both generic secure computation using garbled circuits and automated test input generation using symbolic execution, and demonstrate order of magnitude improvements for both applications."
SoK: SSL and HTTPS: Revisiting Past Challenges and Evaluating Certificate Trust Model Enhancements - IEEE Conference Publication,"Internet users today depend daily on HTTPS for secure communication with sites they intend to visit. Over the years, many attacks on HTTPS and the certificate trust model it uses have been hypothesized, executed, and/or evolved. Meanwhile the number of browser-trusted (and thus, de facto, user-trusted) certificate authorities has proliferated, while the due diligence in baseline certificate issuance has declined. We survey and categorize prominent security issues with HTTPS and provide a systematic treatment of the history and on-going challenges, intending to provide context for future directions. We also provide a comparative evaluation of current proposals for enhancing the certificate infrastructure used in practice."
Lucky Thirteen: Breaking the TLS and DTLS Record Protocols - IEEE Conference Publication,"The Transport Layer Security (TLS) protocol aims to provide confidentiality and integrity of data in transit across untrusted networks. TLS has become the de facto secure protocol of choice for Internet and mobile applications. DTLS is a variant of TLS that is growing in importance. In this paper, we present distinguishing and plaintext recovery attacks against TLS and DTLS. The attacks are based on a delicate timing analysis of decryption processing in the two protocols. We include experimental results demonstrating the feasibility of the attacks in realistic network environments for several different implementations of TLS and DTLS, including the leading OpenSSL implementations. We provide countermeasures for the attacks. Finally, we discuss the wider implications of our attacks for the cryptographic design used by TLS and DTLS."
Cookieless Monster: Exploring the Ecosystem of Web-Based Device Fingerprinting - IEEE Conference Publication,"The web has become an essential part of our society and is currently the main medium of information delivery. Billions of users browse the web on a daily basis, and there are single websites that have reached over one billion user accounts. In this environment, the ability to track users and their online habits can be very lucrative for advertising companies, yet very intrusive for the privacy of users. In this paper, we examine how web-based device fingerprinting currently works on the Internet. By analyzing the code of three popular browser-fingerprinting code providers, we reveal the techniques that allow websites to track users without the need of client-side identifiers. Among these techniques, we show how current commercial fingerprinting approaches use questionable practices, such as the circumvention of HTTP proxies to discover a user's real IP address and the installation of intrusive browser plugins. At the same time, we show how fragile the browser ecosystem is against fingerprinting through the use of novel browser-identifying techniques. With so many different vendors involved in browser development, we demonstrate how one can use diversions in the browsers' implementation to distinguish successfully not only the browser-family, but also specific major and minor versions. Browser extensions that help users spoof the user-agent of their browsers are also evaluated. We show that current commercial approaches can bypass the extensions, and, in addition, take advantage of their shortcomings by using them as additional fingerprinting features."
Practical Control Flow Integrity and Randomization for Binary Executables - IEEE Conference Publication,"Control Flow Integrity (CFI) provides a strong protection against modern control-flow hijacking attacks. However, performance and compatibility issues limit its adoption. We propose a new practical and realistic protection method called CCFIR (Compact Control Flow Integrity and Randomization), which addresses the main barriers to CFI adoption. CCFIR collects all legal targets of indirect control-transfer instructions, puts them into a dedicated \""Springboard section\"" in a random order, and then limits indirect transfers to flow only to them. Using the Springboard section for targets, CCFIR can validate a target more simply and faster than traditional CFI, and provide support for on-site target-randomization as well as better compatibility. Based on these approaches, CCFIR can stop control-flow hijacking attacks including ROP and return-into-libc. Results show that ROP gadgets are all eliminated. We observe that with the wide deployment of ASLR, Windows/x86 PE executables contain enough information in relocation tables which CCFIR can use to find all legal instructions and jump targets reliably, without source code or symbol information. We evaluate our prototype implementation on common web browsers and the SPEC CPU2000 suite: CCFIR protects large applications such as GCC and Firefox completely automatically, and has low performance overhead of about 3.6%/8.6% (average/max) using SPECint2000. Experiments on real-world exploits also show that CCFIR-hardened versions of IE6, Firefox 3.6 and other applications are protected effectively."
Just-In-Time Code Reuse: On the Effectiveness of Fine-Grained Address Space Layout Randomization - IEEE Conference Publication,"Fine-grained address space layout randomization (ASLR) has recently been proposed as a method of efficiently mitigating runtime attacks. In this paper, we introduce the design and implementation of a framework based on a novel attack strategy, dubbed just-in-time code reuse, that undermines the benefits of fine-grained ASLR. Specifically, we derail the assumptions embodied in fine-grained ASLR by exploiting the ability to repeatedly abuse a memory disclosure to map an application's memory layout on-the-fly, dynamically discover API functions and gadgets, and JIT-compile a target program using those gadgets -- all within a script environment at the time an exploit is launched. We demonstrate the power of our framework by using it in conjunction with a real-world exploit against Internet Explorer, and also provide extensive evaluations that demonstrate the practicality of just-in-time code reuse attacks. Our findings suggest that fine-grained ASLR may not be as promising as first thought."
Welcome to the Entropics: Boot-Time Entropy in Embedded Devices - IEEE Conference Publication,"We present three techniques for extracting entropy during boot on embedded devices. Our first technique times the execution of code blocks early in the Linux kernel boot process. It is simple to implement and has a negligible runtime overhead, but, on many of the devices we test, gathers hundreds of bits of entropy. Our second and third techniques, which run in the bootloader, use hardware features - DRAM decay behavior and PLL locking latency, respectively -- and are therefore less portable and less generally applicable, but their behavior is easier to explain based on physically unpredictable processes. We implement and measure the effectiveness of our techniques on ARM-, MIPS-, and AVR32-based systems-on-a-chip from a variety of vendors."
