,0
All Your IFCException Are Belong to Us - IEEE Conference Publication,"Existing designs for fine-grained, dynamic information-flow control assume that it is acceptable to terminate the entire system when an incorrect flow is detected-i.e, they give up availability for the sake of confidentiality and integrity. This is an unrealistic limitation for systems such as long-running servers. We identify public labels and delayed exceptions as crucial ingredients for making information-flow errors recoverable in a sound and usable language, and we propose two new error-handling mechanisms that make all errors recoverable. The first mechanism builds directly on these basic ingredients, using not-a-values (NaVs) and data flow to propagate errors. The second mechanism adapts the standard exception model to satisfy the extra constraints arising from information flow control, converting thrown exceptions to delayed ones at certain points. We prove that both mechanisms enjoy the fundamental soundness property of non-interference. Finally, we describe a prototype implementation of a full-scale language with NaVs and report on our experience building robust software components in this setting."
"Declarative, Temporal, and Practical Programming with Capabilities - IEEE Conference Publication","New operating systems, such as the Capsicum capability system, allow a programmer to write an application that satisfies strong security properties by invoking security-specific system calls at a few key points in the program. However, rewriting an application to invoke such system calls correctly is an error-prone process: even the Capsicum developers have reported difficulties in rewriting programs to correctly invoke system calls. This paper describes capweave, a tool that takes as input (i) an LLVM program, and (ii) a declarative policy of the possibly-changing capabilities that a program must hold during its execution, and rewrites the program to use Capsicum system calls to enforce the policy. Our experiments demonstrate that capweave can be applied to rewrite security-critical UNIX utilities to satisfy practical security policies. capweave itself works quickly, and the runtime overhead incurred in the programs that capweave produces is generally low for practical workloads."
Towards Practical Reactive Security Audit Using Extended Static Checkers - IEEE Conference Publication,"This paper describes our experience of performing reactive security audit of known security vulnerabilities in core operating system and browser COM components, using an extended static checker HAVOCLITE. We describe the extensions made to the tool to be applicable on such large C++ components, along with our experience of using an extended static checker in the large. We argue that the use of such checkers as a configurable static analysis in the hands of security auditors can be an effective tool for finding variations of known vulnerabilities. The effort has led to finding and fixing around 70 previously unknown security vulnerabilities in over 10 millions lines operating system and browser code."
SoK: Eternal War in Memory - IEEE Conference Publication,"Memory corruption bugs in software written in low-level languages like C or C++ are one of the oldest problems in computer security. The lack of safety in these languages allows attackers to alter the program's behavior or take full control over it by hijacking its control flow. This problem has existed for more than 30 years and a vast number of potential solutions have been proposed, yet memory corruption attacks continue to pose a serious threat. Real world exploits show that all currently deployed protections can be defeated. This paper sheds light on the primary reasons for this by describing attacks that succeed on today's systems. We systematize the current knowledge about various protection techniques by setting up a general model for memory corruption attacks. Using this model we show what policies can stop which attacks. The model identifies weaknesses of currently deployed techniques, as well as other proposed protections enforcing stricter policies. We analyze the reasons why protection mechanisms implementing stricter polices are not deployed. To achieve wide adoption, protection mechanisms must support a multitude of features and must satisfy a host of requirements. Especially important is performance, as experience shows that only solutions whose overhead is in reasonable bounds get deployed. A comparison of different enforceable policies helps designers of new protection mechanisms in finding the balance between effectiveness (security) and efficiency. We identify some open research problems, and provide suggestions on improving the adoption of newer techniques."
The Parrot Is Dead: Observing Unobservable Network Communications - IEEE Conference Publication,"In response to the growing popularity of Tor and other censorship circumvention systems, censors in non-democratic countries have increased their technical capabilities and can now recognize and block network traffic generated by these systems on a nationwide scale. New censorship-resistant communication systems such as Skype Morph, Stego Torus, and Censor Spoofer aim to evade censors' observations by imitating common protocols like Skype and HTTP. We demonstrate that these systems completely fail to achieve unobservability. Even a very weak, local censor can easily distinguish their traffic from the imitated protocols. We show dozens of passive and active methods that recognize even a single imitated session, without any need to correlate multiple network flows or perform sophisticated traffic analysis. We enumerate the requirements that a censorship-resistant system must satisfy to successfully mimic another protocol and conclude that \""unobservability by imitation\"" is a fundamentally flawed approach. We then present our recommendations for the design of unobservable communication systems."
"Trawling for Tor Hidden Services: Detection, Measurement, Deanonymization - IEEE Conference Publication","Tor is the most popular volunteer-based anonymity network consisting of over 3000 volunteer-operated relays. Apart from making connections to servers hard to trace to their origin it can also provide receiver privacy for Internet services through a feature called \""hidden services\"". In this paper we expose flaws both in the design and implementation of Tor's hidden services that allow an attacker to measure the popularity of arbitrary hidden services, take down hidden services and deanonymize hidden services. We give a practical evaluation of our techniques by studying: (1) a recent case of a botnet using Tor hidden services for command and control channels; (2) Silk Road, a hidden service used to sell drugs and other contraband; (3) the hidden service of the DuckDuckGo search engine."
SoK: P2PWNED - Modeling and Evaluating the Resilience of Peer-to-Peer Botnets - IEEE Conference Publication,"Centralized botnets are easy targets for takedown efforts by computer security researchers and law enforcement. Thus, botnet controllers have sought new ways to harden the infrastructures of their botnets. In order to meet this objective, some botnet operators have (re)designed their botnets to use Peer-to-Peer (P2P) infrastructures. Many P2P botnets are far more resilient to takedown attempts than centralized botnets, because they have no single points of failure. However, P2P botnets are subject to unique classes of attacks, such as node enumeration and poisoning. In this paper, we introduce a formal graph model to capture the intrinsic properties and fundamental vulnerabilities of P2P botnets. We apply our model to current P2P botnets to assess their resilience against attacks. We provide assessments on the sizes of all eleven active P2P botnets, showing that some P2P botnet families contain over a million bots. In addition, we have prototyped several mitigation strategies to measure the resilience of existing P2P botnets. We believe that the results from our analysis can be used to assist security researchers in evaluating mitigation strategies against current and future P2P botnets."
Finding the Linchpins of the Dark Web: a Study on Topologically Dedicated Hosts on Malicious Web Infrastructures - IEEE Conference Publication,"Malicious Web activities continue to be a major threat to the safety of online Web users. Despite the plethora forms of attacks and the diversity of their delivery channels, in the back end, they are all orchestrated through malicious Web infrastructures, which enable miscreants to do business with each other and utilize others' resources. Identifying the linchpins of the dark infrastructures and distinguishing those valuable to the adversaries from those disposable are critical for gaining an upper hand in the battle against them. In this paper, using nearly 4 million malicious URL paths crawled from different attack channels, we perform a large-scale study on the topological relations among hosts in the malicious Web infrastructure. Our study reveals the existence of a set of topologically dedicated malicious hosts that play orchestrating roles in malicious activities. They are well connected to other malicious hosts and do not receive traffic from legitimate sites. Motivated by their distinctive features in topology, we develop a graph-based approach that relies on a small set of known malicious hosts as seeds to detect dedicate malicious hosts in a large scale. Our method is general across the use of different types of seed data, and results in an expansion rate of over 12 times in detection with a low false detection rate of 2%. Many of the detected hosts operate as redirectors, in particular Traffic Distribution Systems (TDSes) that are long-lived and receive traffic from new attack campaigns over time. These TDSes play critical roles in managing malicious traffic flows. Detecting and taking down these dedicated malicious hosts can therefore have more impact on the malicious Web infrastructures than aiming at short-lived doorways or exploit sites."
The Crossfire Attack - IEEE Conference Publication,"We present the Crossfire attack -- a powerful attack that degrades and often cuts off network connections to a variety of selected server targets (e.g., servers of an enterprise, a city, a state, or a small country) by flooding only a few network links. In Crossfire, a small set of bots directs low intensity flows to a large number of publicly accessible servers. The concentration of these flows on the small set of carefully chosen links floods these links and effectively disconnects selected target servers from the Internet. The sources of the Crossfire attack are undetectable by any targeted servers, since they no longer receive any messages, and by network routers, since they receive only low-intensity, individual flows that are indistinguishable from legitimate flows. The attack persistence can be extended virtually indefinitely by changing the set of bots, publicly accessible servers, and target links while maintaining the same disconnection targets. We demonstrate the attack feasibility using Internet experiments, show its effects on a variety of chosen targets (e.g., servers of universities, US states, East and West Coasts of the US), and explore several countermeasures."
Ghost Talk: Mitigating EMI Signal Injection Attacks against Analog Sensors - IEEE Conference Publication,"Electromagnetic interference (EMI) affects circuits by inducing voltages on conductors. Analog sensing of signals on the order of a few millivolts is particularly sensitive to interference. This work (1) measures the susceptibility of analog sensor systems to signal injection attacks by intentional, low-power emission of chosen electromagnetic waveforms, and (2) proposes defense mechanisms to reduce the risks. Our experiments use specially crafted EMI at varying power and distance to measure susceptibility of sensors in implantable medical devices and consumer electronics. Results show that at distances of 1-2m, consumer electronic devices containing microphones are vulnerable to the injection of bogus audio signals. Our measurements show that in free air, intentional EMI under 10 W can inhibit pacing and induce defibrillation shocks at distances up to 1-2m on implantable cardiac electronic devices. However, with the sensing leads and medical devices immersed in a saline bath to better approximate the human body, the same experiment decreases to about 5 cm. Our defenses range from prevention with simple analog shielding to detection with a signal contamination metric based on the root mean square of waveform amplitudes. Our contribution to securing cardiac devices includes a novel defense mechanism that probes for forged pacing pulses inconsistent with the refractory period of cardiac tissue."
On Limitations of Friendly Jamming for Confidentiality - IEEE Conference Publication,"Wireless communication provides unique security challenges, but also enables novel ways to defend against attacks. In the past few years, a number of works discussed the use of friendly jamming to protect the confidentiality of the communicated data as well as to enable message authentication and access control. In this work, we analytically and experimentally evaluate the confidentiality that can be achieved by the use of friendly jamming, given an attacker with multiple receiving antennas. We construct a MIMO-based attack that allows the attacker to recover data protected by friendly jamming and refine the conditions for which this attack is most effective. Our attack shows that friendly jamming cannot provide strong confidentiality guarantees in all settings. We further test our attack in a setting where friendly jamming is used to protect the communication to medical implants."
Ally Friendly Jamming: How to Jam Your Enemy and Maintain Your Own Wireless Connectivity at the Same Time - IEEE Conference Publication,"This paper presents a novel mechanism, called Ally Friendly Jamming, which aims at providing an intelligent jamming capability that can disable unauthorized (enemy) wireless communication but at the same time still allow authorized wireless devices to communicate, even if all these devices operate at the same frequency. The basic idea is to jam the wireless channel continuously but properly control the jamming signals with secret keys, so that the jamming signals are unpredictable interference to unauthorized devices, but are recoverable by authorized ones equipped with the secret keys. To achieve the ally friendly jamming capability, we develop new techniques to generate ally jamming signals, to identify and synchronize with multiple ally jammers. This paper also reports the analysis, implementation, and experimental evaluation of ally friendly jamming on a software defined radio platform. Both the analytical and experimental results indicate that the proposed techniques can effectively disable enemy wireless communication and at the same time maintain wireless communication between authorized devices."
Practical Timing Side Channel Attacks against Kernel Space ASLR - IEEE Conference Publication,"Due to the prevalence of control-flow hijacking attacks, a wide variety of defense methods to protect both user space and kernel space code have been developed in the past years. A few examples that have received widespread adoption include stack canaries, non-executable memory, and Address Space Layout Randomization (ASLR). When implemented correctly (i.e., a given system fully supports these protection methods and no information leak exists), the attack surface is significantly reduced and typical exploitation strategies are severely thwarted. All modern desktop and server operating systems support these techniques and ASLR has also been added to different mobile operating systems recently. In this paper, we study the limitations of kernel space ASLR against a local attacker with restricted privileges. We show that an adversary can implement a generic side channel attack against the memory management system to deduce information about the privileged address space layout. Our approach is based on the intrinsic property that the different caches are shared resources on computer systems. We introduce three implementations of our methodology and show that our attacks are feasible on four different x86-based CPUs (both 32- and 64-bit architectures) and also applicable to virtual machines. As a result, we can successfully circumvent kernel space ASLR on current operating systems. Furthermore, we also discuss mitigation strategies against our attacks, and propose and implement a defense solution with negligible performance overhead."
PrivExec: Private Execution as an Operating System Service - IEEE Conference Publication,"Privacy has become an issue of paramount importance for many users. As a result, encryption tools such as True Crypt, OS-based full-disk encryption such as File Vault, and privacy modes in all modern browsers have become popular. However, although such tools are useful, they are not perfect. For example, prior work has shown that browsers still leave many traces of user information on disk even if they are started in private browsing mode. In addition, disk encryption alone is not sufficient, as key disclosure through coercion remains possible. Clearly, it would be useful and highly desirable to have OS-level support that provides strong privacy guarantees for any application -- not only browsers. In this paper, we present the design and implementation of PrivExec, the first operating system service for private execution. PrivExec provides strong, general guarantees of private execution, allowing any application to execute in a mode where storage writes, either to the filesystem or to swap, will not be recoverable by others during or after execution. PrivExec does not require explicit application support, recompilation, or any other preconditions. We have implemented a prototype of PrivExec by extending the Linux kernel that is performant, practical, and that secures sensitive data against disclosure."
A Hybrid Architecture for Interactive Verifiable Computation - IEEE Conference Publication,"We consider interactive, proof-based verifiable computation: how can a client machine specify a computation to a server, receive an answer, and then engage the server in an interactive protocol that convinces the client that the answer is correct, with less work for the client than executing the computation in the first place? Complexity theory and cryptography offer solutions in principle, but if implemented naively, they are ludicrously expensive. Recently, however, several strands of work have refined this theory and implemented the resulting protocols in actual systems. This work is promising but suffers from one of two problems: either it relies on expensive cryptography, or else it applies to a restricted class of computations. Worse, it is not always clear which protocol will perform better for a given problem.We describe a system that (a) extends optimized refinements of the non-cryptographic protocols to a much broader class of computations, (b) uses static analysis to fail over to the cryptographic ones when the non-cryptographic ones would be more expensive, and (c) incorporates this core into a built system that includes a compiler for a high-level language, a distributed server, and GPU acceleration. Experimental results indicate that our system performs better and applies more widely than the best in the literature."
Pinocchio: Nearly Practical Verifiable Computation - IEEE Conference Publication,"To instill greater confidence in computations outsourced to the cloud, clients should be able to verify the correctness of the results returned. To this end, we introduce Pinocchio, a built system for efficiently verifying general computations while relying only on cryptographic assumptions. With Pinocchio, the client creates a public evaluation key to describe her computation; this setup is proportional to evaluating the computation once. The worker then evaluates the computation on a particular input and uses the evaluation key to produce a proof of correctness. The proof is only 288 bytes, regardless of the computation performed or the size of the inputs and outputs. Anyone can use a public verification key to check the proof. Crucially, our evaluation on seven applications demonstrates that Pinocchio is efficient in practice too. Pinocchio's verification time is typically 10ms: 5-7 orders of magnitude less than previous work; indeed Pinocchio is the first general-purpose system to demonstrate verification cheaper than native execution (for some apps). Pinocchio also reduces the worker's proof effort by an additional 19-60x. As an additional feature, Pinocchio generalizes to zero-knowledge proofs at a negligible cost over the base protocol. Finally, to aid development, Pinocchio provides an end-to-end toolchain that compiles a subset of C into programs that implement the verifiable computation protocol."
ObliviStore: High Performance Oblivious Cloud Storage - IEEE Conference Publication,"We design and build ObliviStore, a high performance, distributed ORAM-based cloud data store secure in the malicious model. To the best of our knowledge, ObliviStore is the fastest ORAM implementation known to date, and is faster by 10X or more in comparison with the best known ORAM implementation. ObliviStore achieves high throughput by making I/O operations asynchronous. Asynchrony introduces security challenges, i.e., we must prevent information leakage not only through access patterns, but also through timing of I/O events. We propose various practical optimizations which are key to achieving high performance, as well as techniques for a data center to dynamically scale up a distributed ORAM. We show that with 11 trusted machines (each with a modern CPU), and 20 Solid State Drives, ObliviStore achieves a throughput of 31.5MB/s with a block size of 4KB."
Hiding Information in Flash Memory - IEEE Conference Publication,"This paper introduces a novel information hiding technique for Flash memory. The method hides data within an analog characteristic of Flash, the program time of individual bits. Because the technique uses analog behaviors, normal Flash memory operations are not affected and hidden information is invisible in the data stored in the memory. Even if an attacker checks a Flash chip's analog characteristics, experimental results indicate that the hidden information is difficult to distinguish from inherent manufacturing variation or normal wear on the device. Moreover, the hidden data can survive erasure of the Flash memory data, and the technique can be used on current Flash chips without hardware changes."
PUFs in Security Protocols: Attack Models and Security Evaluations - IEEE Conference Publication,"In recent years, PUF-based schemes have not only been suggested for the basic security tasks of tamper sensitive key storage or system identification, but also for more complex cryptographic protocols like oblivious transfer (OT), bit commitment (BC), or key exchange (KE). In these works, so-called \""Strong PUFs\"" are regarded as a new, fundamental cryptographic primitive of their own, comparable to the bounded storage model, quantum cryptography, or noisebased cryptography. This paper continues this line of research, investigating the correct adversarial attack model and the actual security of such protocols. In its first part, we define and compare different attack models. They reach from a clean, first setting termed the \""stand-alone, good PUF model\"" to stronger scenarios like the \""bad PUF model\"" and the \""PUF re-use model\"". We argue why these attack models are realistic, and that existing protocols would be faced with them if used in practice. In the second part, we execute exemplary security analyses of existing schemes in the new attack models. The evaluated protocols include recent schemes from Brzuska et al. published at Crypto 2011 [1] and from Ostrovsky et al. [18]. While a number of protocols are certainly secure in their own, original attack models, the security of none of the considered protocols for OT, BC, or KE is maintained in all of the new, realistic scenarios. One consequence of our work is that the design of advanced cryptographic PUF protocols needs to be strongly reconsidered. Furthermore, it suggests that Strong PUFs require additional hardware properties in order to be broadly usable in such protocols: Firstly, they should ideally be \""erasable\"", meaning that single PUF-responses can be erased without affecting other responses. If the area efficient implementation of this feature turns out to be difficult, new forms of Controlled PUFs [8] (such as Logically Erasable and Logically Reconfigurable PUFs [13]) may suffice in certain applications. Secondly, PUFs should be \""certifiable\"", meaning that one can verify that the PUF has been produced faithfully and has not been manipulated in any way afterwards. The combined implementation of these features represents a pressing and challenging problem, which we pose to the PUF hardware community in this work."
