,0
LeaPS: Learning-Based Proactive Security Auditing for Clouds,"Cloud security auditing assures the transparency and accountability of a cloud provider to its tenants. However, the high operational complexity implied by the multi-tenancy and self-service nature, coupled with the sheer size of a cloud, imply that security auditing in the cloud can become quite expensive and non-scalable. Therefore, a proactive auditing approach, which starts the auditing ahead of critical events, has recently been proposed as a promising solution for delivering practical response time. However, a key limitation of such approaches is their reliance on manual efforts to extract the dependency relationships among events, which greatly restricts their practicality and adoptability. In this paper, we propose a fully automated approach, namely LeaPS, leveraging learning-based techniques to extract dependency models from runtime events in order to facilitate the proactive security auditing of cloud operations. We integrate LeaPS to OpenStack, a popular cloud platform, and perform extensive experiments in both simulated and real cloud environments that show a practical response time (e.g., 6 ms to audit a cloud of 100,000 VMs) and a significant improvement (e.g., about 50% faster) over existing proactive approaches."
Identifying Multiple Authors in a Binary Program,"Knowing the authors of a binary program has significant application to forensics of malicious software (malware), software supply chain risk management, and software plagiarism detection. Existing techniques assume that a binary is written by a single author, which does not hold true in real world because most modern software, including malware, often contains code from multiple authors. In this paper, we make the first step toward identifying multiple authors in a binary. We present new fine-grained techniques to address the tougher problem of determining the author of each basic block. The decision of attributing authors at the basic block level is based on an empirical study of three large open source software, in which we find that a large fraction of basic blocks can be well attributed to a single author. We present new code features that capture programming style at the basic block level, our approach for identifying external template library code, and a new approach to capture correlations between the authors of basic blocks in a binary. Our experiments show strong evidence that programming styles can be recovered at the basic block level and it is practical to identify multiple authors in a binary."
Secure IDS Offloading with Nested Virtualization and Deep VM Introspection,"To securely execute intrusion detection systems (IDSes) for virtual machines (VMs), IDS offloading with VM introspection (VMI) is used. In semi-trusted clouds, however, IDS offloading inside an untrusted virtualized system does not guarantee that offloaded IDSes run correctly. Assuming a trusted hypervisor, secure IDS offloading has been proposed, but there are several drawbacks because the hypervisor is tightly coupled with untrusted management components. In this paper, we propose a system called V-Met, which offloads IDSes outside the virtualized system using nested virtualization. Since V-Met runs an untrusted virtualized system in a VM, the trusted computing base (TCB) is separated more clearly and strictly. V-Met can prevent IDSes from being compromised by untrusted virtualized systems and allows untrusted administrators to manage even the hypervisor. Furthermore, V-Met provides deep VMI for offloaded IDSes to obtain the internal state of target VMs inside the VM for running a virtualized system. We have implemented V-Met in Xen and confirmed that the performance of offloaded legacy IDSes was comparable to that in traditional IDS offloading."
Privacy Implications of Room Climate Data,"Smart heating applications promise to increase energy efficiency and comfort by collecting and processing room climate data. While it has been suspected that the sensed data may leak crucial personal information about the occupants, this belief has up until now not been supported by evidence.In this work, we investigate privacy risks arising from the collection of room climate measurements. We assume that an attacker has access to the most basic measurements only: temperature and relative humidity. We train machine learning classifiers to predict the presence and actions of room occupants. On data that was collected at three different locations, we show that occupancy can be detected with up to 93.5% accuracy. Moreover, the four actions reading, working on a PC, standing, and walking, can be discriminated with up to 56.8% accuracy, which is also far better than guessing (25%). Constraining the set of actions allows to achieve even higher prediction rates. For example, we discriminate standing and walking occupants with 95.1% accuracy. Our results provide evidence that even the leakage of such ‘inconspicuous’ data as temperature and relative humidity can seriously violate privacy."
Network Intrusion Detection Based on Semi-supervised Variational Auto-Encoder,"Network intrusion detection systems (NIDSs) based on machine learning have been attracting much attention for its potential ability to detect unknown attacks that are hard for signature-based NIDSs to detect. However, acquisition of a large amount of labeled data that general supervised learning methods need is prohibitively expensive, and this results in making it hard for learning-based NIDS to become widespread in practical use.In this paper, we tackle this issue by introducing semi-supervised learning, and propose a novel detection method that is realized by means of classification with the latent variable, which represents the causes underlying the traffic we observe. Our proposed model is based on Variational Auto-Encoder, unsupervised deep neural network, and its strength is a scalability to the amount of training data. We demonstrate that our proposed method can make the detection accuracy of attack dramatically improve by simply increasing the amount of unlabeled data, and, in terms of the false negative rate, it outperforms the previous work based on semi-supervised learning method, Laplacian regularized least squares which has cubic complexity in the number of training data records and is too inefficient to leverage a huge amount of unlabeled data."
No Sugar but All the Taste! Memory Encryption Without Architectural Support,"The protection of in situ data, typically require solutions that involve different kinds of encryption schemes. Even though the majority of these solutions prioritize the protection of cold data stored on secondary devices, it has been shown that sensitive information like passwords, secrets, and private data can be easily exfiltrated from main memory as well, by adversaries with physical access. As such, the protection of hot data that reside on main memory is equally important.In this paper, we aim to investigate whether it is possible to achieve memory encryption without any architectural support at a reasonable performance cost. In particular, we propose the first of its kind software-based memory encryption approach, which ensures that sensitive data will remain encrypted in main memory at all times. Our approach is based on commodity off-the-shelf hardware, and is totally transparent to legacy applications. To accommodate different applications needs, we have built two versions of main memory encryption: Full and Selective Memory Encryption. Additionally, we provide a new memory allocation library that allows programmers to manage granular sensitive memory regions according to the specific requirements of each application. We conduct an extensive quantitative evaluation and characterization of the overheads of our software-based memory encryption, using both micro-benchmarks and real-world application workloads. Our results show that the performance overheads due to memory encryption are tolerable in real-world network scenarios, below 17% for HTTP and 27% for HTTPS."
Inference-Proof Updating of a Weakened View Under the Modification of Input Parameters,"We treat a challenging problem of confidentiality-preserving data publishing: how to repeatedly update a released weakened view under a modification of the input parameter values, while continuously enforcing the confidentiality policy, i.e., without revealing a prohibited piece of information, neither for the updated view nor retrospectively for the previous versions of the view. In our semantically ambitious approach, a weakened view is determined by a two-stage procedure that takes three input parameters: (i) a confidentiality policy consisting of prohibitions in the form of pieces of information that the pertinent receiver of the view should not be able to learn, (ii) the assumed background knowledge of that receiver, and (iii) the actually stored relation instance, or the respective modification requests. Assuming that the receiver is aware of the specification of both the underlying view generation procedure and the proposed updating procedure and additionally of the declared confidentiality policy, the main challenge has been to block all meta-inferences that the receiver could make by relating subsequent views."
Preventing Advanced Persistent Threats in Complex Control Networks,"An Advanced Persistent Threat (APT) is an emerging attack against Industrial Control and Automation Systems, that is executed over a long period of time and is difficult to detect. In this context, graph theory can be applied to model the interaction among nodes and the complex attacks affecting them, as well as to design recovery techniques that ensure the survivability of the network. Accordingly, we leverage a decision model to study how a set of hierarchically selected nodes can collaborate to detect an APT within the network, concerning the presence of changes in its topology. Moreover, we implement a response service based on redundant links that dynamically uses a secret sharing scheme and applies a flexible routing protocol depending on the severity of the attack. The ultimate goal is twofold: ensuring the reachability between nodes despite the changes and preventing the path followed by messages from being discovered."
Shortfall-Based Optimal Placement of Security Resources for Mobile IoT Scenarios,"We present a method for computing the best provisioning of security resources for Internet of Things (IoT) scenarios characterized by a high degree of mobility. The security infrastructure is specified by a security resource allocation plan computed as the solution of an optimization problem that minimizes the risk of having IoT devices not monitored by any resource. Due the mobile nature of IoT devices, a probabilistic framework for modeling such scenarios is adopted. We adapt the concept of shortfall from economics as a risk measure and show how to compute and evaluate the quality of an allocation plan. The proposed approach fits well with applications such as vehicular networks, mobile ad-hoc networks, smart cities, or any IoT environment characterized by mobile devices that needs a monitoring infrastructure."
Boot Attestation: Secure Remote Reporting with Off-The-Shelf IoT Sensors,"A major challenge in computer security is about establishing the trustworthiness of remote platforms. Remote attestation is the most common approach to this challenge. It allows a remote platform to measure and report its system state in a secure way to a third party. Unfortunately, existing attestation solutions either provide low security, as they rely on unrealistic assumptions, or are not applicable to commodity low-cost and resource-constrained devices, as they require custom secure hardware extensions that are difficult to adopt across IoT vendors. In this work, we propose a novel remote attestation scheme, named Boot Attestation, that is particularly optimized for low-cost and resource-constrained embedded devices. In Boot Attestation, software integrity measurements are immediately committed to during boot, thus relaxing the traditional requirement for secure storage and reporting. Our scheme is very light on cryptographic requirements and storage, allowing efficient implementations, even on the most low-end IoT platforms available today. We also describe extensions for more flexible management of ownership and third party (public-key) attestation that may be desired in fully Internet-enabled devices. Our scheme is supported by many existing off-the-shelf devices. To this end, we review the hardware protection capabilities for a number of popular device types and present implementation results for two such commercially available platforms."
RingCT 2.0: A Compact Accumulator-Based (Linkable Ring Signature) Protocol for Blockchain Cryptocurrency Monero,"In this work, we initially study the necessary properties and security requirements of Ring Confidential Transaction (RingCT) protocol deployed in the popular anonymous cryptocurrency Monero. Firstly, we formalize the syntax of RingCT protocol and present several formal security definitions according to its application in Monero. Based on our observations on the underlying (linkable) ring signature and commitment schemes, we then put forward a new efficient RingCT protocol (RingCT 2.0), which is built upon the well-known Pedersen commitment, accumulator with one-way domain and signature of knowledge (which altogether perform the functions of a linkable ring signature). Besides, we show that it satisfies the security requirements if the underlying building blocks are secure in the random oracle model. In comparison with the original RingCT protocol, our RingCT 2.0 protocol presents a significant space saving, namely, the transaction size is independent of the number of groups of input accounts included in the generalized ring while the original RingCT suffers a linear growth with the number of groups, which would allow each block to process more transactions."
SePCAR: A Secure and Privacy-Enhancing Protocol for Car Access Provision,"We present an efficient secure and privacy-enhancing protocol for car access provision, named SePCAR. The protocol is fully decentralised and allows users to share their cars conveniently without sacrifising their security and privacy. It provides generation, update, revocation, and distribution mechanisms for access tokens to shared cars, as well as procedures to solve disputes and to deal with law enforcement requests, for instance in the case of car incidents. We prove that SePCAR meets its appropriate security and privacy requirements and that it is efficient: our practical efficiency analysis through a proof-of-concept implementation shows that SePCAR takes only 1.55 s for a car access provision."
Privacy-Preserving Decision Trees Evaluation via Linear Functions,"The combination of cloud-based computing paradigm and machine learning algorithms has enabled many complex analytic services, such as face recognition in a crowd or valuation of immovable properties. Companies can charge clients who do not have the expertise or resource to build such complex models for the prediction or classification service. In this work, we focus on machine learning classification with decision tree (or random forests) as the analytic model, which is popular for its effectiveness and simplicity. We propose privacy-preserving decision tree evaluation protocols which hide the sensitive inputs (model and query) from the counterparty. Comparing with the state-of-the-art, we made a significant improvement in efficiency by cleverly exploiting the structure of decision trees, which avoids an exponential number of encryptions in the depth of the decision tree. Our experiment results show that our protocols are especially efficient for deep but sparse decision trees, which are typical for classification models trained from real datasets, ranging from cancer diagnosis to spam classification."
Stringer: Measuring the Importance of Static Data Comparisons to Detect Backdoors and Undocumented Functionality,"Finding undocumented functionality in commercial off-the-shelf (COTS) device firmware is an important and challenging task. This paper proposes a new static analysis method that measures the influence individual pieces of static data (such as strings) have upon the control flow of binaries in firmware. Our method automatically identifies static data comparison functions within binaries, then labels each function’s basic blocks with the set of sequences of static data that must be matched against to reach them. Then using these sets, it assigns a score to each function, which measures the extent to which the function’s branching is influenced by static data. Special keywords triggering backdoor functionality will have a large impact on the program flow. This allows us to identify three authentication backdoors – two of which previously undocumented. Moreover, we show our method is effective in aiding the recovery of both previously known and proprietary text-based protocols. We have developed a tool, Stringer which implements our technique; we demonstrate the effectiveness of our approach as well as its applicability to lightweight analysis by running it on a data set of 2,451,532 binaries from 30 different COTS device vendors."
