,0
Secure Authentication in the Grid: A Formal Analysis of DNP3: SAv5,"Most of the world’s power grids are controlled remotely. Their control messages are sent over potentially insecure channels, driving the need for an authentication mechanism. The main communication mechanism for power grids and other utilities is defined by an IEEE standard, referred to as DNP3; this includes the Secure Authentication v5 (SAv5) protocol, which aims to ensure that messages are authenticated. We provide the first security analysis of the complete DNP3: SAv5 protocol. Previous work has considered the message-passing sub-protocol of SAv5 in isolation, and considered some aspects of the intended security properties. In contrast, we formally model and analyse the complex composition of the protocol’s three sub-protocols. In doing so, we consider the full state machine, and the possibility of cross-protocol attacks. Furthermore, we model fine-grained security properties that closely match the standard’s intended security properties. For our analysis, we leverage the Tamarin prover for the symbolic analysis of security protocols.Our analysis shows that the core DNP3: SAv5 design meets its intended security properties. Notably, we show that a previously reported attack does not apply to the standard. However, our analysis also leads to several concrete recommendations for improving future versions of the standard."
Per-Session Security: Password-Based Cryptography Revisited,"Cryptographic security is usually defined as a guarantee that holds except when a bad event with negligible probability occurs, and nothing is guaranteed in that case. However, in settings where a failure can happen with substantial probability, one needs to provide guarantees even for the bad case. A typical example is where a (possibly weak) password is used instead of a secure cryptographic key to protect a session, the bad event being that the adversary correctly guesses the password. In a situation with multiple such sessions, a per-session guarantee is desired: any session for which the password has not been guessed remains secure, independently of whether other sessions have been compromised.Our contributions are two-fold. First, we provide a new, general technique for stating security guarantees that degrade gracefully and which could not be expressed with existing formalisms. Our method is simple, does not require new security definitions, and can be carried out in any simulation-based security framework (thus providing composability). Second, we apply our approach to revisit the analysis of password-based message authentication and of password-based (symmetric) encryption (PBE), investigating whether they provide strong per-session guarantees.In the case of PBE, one would intuitively expect a weak form of confidentiality, where a transmitted message only leaks to the adversary once the underlying password is guessed. Indeed, we show that PBE does achieve this weak confidentiality if an upper-bound on the number of adversarial password-guessing queries is known in advance for each session. However, such local restrictions appear to be questionable in reality and, quite surprisingly, we show that in a more realistic scenario the desired per-session confidentiality is unachievable."
AVR Processors as a Platform for Language-Based Security,"AVR processors are widely used in embedded devices. Hence, it is crucial for the security of such devices that cryptography on AVR processors is implemented securely. Timing-side-channel vulnerabilities and other possibilities for information leakage pose serious dangers to the security of cryptographic implementations. In this article, we propose a framework for verifying that AVR assembly programs are free from such vulnerabilities. In the construction of our framework, we exploit specifics of the 8-bit AVR architecture to make the static analysis of timing behavior reliable. We prove the soundness of our analysis against a formalization of the official AVR instruction-set specification."
A Better Composition Operator for Quantitative Information Flow Analyses,"Given a description of the quantitative information flow (qif) for components, how can we determine the qif of a system composed from components? We explore this fundamental question mathematically and provide an answer based on a new composition operator. We investigate its properties and prove that it generalises existing composition operators. We illustrate the results with a fresh look on Chaum’s dining cryptographers. We show that the new operator enjoys various convenient algebraic properties and that it is well-behaved under composition refinement."
Analyzing the Capabilities of the CAN Attacker,"The modern car is controlled by a large number of Electronic Control Units (ECUs), which communicate over a network of bus systems. One of the most widely used bus types is called Controller Area Network (CAN). Recent automotive hacking has shown that attacks with severe safety impact are possible when an attacker manages to gain access to a safety-critical CAN. In this paper, our goal is to obtain a more systematic understanding of the capabilities of the CAN attacker, which can support the development of security concepts for in-vehicle networks."
Automated Analysis of Equivalence Properties for Security Protocols Using Else Branches,"In this paper we present an extension of the AKISS protocol verification tool which allows to verify equivalence properties for protocols with else branches, i.e., disequality tests. While many protocols are represented as linear sequences or inputs, outputs and equality tests, the reality is often more complex. When verifying equivalence properties one needs to model precisely the error messages sent out when equality tests fail. While ignoring these branches may often be safe when studying trace properties this is not the case for equivalence properties, as for instance witnessed by an attack on the European electronic passport. One appealing feature of our approach is that our extension re-uses the saturation procedure which is at the heart of the verification procedure of AKISS as a black box, without need to modify it. As a result we obtain the first tool that is able verify equivalence properties for protocols that may use xor and else branches. We demonstrate the tool’s effectiveness on several case studies, including the AKA protocol deployed in mobile telephony."
Quantifying Web Adblocker Privacy,"Web advertisements, an integral part of today’s web browsing experience, financially support countless websites. Meaningful advertisements, however, require behavioral targeting, user tracking and profile fingerprinting that raise serious privacy concerns. To counter privacy issues and enhance usability, adblockers emerged as a popular way to filter web requests that do not serve the website’s main content. Despite their popularity, little work has focused on quantifying the privacy provisions of adblockers.In this paper, we develop a quantitative framework to compare the privacy provisions of adblockers objectively. For our methodology, we introduce several privacy metrics that capture not only the technical web architecture but also the underlying corporate institutions of the problem across time and geography.Using our framework, we quantify the web privacy implications of 12 ad-blocking software combinations and browser settings on 1000 websites on a daily basis over a timespan of three weeks (a total of 252’000 crawls). Our results highlight a significant difference among adblockers regarding filtering performance, in particular, affected by the applied configurations. Our experimental results confirm that our framework provides consistent results and hence can be used as a quantitative methodology to assess other configurations and adblockers further."
More Efficient Structure-Preserving Signatures - Or: Bypassing the Type-III Lower Bounds,"Structure-Preserving Signatures (SPSs) are an important cryptographic primitive that is useful for the design of modular cryptographic protocols. It has be shown that in the most efficient Type-III bilinear group setting such schemes have a lower bound of 3-element signatures, which must include elements from both base groups, and a verification overhead of at least 2 Pairing-Product Equations (PPEs). In this work we show how to circumvent these lower bounds by constructing more efficient schemes than existing optimal schemes. Towards this end, we first formally define the notion of Unilateral Structure-Preserving Signatures on Diffie-Hellman pairs (USPSDH) as Type-III SPS schemes with messages being Diffie-Hellman pairs and signatures being elements of one of the base groups, i.e. unilateral. We construct a number of new fully randomizable SPS schemes that are existentially unforgeable against adaptive chosen-message attacks, and which yield signatures consisting of only 2 elements from the shorter base group, and which require only a single PPE for verification (not counting the cost of verifying the well-formedness of the message). Thus, our signatures are at least half the size of the best existing scheme for unilateral messages. Our first scheme has a feature that permits controlled randomizability which might be of independent interest. We also give various optimal strongly unforgeable one-time schemes with 1-element signatures, including a new scheme for unilateral messages that matches the best existing scheme in every respect. We prove optimality of our constructions by proving different lower bounds and giving some impossibility results. We also show how to extend our schemes to sign a vector of messages. Finally, we highlight how our schemes yield more efficient instantiations of various cryptographic protocols, including variants of attribute-based signatures and direct anonymous attestation, which is a protocol deployed in practice. Our results offer value along two fronts: On the theoretical side, our results serve as a workaround to bypass existing lower bounds. On the practical side, our constructions could lead to more efficient instantiations of various cryptographic protocols."
Adversarial Examples for Malware Detection,"Machine learning models are known to lack robustness against inputs crafted by an adversary. Such adversarial examples can, for instance, be derived from regular inputs by introducing minor—yet carefully selected—perturbations.In this work, we expand on existing adversarial example crafting algorithms to construct a highly-effective attack that uses adversarial examples against malware detection models. To this end, we identify and overcome key challenges that prevent existing algorithms from being applied against malware detection: our approach operates in discrete and often binary input domains, whereas previous work operated only in continuous and differentiable domains. In addition, our technique guarantees the malware functionality of the adversarially manipulated program. In our evaluation, we train a neural network for malware detection on the DREBIN data set and achieve classification performance matching state-of-the-art from the literature. Using the augmented adversarial crafting algorithm we then manage to mislead this classifier for 63% of all malware samples. We also present a detailed evaluation of defensive mechanisms previously introduced in the computer vision contexts, including distillation and adversarial training, which show promising results."
PerfWeb: How to Violate Web Privacy with Hardware Performance Events,"The browser history reveals highly sensitive information about users, such as financial status, health conditions, or political views. Private browsing modes and anonymity networks are consequently important tools to preserve the privacy not only of regular users but in particular of whistleblowers and dissidents. Yet, in this work we show how a malicious application can infer opened websites from Google Chrome in Incognito mode and from Tor Browser by exploiting hardware performance events (HPEs). In particular, we analyze the browsers’ microarchitectural footprint with the help of advanced Machine Learning techniques: k-th Nearest Neighbors, Decision Trees, Support Vector Machines, and in contrast to previous literature also Convolutional Neural Networks. We profile 40 different websites, 30 of the top Alexa sites and 10 whistleblowing portals, on two machines featuring an Intel and an ARM processor. By monitoring retired instructions, cache accesses, and bus cycles for at most 5 s we manage to classify the selected websites with a success rate of up to 86.3%. The results show that hardware performance events can clearly undermine the privacy of web users. We therefore propose mitigation strategies that impede our attacks and still allow legitimate use of HPEs."
Acoustic Data Exfiltration from Speakerless Air-Gapped Computers via Covert Hard-Drive Noise (‘DiskFiltration’),"In the past, it has been shown that malware can exfiltrate data from air-gapped (isolated) networks by transmitting ultrasonic signals via the computer’s speakers. However, such a communication relies on the availability of speakers on a computer. In this paper, we present ‘DiskFiltration’, a method to leak data from speakerless computers via covert acoustic signals emitted from its hard disk drive (HDD) (Video: https://www.youtube.com/watch?v=H7lQXmSLiP8 or http://cyber.bgu.ac.il/advanced-cyber/airgap). Although it is known that HDDs generate acoustical noise, it has never been studied in the context of a malicious covert-channel. Notably, the magnetic HDDs dominate the storage wars, and most PCs, servers, and laptops todays are installed with HDD drive(s). A malware installed on a compromised machine can generate acoustic emissions at specific audio frequencies by controlling the movements of the HDD’s actuator arm. Binary Information can be modulated over the acoustic signals and then be picked up by a nearby receiver (e.g., microphone, smartphone, laptop, etc.). We examine the HDD anatomy and analyze its acoustical characteristics. We also present signal generation and detection, and data modulation and demodulation algorithms. Based on our proposed method, we developed a transmitter and a receiver for PCs and smartphones, and provide the design and implementation details. We examine the channel capacity and evaluate it on various types of internal and external HDDs in different computer chassis and at various distances. With DiskFiltration we were able to covertly transmit data (e.g., passwords, encryption keys, and keylogging data) between air-gapped computers to a nearby receiver at an effective bit rate of 180 bits/min (10,800 bits/h)."
DOMPurify: Client-Side Protection Against XSS and Markup Injection,"To prevent Cross-Site Scripting (XSS) and related attacks, sanitation of untrusted content is usually performed either on the server side, or by client-side filters like XSS Auditor or NoScript. However, modern web applications (including mobile apps) may not be able to rely on these mechanisms any more since untrusted content may pass these filters as ciphertext or may completely be processed within the DOM of the browser/app.To cope with this problem, XSS sanitation within the Document Object Model (DOM) is required. This poses a novel technical challenge: A DOM-based sanitizer must rely on native JavaScript functions. However, in the DOM, any function or property can be overwritten, through a class of attacks called DOM Clobbering.We present a two-part solution: First we show how to embed any server or client side filtering technology securely into the DOM. Second, we give an example instantiation of an XSS filter which is highly efficient when implemented in Javascript. Both parts are combined into a working and battle-tested proof-of-concept implementation called DOMPurify."
Preventing DNS Amplification Attacks Using the History of DNS Queries with SDN,"Domain Name System (DNS) amplification attack is a sophisticated Distributed Denial of Service (DDoS) attack by sending a huge volume of DNS name lookup requests to open DNS servers with the source address spoofed as a victim host. However, from the point of view of an individual network resource such as DNS server and switch, it is not easy to mitigate such attacks because a distributed attack could be performed with multiple DNS servers and/or switches. To overcome this limitation, we propose a novel security framework using Software-Defined Networking (SDN) to store the history of DNS queries as an evidence to distinguish normal DNS responses from attack packets. Our evaluation results demonstrate that the network traffic for DNS amplification attack can completely be blocked under various network conditions without incurring a significant communication overhead."
A Traceability Analysis of Monero’s Blockchain,"Privacy and anonymity are important desiderata in the use of cryptocurrencies. Monero—a privacy centric cryptocurrency has rapidly gained popularity due to its unlinkability and untraceablity guarantees. It has a market capitalization of USD 290M. In this work, we quantify the efficacy of three attacks on Monero’s untraceability guarantee, which promises to make it hard to trace the origin of a received fund, by analyzing its blockchain data. To this end, we develop three attack routines and evaluate them on the Monero blockchain. Our results show that in 88% of cases, the origin of the funds can be easily determined with certainty. Moreover, we have compelling evidence that two of the attack routines also extend to Monero RingCTs—the second generation Monero that even hides the transaction amount. We further observe that over 98% of the results can in fact be obtained by a simple temporal analysis. In light of our findings, we discuss mitigations to strengthen Monero against these attacks. We shared our findings with the Monero development team and the general community. This has resulted into several discussions and proposals for fixes."
Multi-rate Threshold FlipThem,"A standard method to protect data and secrets is to apply threshold cryptography in the form of secret sharing. This is motivated by the acceptance that adversaries will compromise systems at some point; and hence using threshold cryptography provides a defence in depth. The existence of such powerful adversaries has also motivated the introduction of game theoretic techniques into the analysis of systems, e.g. via the FlipIt game of van Dijk et al. This work further analyses the case of FlipIt when used with multiple resources, dubbed FlipThem in prior papers. We examine two key extensions of the FlipThem game to more realistic scenarios; namely separate costs and strategies on each resource, and a learning approach obtained using so-called fictitious play in which players do not know about opponent costs, or assume rationality."
Practical Keystroke Timing Attacks in Sandboxed JavaScript,"Keystrokes trigger interrupts which can be detected through software side channels to reconstruct keystroke timings. Keystroke timing attacks use these side channels to infer typed words, passphrases, or create user fingerprints. While keystroke timing attacks are considered harmful, they typically require native code execution to exploit the side channels and, thus, may not be practical in many scenarios.In this paper, we present the first generic keystroke timing attack in sandboxed JavaScript, targeting arbitrary other tabs, processes and programs. This violates same-origin policy, HTTPS security model, and process isolation. Our attack is based on the interrupt-timing side channel which has previously only been exploited using native code. In contrast to previous attacks, we do not require the victim to run a malicious binary or interact with the malicious website. Instead, our attack runs in a background tab, possibly in a minimized browser window, displaying a malicious online advertisement. We show that we can observe the exact inter-keystroke timings for a user’s PIN or password, infer URLs entered by the user, and distinguish different users time-sharing a computer. Our attack works on personal computers, laptops and smartphones, with different operating systems and browsers. As a solution against all known JavaScript timing attacks, we propose a fine-grained permission model."
On-Demand Time Blurring to Support Side-Channel Defense,"Side-channel attacks are a serious threat to multi-tenant public clouds. Past work showed how secret information in one virtual machine (VM) can be leaked to another, co-resident VM using timing side channels. Recent defenses against timing side channels focus on reducing the degree of resource sharing. However, such defenses necessarily limit the flexibility with which resources are shared. In this paper, we propose a technique that dynamically adjusts the granularity of platform time sources, to interfere with timing side-channel attacks. Our proposed technique supposes an interface by which a VM can request the temporary coarsening of platform time sources as seen by all VMs on the platform, which the hypervisor can effect since it virtualizes accesses to those timers. We show that the VM-Function (VMFUNC) mechanism provides a low-overhead such interface, thereby enabling applications to adjust timer granularity with minimal overhead. We present a proof-of-concept implementation using a Xen hypervisor running Linux-based VMs on a cloud server using commodity Intel processors and supporting adjustment of the timestamp-counter (TSC) granularity. We evaluate our implementation and show that our scheme mitigates timing side-channel attacks, while introducing negligible performance penalties."
VuRLE: Automatic Vulnerability Detection and Repair by Learning from Examples,"Vulnerability becomes a major threat to the security of many systems. Attackers can steal private information and perform harmful actions by exploiting unpatched vulnerabilities. Vulnerabilities often remain undetected for a long time as they may not affect typical systems’ functionalities. Furthermore, it is often difficult for a developer to fix a vulnerability correctly if he/she is not a security expert. To assist developers to deal with multiple types of vulnerabilities, we propose a new tool, called VuRLE, for automatic detection and repair of vulnerabilities. VuRLE (1) learns transformative edits and their contexts (i.e., code characterizing edit locations) from examples of vulnerable codes and their corresponding repaired codes; (2) clusters similar transformative edits; (3) extracts edit patterns and context patterns to create several repair templates for each cluster. VuRLE uses the context patterns to detect vulnerabilities, and customizes the corresponding edit patterns to repair them. We evaluate VuRLE on 279 vulnerabilities from 48 real-world applications. Under 10-fold cross validation, we compare VuRLE with another automatic repair tool, LASE. Our experiment shows that VuRLE successfully detects 183 out of 279 vulnerabilities, and repairs 101 of them, while LASE can only detect 58 vulnerabilities and repair 21 of them."
Link-Layer Device Type Classification on Encrypted Wireless Traffic with COTS Radios,"In this work, we design and implement a framework, PrEDeC, which enables an attacker to violate user privacy by using the encrypted link-layer radio traffic to detect device types in a targeted environment. We focus on 802.11 traffic using WPA2 as security protocol. Data is collected by passive eavesdropping using COTS radios. PrEDeC (a) extracts features using temporal properties, size of encrypted payload, type and direction of wireless traffic (b) filters features to improve overall performance (c) builds a classification model to detect different device types. While designing PrEDeC, we experimentally record the traffic of 22 IoT devices and manually classify that data into 10 classes to train three machine learning classifiers: Random Forest, Decision Tree and SVM. We analyze the performance of the classifiers on different block sizes (set of frames) and find that a block size of 30k frames with Random Forest classifier shows above 90% accuracy. Additionally, we observe that a reduced set of 49 features gives similar accuracy but better efficiency as compared to taking an entire set of extracted features. We investigate the significance of these features for classification. We further investigated the number of frames and the amount time required to eavesdrop them in different traffic scenarios."
