,0
VDF: Targeted Evolutionary Fuzz Testing of Virtual Devices,"As cloud computing becomes more and more prevalent, there is increased interest in mitigating attacks that target hypervisors from within the virtualized guest environments that they host. We present VDF, a targeted evolutionary fuzzing framework for discovering bugs within the software-based virtual devices implemented as part of a hypervisor. To achieve this, VDF selectively instruments the code of a given virtual device, and performs record and replay of memory-mapped I/O (MMIO) activity specific to the virtual device. We evaluate VDF by performing cloud-based parallel fuzz testing of eighteen virtual devices implemented within the QEMU hypervisor, executing over two billion test cases and revealing over one thousand unique crashes or hangs in one third of the tested devices. Our custom test case minimization algorithm further reduces the erroneous test cases into only 18.57% of the original sizes on average."
Static Program Analysis as a Fuzzing Aid,"Fuzz testing is an effective and scalable technique to perform software security assessments. Yet, contemporary fuzzers fall short of thoroughly testing applications with a high degree of control-flow diversity, such as firewalls and network packet analyzers. In this paper, we demonstrate how static program analysis can guide fuzzing by augmenting existing program models maintained by the fuzzer. Based on the insight that code patterns reflect the data format of inputs processed by a program, we automatically construct an input dictionary by statically analyzing program control and data flow. Our analysis is performed before fuzzing commences, and the input dictionary is supplied to an off-the-shelf fuzzer to influence input generation. Evaluations show that our technique not only increases test coverage by 10–15% over baseline fuzzers such as afl but also reduces the time required to expose vulnerabilities by up to an order of magnitude. As a case study, we have evaluated our approach on two classes of network applications: nDPI, a deep packet inspection library, and tcpdump, a network packet analyzer. Using our approach, we have uncovered 15 zero-day vulnerabilities in the evaluated software that were not found by stand-alone fuzzers. Our work not only provides a practical method to conduct security evaluations more effectively but also demonstrates that the synergy between program analysis and testing can be exploited for a better outcome."
Breaking Fitness Records Without Moving: Reverse Engineering and Spoofing Fitbit,"Tens of millions of wearable fitness trackers are shipped yearly to consumers who routinely collect information about their exercising patterns. Smartphones push this health-related data to vendors’ cloud platforms, enabling users to analyze summary statistics on-line and adjust their habits. Third-parties including health insurance providers now offer discounts and financial rewards in exchange for such private information and evidence of healthy lifestyles. Given the associated monetary value, the authenticity and correctness of the activity data collected becomes imperative. In this paper, we provide an in-depth security analysis of the operation of fitness trackers commercialized by Fitbit, the wearables market leader. We reveal an intricate security through obscurity approach implemented by the user activity synchronization protocol running on the devices we analyze. Although non-trivial to interpret, we reverse engineer the message semantics, demonstrate how falsified user activity reports can be injected, and argue that based on our discoveries, such attacks can be performed at scale to obtain financial gains. We further document a hardware attack vector that enables circumvention of the end-to-end protocol encryption present in the latest Fitbit firmware, leading to the spoofing of valid encrypted fitness data. Finally, we give guidelines for avoiding similar vulnerabilities in future system designs."
Lens on the Endpoint: Hunting for Malicious Software Through Endpoint Data Analysis,"Organizations are facing an increasing number of criminal threats ranging from opportunistic malware to more advanced targeted attacks. While various security technologies are available to protect organizations’ perimeters, still many breaches lead to undesired consequences such as loss of proprietary information, financial burden, and reputation defacing. Recently, endpoint monitoring agents that inspect system-level activities on user machines started to gain traction and be deployed in the industry as an additional defense layer. Their application, though, in most cases is only for forensic investigation to determine the root cause of an incident.In this paper, we demonstrate how endpoint monitoring can be proactively used for detecting and prioritizing suspicious software modules overlooked by other defenses. Compared to other environments in which host-based detection proved successful, our setting of a large enterprise introduces unique challenges, including the heterogeneous environment (users installing software of their choice), limited ground truth (small number of malicious software available for training), and coarse-grained data collection (strict requirements are imposed on agents’ performance overhead). Through applications of clustering and outlier detection algorithms, we develop techniques to identify modules with known malicious behavior, as well as modules impersonating popular benign applications. We leverage a large number of static, behavioral and contextual features in our algorithms, and new feature weighting methods that are resilient against missing attributes. The large majority of our findings are confirmed as malicious by anti-virus tools and manual investigation by experienced security analysts."
Redemption: Real-Time Protection Against Ransomware at End-Hosts,"Ransomware is a form of extortion-based attack that locks the victim’s digital resources and requests money to release them. The recent resurgence of high-profile ransomware attacks, particularly in critical sectors such as the health care industry, has highlighted the pressing need for effective defenses. While users are always advised to have a reliable backup strategy, the growing number of paying victims in recent years suggests that an endpoint defense that is able to stop and recover from ransomware’s destructive behavior is needed.In this paper, we introduce Redemption, a novel defense that makes the operating system more resilient to ransomware attacks. Our approach requires minimal modification of the operating system to maintain a transparent buffer for all storage I/O. At the same time, our system monitors the I/O request patterns of applications on a per-process basis for signs of ransomware-like behavior. If I/O request patterns are observed that indicate possible ransomware activity, the offending processes can be terminated and the data restored.Our evaluation demonstrates that Redemption can ensure zero data loss against current ransomware families without detracting from the user experience or inducing alarm fatigue. In addition, we show that Redemption incurs modest overhead, averaging 2.6% for realistic workloads."
ILAB: An Interactive Labelling Strategy for Intrusion Detection,"Acquiring a representative labelled dataset is a hurdle that has to be overcome to learn a supervised detection model. Labelling a dataset is particularly expensive in computer security as expert knowledge is required to perform the annotations. In this paper, we introduce ILAB, a novel interactive labelling strategy that helps experts label large datasets for intrusion detection with a reduced workload. First, we compare ILAB with two state-of-the-art labelling strategies on public labelled datasets and demonstrate it is both an effective and a scalable solution. Second, we show ILAB is workable with a real-world annotation project carried out on a large unlabelled NetFlow dataset originating from a production environment. We provide an open source implementation (https://github.com/ANSSI-FR/SecuML/) to allow security experts to label their own datasets and researchers to compare labelling strategies."
Precisely and Scalably Vetting JavaScript Bridge in Android Hybrid Apps,"In this paper, we propose a novel system, named BridgeScope, for precise and scalable vetting of JavaScript Bridge security issues in Android hybrid apps. BridgeScope is flexible and can be leveraged to analyze a diverse set of WebView implementations, such as Android’s default WebView, and Mozilla’s Rhino-based WebView. Furthermore, BridgeScope can automatically generate test exploit code to further confirm any discovered JavaScript Bridge vulnerability.We evaluated BridgeScope to demonstrate that it is precise and effective in finding JavaScript Bridge vulnerabilities. On average, it can vet an app within seven seconds with a low false positive rate. A large scale evaluation identified hundreds of potentially vulnerable real-world popular apps that could lead to critical exploitation. Furthermore, we also demonstrate that BridgeScope can discover malicious functionalities that leverage JavaScript Bridge in real-world malicious apps, even when the associated malicious severs were unavailable."
Filtering for Malice Through the Data Ocean: Large-Scale PHA Install Detection at the Communication Service Provider Level,"As a key stakeholder in mobile communications, the communication service provider (CSP, including carriers and ISPs) plays a critical role in safeguarding mobile users against potentially-harmful apps (PHA), complementing the security protection at app stores. However a CSP-level scan faces an enormous challenge: hundreds of millions of apps are installed everyday; retaining their download traffic to construct their packages entails a huge burden on the CSP side, forces them to change their infrastructure and can have serious privacy and legal ramifications. To control the cost and avoid trouble, today’s CSPs acquire apps from download URLs for a malware analysis. Even this step is extremely expensive and hard to meet the demand of online protection: for example, a CSP we are working with runs hundreds of machines to check the daily downloads it observes. To rise up to this challenge, we present in this paper an innovative “app baleen” (called Abaleen) framework for an on-line security vetting of an extremely large number of app downloads, through a high-performance, concurrent inspection of app content from the sources of the downloads. At the center of the framework is the idea of retrieving only a small amount of the content from the remote sources to identify suspicious app downloads and warn the end users, hopefully before the installation is complete. Running on 90 million download URLs recorded by our CSP partner, our screening framework achieves an unparalleled performance, with a nearly 85     speed-up compared to the existing solution. This level of performance enables an online vetting for PHAs at the CSP scale: among all unique URLs used in our study, more than 95% were processed before the completion of unfettered downloads. With the CSP-level dataset, we revealed not only the surprising pervasiveness of PHAs, but also the real impact of them (over 2 million installs in merely 3 days)."
Android Malware Clustering Through Malicious Payload Mining,"Clustering has been well studied for desktop malware analysis as an effective triage method. Conventional similarity-based clustering techniques, however, cannot be immediately applied to Android malware analysis due to the excessive use of third-party libraries in Android application development and the widespread use of repackaging in malware development. We design and implement an Android malware clustering system through iterative mining of malicious payload and checking whether malware samples share the same version of malicious payload. Our system utilizes a hierarchical clustering technique and an efficient bit-vector format to represent Android apps. Experimental results demonstrate that our clustering approach achieves precision of 0.90 and recall of 0.75 for Android Genome malware dataset, and average precision of 0.98 and recall of 0.96 with respect to manually verified ground-truth."
Stealth Loader: Trace-Free Program Loading for API Obfuscation,"Understanding how application programming interfaces (APIs) are used in a program plays an important role in malware analysis. This, however, has resulted in an endless battle between malware authors and malware analysts around the development of API [de]obfuscation techniques over the last few decades. Our goal in this paper is to show a limit of existing API de-obfuscations. To do that, we first analyze existing API [de]obfuscation techniques and clarify an attack vector commonly existed in API de-obfuscation techniques, and then we present Stealth Loader, which is a program loader using our API obfuscation technique to bypass all existing API de-obfuscations. The core idea of this technique is to load a dynamic link library (DLL) and resolve its dependency without leaving any traces on memory to be detected. We demonstrate the effectiveness of Stealth Loader by analyzing a set of Windows executables and malware protected with Stealth Loader using major dynamic and static analysis tools and techniques. The result shows that among other obfuscation techniques, only Stealth Loader is able to successfully bypass all analysis tools and techniques."
LAZARUS: Practical Side-Channel Resilient Kernel-Space Randomization,"Kernel exploits are commonly used for privilege escalation to take full control over a system, e.g., by means of code-reuse attacks. For this reason modern kernels are hardened with kernel Address Space Layout Randomization (KASLR), which randomizes the start address of the kernel code section at boot time. Hence, the attacker first has to bypass the randomization, to conduct the attack using an adjusted payload in a second step. Recently, researchers demonstrated that attackers can exploit unprivileged instructions to collect timing information through side channels in the paging subsystem of the processor. This can be exploited to reveal the randomization secret, even in the absence of any information-disclosure vulnerabilities in the software.In this paper we present LAZARUS, a novel technique to harden KASLR against paging-based side-channel attacks. In particular, our scheme allows for fine-grained protection of the virtual memory mappings that implement the randomization. We demonstrate the effectiveness of our approach by hardening a recent Linux kernel with LAZARUS, mitigating all of the previously presented side-channel attacks on KASLR. Our extensive evaluation shows that LAZARUS incurs only 0.943% overhead for standard benchmarks, and therefore, is highly practical."
CFI CaRE: Hardware-Supported Call and Return Enforcement for Commercial Microcontrollers,"With the increasing scale of deployment of Internet of Things (IoT), concerns about IoT security have become more urgent. In particular, memory corruption attacks play a predominant role as they allow remote compromise of IoT devices. Control-flow integrity (CFI) is a promising and generic defense technique against these attacks. However, given the nature of IoT deployments, existing protection mechanisms for traditional computing environments (including CFI) need to be adapted to the IoT setting. In this paper, we describe the challenges of enabling CFI on microcontroller (MCU) based IoT devices. We then present CaRE, the first interrupt-aware CFI scheme for low-end MCUs. CaRE uses a novel way of protecting the CFI metadata by leveraging TrustZone-M security extensions introduced in the ARMv8-M architecture. Its binary instrumentation approach preserves the memory layout of the target MCU software, allowing pre-built bare-metal binary code to be protected by CaRE. We describe our implementation on a Cortex-M Prototyping System and demonstrate that CaRE is secure while imposing acceptable performance and memory impact."
Mining on Someone Else’s Dime: Mitigating Covert Mining Operations in Clouds and Enterprises,"Covert cryptocurrency mining operations are causing notable losses to both cloud providers and enterprises. Increased power consumption resulting from constant CPU and GPU usage from mining, inflated cooling and electricity costs, and wastage of resources that could otherwise benefit legitimate users are some of the factors that contribute to these incurred losses. Affected organizations currently have no way of detecting these covert, and at times illegal miners and often discover the abuse when attackers have already fled and the damage is done.In this paper, we present MineGuard, a tool that can detect mining behavior in real-time across pools of mining VMs or processes, and prevent abuse despite an active adversary trying to bypass the defenses. Our system employs hardware-assisted profiling to create discernible signatures for various mining algorithms and can accurately detect these, with negligible overhead ( {<}0.01  ), for both CPU and GPU-based miners. We empirically demonstrate the uniqueness of mining behavior and show the effectiveness of our mitigation approach( {  }99.7   detection rate). Furthermore, we characterize the noise introduced by virtualization and incorporate it into our detection mechanism making it highly robust. The design of MineGuard is both practical and usable and requires no modification to the core infrastructure of commercial clouds or enterprises."
BEADS: Automated Attack Discovery in OpenFlow-Based SDN Systems,"We create BEADS, a framework to automatically generate test scenarios and find attacks in SDN systems. The scenarios capture attacks caused by malicious switches that do not obey the OpenFlow protocol and malicious hosts that do not obey the ARP protocol. We generated and tested almost 19,000 scenarios that consist of sending malformed messages or not properly delivering them, and found 831 unique bugs across four well-known SDN controllers: Ryu, POX, Floodlight, and ONOS. We classify these bugs into 28 categories based on their impact; 10 of these categories are new, not previously reported. We demonstrate how an attacker can leverage several of these bugs by manually creating 4 representative attacks that impact high-level network goals such as availability and network topology."
Trapped by the UI: The Android Case,"Mobile devices are highly dependent on the design of user interfaces, since their size and computational cost introduce considerable constraints. UI and UX are interdependent since UX measures the satisfaction of users interacting with digital products. Therefore, both UX and UI are considered as top priorities among major mobile OS platforms. In this work we highlight some pitfalls in the design of Android UI which can greatly expose users and break user trust in the UI by proving how deceiving it can be. To this end, we showcase a series of attacks that exploit side channel information and poor UI choices ranging from sniffing users’ input; resurrecting tapjacking, to wiping users’ data, in Android from KitKat to Nougat."
S gx-L apd: Thwarting Controlled Side Channel Attacks via Enclave Verifiable Page Faults,"To make outsourcing computing more practical, Intel recently introduced SGX, a hardware extension that creates secure enclaves for the execution of client applications. With SGX, instruction execution and data access inside an enclave are invisible to the underlying OS, thereby achieving both confidentiality and integrity for outsourced computing. However, since SGX excludes the OS from its trusted computing base, now a malicious OS can attack SGX applications, particularly through controlled side channel attacks, which can extract application secrets through page fault patterns. This paper presents Sgx-Lapd, a novel defense that uses compiler instrumentation and enclave verifiable page fault to thwart malicious OS from launching page fault attacks. We have implemented Sgx-Lapd atop Linux kernel 4.2.0 and LLVM 3.6.2. Our experimental results show that it introduces reasonable overhead for SGX-nbench, a set of SGX benchmark programs that we developed."
Secure In-Cache Execution,"A cold boot attack is a powerful physical attack that can dump the memory of a computer system and extract sensitive data from it. Previous defenses focus on storing cryptographic keys off the memory in the limited storage “borrowed” from hardware chips. In this paper, we propose EncExec, a practical and effective defense against cold boot attacks. EncExec has two key techniques: spatial cache reservation and secure in-cache execution. The former overcomes the challenge that x86 processors lack a fine-grained cache control by reserving a small block of the CPU’s level-3 cache exclusively for use by EncExec; the latter leverages the reserved cache to enable split views of the protected data: the data stored in the physical memory is always encrypted, and the plaintext view of the data is strictly confined to the reserved cache. Consequently, a cold boot attack can only obtain the encrypted form of the data. We have built a prototype of EncExec for the FreeBSD system. The evaluation demonstrates that EncExec is a practical and effective defense against cold boot attacks."
Scotch: Combining Software Guard Extensions and System Management Mode to Monitor Cloud Resource Usage,"The growing reliance on cloud-based services has led to increased focus on cloud security. Cloud providers must deal with concerns from customers about the overall security of their cloud infrastructures. In particular, an increasing number of cloud attacks target resource allocation in cloud environments. For example, vulnerabilities in a hypervisor scheduler can be exploited by attackers to effectively steal CPU time from other benign guests on the same hypervisor. In this paper, we present Scotch, a system for transparent and accurate resource consumption accounting in a hypervisor. By combining x86-based System Management Mode with Intel Software Guard Extensions, we can ensure the integrity of our accounting information, even when the hypervisor has been compromised by an escaped malicious guest. We show that we can account for resources at every task switch and I/O interrupt, giving us richly detailed resource consumption information for each guest running on the hypervisor. We show that using our system incurs small but manageable overhead—roughly 1     s every task switch or I/O interrupt. We further discuss performance improvements that can be made for our proposed system by performing accounting at random intervals. Finally, we discuss the viability of this approach against multiple types of cloud-based resource attacks."
Linking Amplification DDoS Attacks to Booter Services,"We present techniques for attributing amplification DDoS attacks to the booter services that launched the attack. Our k-Nearest Neighbor (k-NN) classification algorithm is based on features that are characteristic for a DDoS service, such as the set of reflectors used by that service. This allows us to attribute DDoS attacks based on observations from honeypot amplifiers, augmented with training data from ground truth attack-to-services mappings we generated by subscribing to DDoS services and attacking ourselves in a controlled environment. Our evaluation shows that we can attribute DNS and NTP attacks observed by the honeypots with a precision of over 99% while still achieving recall of over 69% in the most challenging real-time attribution scenario. Furthermore, we develop a similarly precise technique that allows a victim to attribute an attack based on a slightly different set of features that can be extracted from a victim’s network traces. Executing our k-NN classifier over all attacks observed by the honeypots shows that 25.53% (49,297) of the DNS attacks can be attributed to 7 booter services and 13.34% (38,520) of the NTP attacks can be attributed to 15 booter services. This demonstrates the potential benefits of DDoS attribution to identify harmful DDoS services and victims of these services."
Practical and Accurate Runtime Application Protection Against DoS Attacks,"Software Denial-of-Service (DoS) attacks use maliciously crafted inputs aiming to exhaust available resources of the target software. These application-level DoS attacks have become even more prevalent due to the increasing code complexity and modular nature of Internet services that are deployed in cloud environments, where resources are shared and not always guaranteed. To make matters worse, many code testing and verification techniques cannot cope with the code size and diversity present in most services used to deliver the majority of everyday Internet applications. In this paper, we propose Cogo, a practical system for early DoS detection and mitigation of software DoS attacks. Unlike prior solutions, Cogo builds behavioral models of network I/O events in linear time and employs Probabilistic Finite Automata (PFA) models to recognize future resource exhaustion states. Our tracing of events spans then entire code stack from userland to kernel. In many cases, we can block attacks far before impacting legitimate live sessions. We demonstrate the effectiveness and performance of Cogo using commercial-grade testbeds of two large and popular Internet services: Apache and the VoIP OpenSIPS servers. Cogo required less than 12 min of training time to achieve high accuracy: less than  0.0194   false positives rate, while detecting a wide range of resource exhaustion attacks less than seven seconds into the attacks. Finally, Cogo had only two to three percent per-session overhead."
