,Title,Text,Number of Comments,Date Posted
852,I defeated a panic attack tonight,"My biggest fear is of something being wrong with my heart, due to a family history of heart disease. I woke up about 12:30AM with some pain in my chest. While my rational mind was saying ""it's just muscle pain,"" my irrational mind freaked out. Heart started racing, got sweaty, etc. Typical panic attack symptoms. 

I just laid in bed and did some deep breathing and mental exercises...thought about taking a Xanax to calm me down, but I wanted to stare this attack down and come out on top. 

And I did, about 30 minutes later or so. Chest pain went away, heart rate went down to close to normal, and I feel OK now. I'm wide awake - I think from all the adrenaline - but feel good otherwise. 

Being able to get control over an attack and ride it out without Xanax is s big step forward for me. ",56,2015-02-16 10:53:51 EST-0500
853,"I will get through today, and so will you.","Last night I may not have been able to breathe or see well from a few hour anxiety attack, and woke up in the same state, but I will get through today.  I have made breakfast and taken my medication, and will not sink into the couch to extend my low to new depths.  I will draw, then go buy groceries because I am important.  I will take care of myself.   No matter how small the accomplishment, it makes a difference.  Even if it's just breathing. One day at a time.  Thank you for listening.",16,2015-02-18 00:01:30 EST-0500
854,I've suffered from severe anxiety for 16 years (since I was 12 years old). Today was a huge milestone: I asked for help.,[deleted],18,2015-02-17 21:25:16 EST-0500
855,"You'll all probably understand how amazing this is - I was having a lot of anxiety last night, heart racing, couldn't sleep - woke up today, and my office is closed so I'm working from home.","It's always amazing to me how incredibly draining anxiety is. I have health anxiety and GAD so the day after when I feel like this I always start to worry that I had a heart attack in my sleep or something - which logically I know doesn't make sense, but anxiety seems to create all of these illogical medical scenarios in my head. I'm just so glad I can stay home, try to relax, and not face the world this morning.",16,2015-02-17 16:17:05 EST-0500
856,DAE get this feeling where your body is anxious and your mind is calm?,"It is very strange and uncomfortable. My stomach feels out of place, idk how to describe it, and my body just feels very light in general.",32,2015-02-20 07:12:42 EST-0500
857,"I did something really, really fucked up and don't know how to calm myself down","I'm mostly just looking for people to talk to... I need to get this off my chest.

Last night I went to a Mardi Gras party at one of my (very new) coworkers places. Our restaurant chain is all intertwined and I know many of the people who work at the other stores. We've never hung out outside of the restaurants and I don't know them very well, but they happened to all be there last night and I wanted to make good impressions.

Well that didn't happen... I had forgotten to refill my Zoloft prescription for 3 days and finally took it two hours before the party. As some probably know, SSRIs make alcohol affect you much, much harder, and on top of that we were all drinking heavily and having a good time. 

Somewhere in the night I went dark. I wake up in my bed today, vomit on my sheets, and a missing phone. I INSTANTLY felt like something was very wrong and ran to the bathroom where I started hyperventilating. I had NO recollection of the night past a point but I had this feeling in my gut that something bad happened... And apparently I was right. 

I called up my best friend (who was there) from my house phone and she told me and I quote ""you caused a scene. You should probably apologize to some people."" I felt my blood just go cold and started crying again. She then refused to tell me anything else ""while I was being hysterical"" so I hung up and proceeded to have an hour long fucking breakdown. I couldn't move onto the bed, couldn't eat or speak, I just curled up on the ground and hated myself and cried until I gagged.

I knew I had to do damage control so when my friend (with benefits... It's a weird situation) called my house, I instantly apologized and told him I don't know what I did but I know it was bad. He told me yes, it was a shit show where I apparently tried to drag another guy into the bedroom after just hooking up with him, sobbing uncontrollably, screaming back and forth at him, and refusing to leave. He said he had to FORCE me into my coworkers car so they could take me home. 

Then, as he gets me inside my house I go sit on the floor, cuss him out, and start hitting him and biting him (explains the massive bruise on my palm). I apologized sincerely and told him that I don't know what is wrong with me, but that I'm done with alcohol for a LONG time. He told me he accepts my apology and is not upset anymore, just worried because it seemed like I was drugged. My best friend and her boyfriend who drink with me OFTEN also said they've never seen me go off the deep end quite like this (I've been known to cry), but I wasn't drugged. That would that make a nice excuse if I was, but no.

I'm not a violent or hateful person sober. I'm reserved, perpetually anxious, level headed... And I've been drinking for years! I've NEVER been an emotionally disturbed drunk until recently, with all the crying and now this. I have no idea what's going on or how to make this right with everyone. I apologized to my coworker when she brought me my phone at work, and she said ""everyone was worried... It was bad."" I won't be surprised if I'm never invited to her place again. 

My best friend had texted my mom in the middle of the night expressing concern for me and my state. Her boyfriend (also my coworker) made fun of me all night at work for it. I can't show my face in the other restaurant anymore.

Please someone tell me you did something stupid at some point too and it all got better :( my mind won't stop replaying it over and over and over ",53,2015-02-19 13:49:55 EST-0500
858,5-4-3-2-1 Exercise,"Hey, /r/Anxiety 

I'm a constant over thinker and have been for as long as I can remember.  In some aspects, it's actual very helpful, but in others it is a curse.  I just wanted to take a minute and share an exercise that was taught to me.  I've found it helps ground me in times of panic or while perseverating on a negative thought and keeps me in the current moment.  I tend to be a very practical person who has difficulty doing things like imagining peaceful scenes and the like, so this exercise with it's concrete instructions is really helpful.

I hope it's as helpful for you as it has been to me!

I learned this strategy from someone and it is really, really helpful for me when I need to focus on becoming more mindful of the present moment. She called it ""5,4,3,2,1"" and it goes like this:

Either say aloud or just think:

5 things you see

5 things you hear

5 things you smell

5 things you feel (physically)

4 things you see

4 things you hear

...

Until you get to 1.




At the end of this exercise you'll be much, much more focused upon the present moment and will hopefully be less focused upon perseverating on a negative thought or in a state of panic.

Edit: I'm glad to see that this exercise has helped so many people!  Thanks for taking the time to read!",31,2015-02-17 01:33:58 EST-0500
859,Phone calls make me insanely anxious. Anyone else? Any advice?,"I have no idea why, but the idea of talking on the phone with a stranger fills me with paralyzing fear.  It's been this way for years.  I have no problem talking on the phone with people I know--I frequently call my wife, my mom and my grandparents for example.  But when it comes to talking to someone I don't know, it's like night and day.  I almost always avoid answering the phone when I get a call from an unknown number--which has caused me problems in the past as you might imagine, but I can't seem to stop doing it.  Answering the phone in that situation feels like trying to talk myself into jumping off something really high--I know I probably won't get hurt, but every instinct in my body is screaming at me that it's dangerous.  I just found out that I have to call someone for work this afternoon, and added to the anxiety of not knowing him is the fact that I don't really feel equipped to discuss the issue I need to talk to him about.  I've been battling flight-or-fight response for the past hour but I just don't see any way out of this.  I feel shaky right now just writing about it, I really don't know how I'm going to do this.",18,2015-02-18 22:43:50 EST-0500
860,Sitting in a coffee shop feeling incredibly lonely.,[deleted],11,2015-02-15 14:32:36 EST-0500
861,Friendly PSA: Please think critically about how you respond to people with hypochondria!,[deleted],10,2015-02-17 23:33:18 EST-0500
862,Today is better than yesterday,"Yesterday I struggled with anxiety all day. Nothing hit the point of an attack, but it was there, always present. 

Today will be better. I'm at work, I feel okay, I feel like I can eat something. After work, I'm babysitting my best friends' son who is like a nephew to me. Then his sister will get home with her mom and give me a big hug. It helps me to see how happy those kiddos are, that life really isn't meant to worry about everything. I need to enjoy life",4,2015-02-18 16:25:24 EST-0500
863,"""I can't explain what depression is like unless you suffer from it"": Korn frontman Jonathan Davis",,5,2015-02-19 12:19:40 EST-0500
864,Probiotics have been helping me a TON and I think more people need to try it (links to academic studies provided),[removed],36,2015-02-20 21:36:18 EST-0500
865,"When I get stressed I shut down, how do I handle this",,8,2015-02-21 05:03:02 EST-0500
866,Watching Cosmos helped me put thing in perspective,"Neil DeGrasse Tyson describes life and the universe in such a beautiful way, that it made me realize how dumb my anxiety is: we focus our feelings in such insignificant matters, that we forget to enjoy life. If you want to know exactly what I'm talking about, watch Carl Sagan's ""[The Pale Blue Dot](http://youtu.be/4PN5JJDh78I)"".

I've been dealing with so much stress at work that my anxiety has been kicking in way more often than it used to, and it was kind of making it hard for me to control it. But I just watched the last episode of the 1st season of Cosmos, and I'm not going to lie, I cried. I cried of happiness. I'm so glad I have what I have, I am where I am, and in the end, whatever happens at work is just temporary, and in the long term, it is even meaningless. So I should enjoy the process instead of stressing. I should be happy and mindful.

Well, I just wanted to vent. I feel better and I trust my ability to control my anxiety. I always end up controlling it. Everything, including my anxiety, is temporary.",14,2015-02-17 10:35:47 EST-0500
867,How to not give a fuck.,,5,2015-02-19 05:07:50 EST-0500
868,I have Existential death anxiety [Help],[deleted],39,2015-02-19 22:27:40 EST-0500
869,I cant eat pls help,"I need help
My anxiety has grown so debilitating that i am struggling very much so  with the act of eating, I find myself focusing on my throat a lot so when i swallow food down it feels like its getting trapped or im going to choke or that my throat's closing up or something, its actually tthe worst i know the foods going down but my anxiety causes me to cough or start hyperventilating to make sure that im ok, how do i deal with this? i seriously need help :( Im getting CBT, its been kinda helping bt im pretty fresh to it. Someetimes i try to distract myself by watching shows but im too focused on myself if anyone could help it would be much appreciated <3
",34,2015-02-20 16:12:58 EST-0500
870,My description of my anxiety for a book I'm writing.,[deleted],4,2015-02-17 12:52:51 EST-0500
871,Do you find that being sick makes your anxiety worse?,"I've come down with a very bad head cold and woke up this morning feeling horribly anxious. Nothing is out of the ordinary otherwise, but I'm not anxious about being sick. It's just making me think about other things and get anxious about those instead.",13,2015-02-16 22:04:03 EST-0500
872,Did you always have anxiety? Or did something trigger it one day? What happened on that day? How do you cope now?,"All of my life, I was a pretty outgoing person. I had a care free soul, and lived life to the absolute fullest. But that dreadful day on November 15th, 2014 changed everything. Up until then, I never gave much thought to anxiety or any mental illness for that matter. But when it struck me for the first time, I couldn't believe how awful and life changing this affects a person. 


It was honestly the most frightening moment of my life. When an anxiety attack strikes you for the first time - and you have no idea what's happening since you never experienced it before... I have never been so scared. 


I had been struggling with a ton of stress in my life for a magnitude of reasons, and for reasons I am ashamed to admit, dabbled into a cocktail of drugs on the night that it happened. Doing the drugs is what definitely set me overboard, and my brain finally just stopped and said ""I can't take this anymore!"" and thus, the beginning of my anxiety began.


I remember going to the washroom of the party and I looked in the mirror and I couldn't recognize the person in the mirror. I freaked out at my alien figure and started panicking. My neck tensed up and I could barely breathe. I fell to my knees and began blacking in and out. I started feeling intense brain zaps and felt like I was either a) having a seizure/stroke or b) I was about to die.


I ran out of the house, past my friends, and into my truck to drive myself to emergency. As I hopped into my truck, I started experiencing everything in 3rd person view. It felt like I had come out of my body and was observing myself from an overhead view of me panicking inside my truck. Was I fucking dead?!?! I didn't know at this point. Suddenly I came back into my body. And for some reason I was focused on the clock on my dashboard illuminating back at me. ""2:44"" it showed. I kept saying over and over again ""Time of death 2:44, time of death 2:44.."" I kept repeating that for some fucking reason, and all of the sudden I snapped back into reality... and I realized I was driving on THE HIGHWAY THE WHOLE TIME and was almost at the hospital. I have zero recollection of even driving from my friends house to the hospital. In my mind I was still in my friends driveway at the party just sitting inside my truck looking at the clock. 


I pull into the hospital and I hop out. Another wave of panic hits me. My neck begins to tense up. I fall down to my knees again and look up at the hospital and tell my brain ""You just gotta get through those doors."" I was fully convinced the hospital staff was going to find my dead body in the parking lot. I managed to get to my feet though and I walk into the hospital doors clenching my neck with my hands very tightly. I didn't realize that I was actually choking myself more than my neck was actually tense. The doctors see my state and get me into the ER. They sedated me immediately as I was in a huge fit and next thing I know I am waking up in hospital with a heart monitor attached to me and a nurse monitoring my vitals. Everything that had happened previous to that, just felt like a bad dream, but it all actually happened and I couldn't wrap my head around it. The kind doctor explained to me what happened, and they let me talk to a therapist for an hour, free of charge, and he explained to me what anxiety was and how it happens. They gave me anti-anxiety meds and I felt a million times better.


Ever since that dreadful evening on November 15th, 2014.. I still battle the odd anxiety. The antidepressants I am on really help in keeping my mind in control, but now that anxiety has been triggered, I feel like it will never quite go away. It will always linger in some degree. I've had attacks since, but I have been able to keep a rational head. However, I have develop hypochondria, and am always awfully aware of my own heart and what my brain is doing/thinking. It's safe to say I'll never be the same again, but I like to think this horrific thing that happened to me, and that has happened to all of us, will only make us better prepared for whatever we may have to battle in the future. 


**TL;DR** For those who want to skip my story, basically what I'm asking is, have you always had anxiety? Or did something happen on a particular day that triggered this horrifying mental illness on you? Have you learned to cope with it and manage your attacks? 


Thanks r/anxiety! This subreddit has really helped me in so many ways and I just wanted to share my story and hear more from the community. ",18,2015-02-16 07:27:29 EST-0500
873,"Never before have I heard a song that described my life better. It's kind of sad, but also comforting.",,0,2015-02-18 14:22:55 EST-0500
874,Does anyone else become addicted to people as a coping mechanism?,"Ever since I was 13 or so (29 now) I have been infatuated with a certain individual. The person changes, but the addiction process stays the same. I meet someone I like, I start a friendship, start flirting, and it spirals until I get bored with them. I have figured out through therapy that it is a coping mechanism for dealing with my Anxiety due to growing up in an abusive and dysfunctional atmosphere as a child. These addictions make me happy when I am stressed, but the problem is they consume me. I will become to the point where I am obsessive about another individual. I think about them non stop and constantly want their attention, and when I don't get it, it's agonizing. I hate this about myself, and as you can imagine it causes me lots of problems in my personal life, especially so because I am married. I do not want this, but I am having a hard time battling it. I recently opened up to my Husband about it, and we are working on it in Therapy. I just want to know if anyone else out there has dealt with this, so perhaps I don't feel so alone. ",18,2015-02-19 03:11:46 EST-0500
875,Onion gets it right,[deleted],10,2015-08-06 11:34:03 EDT-0400
876,Having anxiety is being the small car at the side of the road who's alarm gets set off by a small gust of wind.,Where it takes a lot more force to set off any other cars alarm.,6,2015-08-04 16:34:17 EDT-0400
877,"DAE feel tired from a day of social things, even just the tiniest social interaction?","I have a pretty high anxiety score currently and am seeing a psych, but lately I've just felt not only depressed but exhausted by going out.
I feel like I've wasted the day if I don't, but if I do coffee dates or quiz nights I feel exhausted.
It's probably because my mind is racing 24/7 and that puts a toll on me. Literally, I feel like I'm on a cliff face all the time.
DAE feel this way?",30,2015-08-05 19:02:48 EDT-0400
878,"This book really helped me, after my therapist recommended it: The Anxiety and Phobia Workbook",,16,2015-08-04 01:36:01 EDT-0400
879,I think I beat my panic disorder!,"I started Viibryd last November, after being on Lexapro, Brintellix and then Pristiq. All of them helped in various ways but after switching to Viibryd it was like life in color again. I got out of my shitty manipulative 2 years relationship, I was no longer depressed and seeing the world in gray. My GAD is also really under control. And most of all I stopped having panic attacks. My biggest trigger used to be getting hit on in public or catcalled. Strangers scared me, especially males, after a sexual assault several years ago. I also would panic if I got yelled or spoken to by an authority figure, for example talking to a professor about a test grade would almost always send me hyperventilating in a bathroom. I used to be scared to leave my house to go to class because guys would whistle at me on my bike.  
My last panic attack was in January when I got spit on by a homeless guy. I think that was a pretty extreme situation that warranted a panic attack though, and even so it wasn't my worst. Since I stated Viibryd my ""activation energy"" for panic attacks has increased, meaning it takes me a much more severe situation for me to panic. But this last month I was able to go to Vegas, got catcalled all over the place, and none of it caused me to panic. A year ago I would have had a meltdown if a guy looked at me the wrong way. So it has officially been more than six months since my last panic attack. 
I'm no longer afraid to leave my house in case I have a meltdown. I know my case isn't that extreme, but hopefully this gives some of you hope that it gets better and you can conquer your anxiety!! ",8,2015-08-02 03:06:33 EDT-0400
880,Even this is giving me anxiety but.. Hello,"Hello everyone I'm a 24 year old male and some of my earliest memories are of anxiety and panic attacks, like panicking that my parents have died if they were out of my sight as a toddler or fear that I would forget to breath or choke on my food and so on. As I got older my anxiety just got worse and worse and by the time I was in 1st grade I went through a number of therapists and nothing scared me more than thinking I was a broken human being and that something was severely wrong with me So I lied to my therapist so I didn't have to see them anymore and I lied to my parents so they wouldn't be disappointed in having a worthless son (my mentality in 1st grade was pretty bleak but I remember that exaxt feeling clear as day.) I feel lying to everyone and trying to hide my real self from everyone brought more issues and since I tried to convince everyone around me I was a normal functioning human being, there was absolutely no leeway to act on my panic attacks and acknowledge my anxiety attacks which in itself lead to further panic and further anxiety, It was like an axietyception. By the time I was 18 I meet a girl that was pretty, smart, and most of all mean (or mentally abusive, which I didn't realize at the time) it was only logical that I should stay with her because I figured it's normal for people to act the way she did at the time so I couldn't break up with her out of anxiety and the wish to be a ""normal"" man.. Yes, man, I was 18 that's legally the age to vote, become fully responsible for yourself graduate grade school. So naturally I wanted to fit in... This is something I believe is wrong with society as well. You shouldn't pressure someone that young to feel like they're adults and responsible for yourself... Because when you take it to the point that I do it becomes completely devastating. I moved out of my parents house to a different town all together and not only that I had a child.. Not to mention I couldn't work a job to save my life. fresh out of high school that I didn't understand, fresh in a relationship that I never understood and being a fresh father... You get the picture.. And that's still just a fragment of my complicated mess of a life that I feel (or stress) could have been different If I would have just acknowledged the fact that I needed help and I wasn't meant to fit into normal society and but that just leads to anxiety of thing things I can't change, an anxietyception, but it's okay not to fit in. I guess what I'm saying is never feel like you're worthless, like I did, or you have to fit in with this society if you truly do not (like I tried and miserably failed.) because accepting yourself early will be a heck of a lot easier than accepting yourself down the road. 
Thank you for reading and I hope I at least reach one person with this. 
Whew... Don't have so much anxiety regarding this text anymore.  ",8,2015-08-01 15:02:43 EDT-0400
881,DAE not want to read about anxiety because they feel that if they don't relate to everything they read then their anxieties could be real?,Cause I get that sometimes ,9,2015-08-02 21:28:47 EDT-0400
882,Well holy crap - A very positive realisation just dawned on me that could help many of us here.,[deleted],6,2015-08-02 03:32:12 EDT-0400
883,"DAE notice a connection between beginning to feel depressed and not caring for things such plants and personal hygiene, ect?...",,12,2015-08-05 10:43:13 EDT-0400
884,"My senior thesis film, Love & Other Mental Illnesses, about a guy with social anxiety who alongside his dream girl run away from group therapy to complete a list of rom com cliches.",,5,2015-08-07 03:47:03 EDT-0400
885,I did it!,"Since being employed 4 years ago, I've never been to an office party. Once. I've been the master of excuses. Stepping into a crowded room of people I don't know with small talk is probably my biggest fear. But today, I did it. I went to my first office party. Everyone was incredibly cordial, and no one used the dreaded phrase ""Why are you so quiet?"". This is probably one of the biggest  hurdles I've ever overcome. I could not be happier right now.",13,2015-08-01 01:30:39 EDT-0400
