,Title,Text,Number of Comments,Date Posted
0,Does anyone else cry when they get yelled at or when someone raises their voice?,Especially when its a teacher or something.,125,2015-07-21 04:49:57 EDT-0400
1,Whenever I go out the next morning I feel like everyone hates me and I want to kill myself.,"Whenever I go out and get tipsy/drunk I suffer from intense anxiety. The next morning I feel like everyone I went out with the previous night will hate me on top of strong feelings of wanting to kill myself. The wanting to kill myself feelings are harder to deal with because I can't stop repeating in my head that I want to kill myself and the voice in my head gets so persistent that I end up absent mindedly saying it aloud. It's only been getting worse as time goes on. I don't know why I have these feelings or how to get rid of them and I was just wondering if anyone else experiences the same thing.

Edit: I want to thank you guys for being nothing but supportive and kind. You're all amazing!",36,2015-07-19 18:41:29 EDT-0400
2,Does anyone else shake literally from anxiety?,"So this morning I woke up literally shaking in bed. I also have a shaking arm sometimes when awake that won't just get away. 
The GP, neurologist, my psychologist and I are all convinced it is due to stress/anxiety. I (25f) started a new job today after 6 month of reintegrating at another job due to burnout/depression. So it's not that strange that I woke up shaking. The only thing is I can't stop it, which leads me to feeling panicky, which leads to a massive panic attack. So I was wondering does anyone else have this? and how do you cope with this? I also don't use any medication. 

tl;dr: sometimes I wake up shaking or my arm shakes all on its own. How to deal with this?",27,2015-07-16 00:12:44 EDT-0400
3,"**Breakthrough** Just want to share my realization, amazing change!!","So I spend so much time being so frustrated with my SO, friends, and family essentially because they don't meet my expectations of what I think they should be doing for me. But, it occured to me this morning that it's completely fucking stupid to get angry at people for not changing themselves to do what YOU want because THEY ARENT YOU. They are them. So, instead of getting angry I accept them as they are and instead evaluate whether what I'm asking for is even reasonable, and most of the time it's not. It's basically just about accepting people. It's not about changing them, it's about asking yourself if you can accept them for who they are and what they do and can do for you. 

I know it seems kind of dumb and round about, but this new perspective is really allowing me to release a lot of anger (and therefore anxiety) and allows me to just accept others. It's relieving a lot of tension in my relationships. I'm just a little proud of myself for this breakthrough...years in the making! I'm hoping this helps others as well. :-)",34,2015-07-17 20:43:37 EDT-0400
4,I just discovered this subreddit and I already feel a rush of calm over me because I can tell this will be a great resource for me.,"Looking forward to hearing everything you all have to say and to have a community of people who understand how I feel (especially since I don't have that in my personal life)

With that being said - what are some of your strategies to discuss your anxiety / when you're anxious with people you have relationships with in real life that don't suffer from anxiety (significant others, parents, friends, coworkers)?
",11,2015-07-21 21:14:58 EDT-0400
5,Advice needed. Can't poop with friends/partner in the house. Overnights/long weekends are painful.,"I have no idea where to post this and if you can recommend a better sub, I'll go there. The only thing I think this can be is anxiety.

I've always had this problem, but it's become a more serious issue now that I (25/F) have a boyfriend (my first, four months). He sleeps over once a week, typically for a night and all of the next day. This past weekend, he slept over two nights in a row.

I live in a studio apartment, so the bathroom is right by the living/bed area. But this has always been an issue for me, even when I've been at friends' houses and stayed overnight. If I was there for multiple days, I'd go to the college building right by there and use a zero-traffic public bathroom. When I dormed very briefly, I used a one-person occupancy stall by the lounge or waited until my roommates are gone.

At this point, it's not so much about the noise, although there is that. It's in part him/them realizing I must be pooping because of how long I take . . . but then there's also just something else. I feel like I'm in ""on"" mode or something, like I'm wired and just can't relax. I feel like I need to be constantly socializing/entertaining him (studi apartment, no wifi, no TV).  I've tried just sitting and waiting a long time whenever I do go to the bathroom (set a timer), but it doesn't work.

As soon as he leaves, literally within five minutes, I feel my body relax and I can go. I have been effortfully drinking a lot of water/eating a lot of fiber to make it easier to go. 

I love him sleeping over, but it becomes painful when I can't go and it distracts me. ",34,2015-07-20 04:55:06 EDT-0400
6,"If you're suffering - go to the doctor. I did, this is what has happened so far","I started having panic attacks early this year.

I wouldn't wish them on my worst enemy.

Everybody's panic is different - mine manifested in being convinced I would die.  If I was hot - I interpreted that as a risk of heat stroke.  I had an episode last 4-6 hours, ending in me laying naked on the bathroom floor, sopping wet from being in the shower, trying to find any way to cool down.  I was covered in goosebumps and I forgot what being cold/hot felt like.  I couldn't interpret it anymore.  I thought surely I was going to have a stroke.

If I started to think about my breathing, I was afraid I wasn't breathing enough.  I would start panicking.  It started with a numb feeling in my face, until I would get tremors that coursed through my body, thinking I was dying, that there was something wrong with me.

I would search for a pulse and if I couldn't find one (I've always had difficulty finding my pulse) I would think my heart stopped and any second, I was going to die.

If my heart was beating rapidly, I would think I was having a heart attack.

So I accommodated my anxiety more than I should of.  I couldn't stand direct sunlight anymore.  After my first public panic attack in the super market that lead me locked in a public bathroom, laying on the floor, I didn't want to leave the house anymore.

After enough attacks, I wished I would die during them, just so I wouldn't have to live in the constant fear of another attack anymore.  Death would at least offer me a reprieve.  I began seriously thinking about this - how could I live my life in such constant stress and fear?

However, through most of this, I never sought help.  I was told by my mother that I was ""more logical"" than that, to receive medication, and by others I loved that I should just ""deal with it"" on my own.

Then I spoke to some people on forums who told me:  Just get the prescription.  Just go to the doctor - get something to control it.

The stigma on medication was very negative from others in my life.  But I realized that because of this - I didn't need the strength to overcome the disease - I needed the strength to acknowledge that I needed help.  To break this habit, to stop suffering.

I went to the doctor who prescribed me a no-refill xanax prescription, 0.5 mg.  Not a daily dose.  She said take 1 if I have anxiety, 2 if I have a full-blown attack.

I read online before taking any that you shouldn't take it if you have breathing problems.  Because I am as paranoid and as scared as ever, I had a pulmonary function test (breathing test).  It didn't go too well (I fell short of the reference marks, but not too short, and I did react to one of the medications I inhaled, but not until the second-highest dose showing that I was sensitive, but likely didn't have severe asthma), but it didn't say that I had a severe problem either.  Still, my fear was strong.  I didn't take any of the drugs.

I had my 30 pills for a month.  The strange thing is during this time - I didn't have an attack.  Just the placebo effect of knowing I had a way to stop an attack IF NECESSARY made them not develop fully.  Sure, I still had episodes of me sitting around worrying, I still felt great dread at leaving the house too far, but none developed into the 5 hour crippling sense of fear and demise that lead to me being locked in my bedroom, avoiding those I loved.  I was able to go on an overnight trip, I feared being in the car a little less.  It wasn't the solution - but it was made just a little bit more bearable.

I didn't want to get 'fucked up' on these pills, but it sure was nice knowing I had a way to lessen the fear - even if I didn't take them.

Then, the time had come to take one.

It was last night.  All weekend I was in a heightened state of anxiety.  And last night it started culminating.  I was feeling very hot, which lead me to feel not like I was dying but like I was very ill, very off.  I was acting very irritated.  I started to get afraid that I would have an attack again, which only made things worse.  My boyfriend, initially against the medication, suggested I take one pill.

I did and the fear set in immediately.  What if I'm allergic?  What if I do have a breathing problem?  What if I die from this?  I drank half a beer 24 hours ago, what if they mix poorly?

For twenty minutes I lie still and repeated a mantra to myself. 

Then it worked.

In twenty minutes, I did not feel high.  I didn't feel 'fucked up.'  I simply felt calm.  

Not relaxed, not sleepy, just simply and utterly calm - I couldn't force myself into an attack.  The idea that something was seriously wrong stopped being broadcast on my consciousness.  It went out not with a bang, but with a whimper.

I had been dealing with this monster for months before seeking help, and finally, for one time, I didn't have to lie in fear.  I didn't have to coax myself into sleep just to avoid lying awake in panic.  I got to feel normal for a night, before drifting off to sleep.

I plan on enrolling in cognitive behavioral therapy once I can afford to, hopefully sometime during my next school semester - this is the optimal way of dealing with anxiety FOREVER.

In the meantime, I have a message for those suffering who have not sought help - please do.

Please do not suffer when there is something out there that can break the habit, that can offer you a sense of normalcy.  Do not abuse these drugs because if you do, their reward will be truly lost.  But do not avoid them either due to stigma.  I get it, 'white-man lab-coat medicine bad' is what I've been told all my life.  But there IS a reason that these drugs are on the market - it's because they work.

Now I feel even my state of anxiety will be lessened over time, since I have taken the pill and seen that I have no reason to fear it.  I hope at the end of my prescription, with no refills, I will have no reason to ever seek it out again.  But in the meantime, I feel truly healed.  Do not let the fear of prescription drugs prevent you from getting help like I did - start healing, and start healing today.  ",38,2015-07-20 18:29:35 EDT-0400
7,"[rant] I hate ""going out""",[deleted],16,2015-07-19 03:34:48 EDT-0400
8,I went outside today,"I went outside today, which is big victory for me because I think people are ruthlessly criticizing me in public. I didn't talk much, but I did go to three stores. After I got home, I had some palpitations, which is usually the start of a panic attack, but I managed to calm down, and I avoided the panic attack! I think today was such a success because of the medicine I've been taking, which is: Lexapro. It's been helping my anxiety a lot. I just wanted to share my success for today.  ",14,2015-07-19 21:31:24 EDT-0400
9,Thoughts of suicide,"I experience thoughts of suicide when  my anxiety is at its worst. 

I have cystic fibrosis and while I'm doing amazing all things considered I sometimes just wish I could cease to exist.  

No more suffering.  No more pain.  

Even just posting this thread I'm filled with feelings of disappointment and inadequacy. 

I have a handle on my situation most of the time but I needed to vent.

EDIT: thank you all for the support and kind words.  Got things under control again. ",13,2015-07-16 22:31:57 EDT-0400
10,"Holy freaking crap, be careful what you read online. Some ""scientific"" studies are SO stupid, as are the articles that report them.",[deleted],18,2015-07-18 11:16:11 EDT-0400
11,"Does anyone else have that feeling you have when you can brake just in time not to hit the car in front of you when you're not paying attention, multiple times a day for minor things?","It's getting crazy. I receive a phonecall, my chest starts to hurt and feels as if it contracts, my heart is pounding, I'm ready to have a heart attack. I have to go somewhere to get some paperwork done. While walking there I get the same thing, as if I saw an axe murderer in front of me and I needed to fight him to the death.

I'm so jumpy all the time, I can't handle it anymore. The adrenaline in my body is raging. I've been declared healthy by multiple specialists but I can feel my blood pressure spiking, my muscles tensing up, especially in my neck and my arm.

Whenever I chill out I feel that it takes it's toll on my body. I get tired quickly, I'm nauseous and sick to my stomach, I eat less and therefore I'm skinny as hell. I need to find some kind of way to let off steam because it's not normal to feel all tense in resting mode. ",15,2015-07-15 15:51:52 EDT-0400
12,I would just like to introduce myself..,[deleted],45,2015-07-16 12:02:23 EDT-0400
13,Everything is so hard. I don't even know why I bother putting in effort,[deleted],16,2015-07-20 18:41:52 EDT-0400
14,I've decided I want to start therapy for my anxiety/depression.. but I don't even know where to start.,"How do I find a therapist that will take my health insurance? I'm on my parent's still and out of state, what if I can't find a therapist in my area that will take my insurance? How much does it usually cost? What do I do if I can't afford anyone in my area?

I also struggle with the idea of opening up with a stranger about something I've kept a secret (even from family and best friends) for nearly 10 years. Did anyone else have that problem?",11,2015-07-16 21:08:36 EDT-0400
15,"""The fog"" after anxiety, anyone else?","I notice that after a long, horrendous, rough day of panic attacks and anxiousness, if I meet with people, a close friends, or close friends, I feel like I am in a fog.  I have been so wrapped in my brain, it is hard to fully cohere what is going on during a conversation.  I feel out of my body, almost high, distant or something.  Then, of course, it makes me anxious because I am thinking ""am I crazy?  I am completely sober, why do I FEEL this way?  Is something wrong with my brain?!"" Ugh, anyways, thought it might make me feel better if I am not alone on this.",19,2015-07-17 21:13:30 EDT-0400
16,Earworm (music stuck in your head) vs intrusive thoughts.,"I suffer from generalized anxiety, as well as obsessive and intrusive thoughts (among other things). I'm working with my therapist on not being bothered by my thoughts so much, and he brought up an interesting point. He asked if I ever have music stuck in my head, and I do - pretty much all the time. I've been playing guitar/bass for 10 years now and listen to music a lot, so it's only natural that a certain riff will stick out to me and I'll repeat it in my head over and over. He said that a lot of people are bothered by this, but I'm not. Music is music, a sequence of notes; there's nothing about it that would cause me anxiety or other negative emotions.

What surprised me is that he said that you can train yourself to see negative, intrusive thoughts the same way. Has anyone thought about this before?",5,2015-07-15 05:40:08 EDT-0400
17,Almost 21 and I can't/don't drive. It makes me feel really crappy about myself.,"I'm from NY state and the majority of people here don't drive until they are 18. When I was 18 and preparing for my road test, I went through a really bad stage where I frequently had a lot of anxiety and panic attacks. I soon stopped learning how to drive, because it was way too stressful for me and driving made me nervous. Fast forward 3 years, I'm on the brink of becoming 21 and I still can't drive. I live in the suburbs, where public transportation sucks and I rely on others to get around and it sucks. Thinking about driving during the day where there's other people and traffic makes me anxious.

For a period there, I was actually learning how to drive. I've been told I'm a good driver, technically, but when it comes to making critical decisions and driving around other cars, I get extremely anxious and it just screws everything up. I took my road test and failed due to not making enough of a full stop. After that instance , I just felt like driving was impossible for me.

It's such a simple and ordinary task but I see it as such a huge hurdle. Driving would make my life infinitely easier and overall more enjoyable, but it's such a mental roadblock for me. I see 16 yr olds driving around like nothing and I, for the life of me, cannot bring myself to actually feel confident enough to do it. I feel extremely self conscious about not having a license, and it holds me back from a lot. :/ I feel like a loser whenever I have to tell people my age I don't drive and brings down my overall self-esteem.",35,2015-07-14 23:08:52 EDT-0400
18,"""Parenthood-induced anxiety is a real thing, and pot is my anti-anxiety drug of choice.""",,9,2015-07-15 18:52:07 EDT-0400
19,Did anyone at one point wish they were someone else?,Because you see that person as the opposite of being anxious?,19,2015-07-20 16:17:56 EDT-0400
20,Saw somebody else suffering today.,"I have been suffering with anxiety and panic disorder for 10 years. In all that time I have never visibly seen somebody else suffer. Today, however, I saw somebody suffering. They had the look of distress in their face and I could see them doing breathing exercises, which I believe they were doing too fast. I wanted to help them so bad but I was thinking how I would react if somebody came up to me when I'm having an attack. I'm pretty sure if somebody told me they know what I'm going through, I wouldn't believe it.

I saw them while I was going to pick up my sibling from school. My sibling told me they had just borrowed their phone. They said some things like they ""just couldn't do it"" and were apologizing a lot. As somebody who's been punched in the face by his father just for having an anxiety attack I have to wonder if they are also in an abusive environment.

But I'm probably thinking too hard about this. I went ahead, got my sibling, and left. I figured if they were doing breathing exercises they're not clueless about their symptoms.

Should I have helped? What would you have done? How would you react if somebody walked up to you offering help during an attack?",8,2015-07-20 19:09:25 EDT-0400
21,Anxiety and digestion problems,"Hi, this particular stretch of anxiety has been going on for about a month now and for that whole time I've been unable to go to the toilet properly. I know that the adrenaline rushing though your body causes digestion abnormalities, but was wondering if anyone has found a way to overcome this. 

I'm struggling to eat as it is, and most of my anxiety is at night/in the morning so when I assume most of the digesting gets done.

I'm reluctant to go to the doctor as I've been a lot recently and they're just trying to get me to take pills which I don't think I need quite yet.

Thanks in advance for any suggestions!",33,2015-07-17 14:08:46 EDT-0400
22,"Hello, My name is Luna and I am new here. Pleasure to meet all of you.",[deleted],13,2015-07-19 22:38:49 EDT-0400
23,I was able to play my instrument while my parents were home today!,"I'm a musician that can't play her primary instrument due to expense (percussion is super pricey, so I'm probably never going to play again) so I'm learning ukulele. I love it. It makes me feel so normal and *me* to be playing music again.

But I have an intense aversion to practicing when my parents are able to hear me. If it's my boyfriend, I don't care. If it's my friends, I care a little but only if they're my musician friends. It's my parents that I absolutely refuse to practice in front of for some reason. Thanks, G.A.D....

Nowadays, of course, my mother is unemployed and home almost 24/7. So, obviously, I don't practice. Then I get into a loop of ""I don't practice, so I don't want to practice, but now I'm not good and never want to practice, because I'm still bad."" etc.

But today I was talking to one of my bosses at work about this. He's very realistic and blunt without being mean, so what he said really worked for me. He said something along the lines of, ""You don't practice because she can hear you? That's silly! Practice anyway, and if she says something condescending just say ""That's why I'm practicing!"" You're doing this for fun, right? So have fun.""

And as much as the ""just get over it"" approach doesn't work for some things, it really does help me in particular with some of my more irrational anxiety moments.

So I came home, did some homework, and by god I actually practiced for half an hour for the first time in months. *Both* my parents are home, but they're sitting out on the front porch so they can only hear me faintly. And ukulele is a lot quieter than a vibraphone, so they may not have even noticed. My dad was even pleasantly surprised to come inside and see me using my instrument. He's going deaf though, so I'm not surprised that he didn't hear it at all lol.

I'm so proud of myself. Now I just have to keep doing it! If I'd kept up practicing since this time last year when I got the thing, I'd be good at it by now. But it's better late than never, right? And who cares if my mom hears me (unless she's sleeping, I'm not a jerk)? I certainly shouldn't! Hell, she's probably pleased to hear me doing something that isn't Internetting.",1,2015-07-17 04:52:58 EDT-0400
24,I can't remember a day I've lived without felling since degree of anxiety.,[deleted],8,2015-07-17 15:19:46 EDT-0400
25,Whoohoo! I did it! I made a phone call!,"I'm a high school student. I've had problems with anxiety and depression for about the last six years. I have trouble with talking to people and initiating conversations. Especially over the phone. I get stressed out and start shaking and sweating and stuttering and rambling. There are times when I even get stressed out over calling my dad. Last year, my issues waned a bit, but recently I've had problems at home, and the anxiety and depression have come back.

For a while now, I've been planning on getting a piercing. I've probably put way more thought into it than I should have, I've researched everything from piercing methods to the cultural significance of piercings throughout history (I overthink things). I knew that the hardest part would be calling ahead and finding a piercer, but that once I found one and had an actual plan, I wouldn't let myself back out of it.

I looked online; I found one. I had the number of the studio written down. I had a list of what I would say when I called. I picked up the phone and rehearsed what I would say a few times. I got a cup of coffee, lit incense, and turned on some upbeat music to help me calm down. It took me a while, and I was still shaking, but I eventually got the courage to make the phone call. Someone at the studio answered the phone, and I was able to ask my questions. It went well. I didn't stutter or ramble (at least, I *think* I didn't). I had my questions answered. I got down to the last one. ""I'm seventeen, will I need parental consent? What sort of ID will I and my parent need to bring?"" Before I could finish asking, the person on the phone cut me off, said you've got to be eighteen, and hung up. Turns out that the one thing I forgot to look up was the legal age in my state.

Normally, I would have been angry at myself for getting stressed out over nothing. Not this time. I actually made a phone call! It seems like a ridiculous thing to be proud of, but I am. Less than a week ago, I almost passed out on an elevator because I was still stressed out over ordering coffee five minutes earlier. This time, I found ways to calm myself down. I did something that was difficult for me. It might have just been a simple phone call, and it may have ended up being a bit of a waste of time, but it feels big!

**EDIT**

*Thank you, All, for the congratulations! I really appreciate it!*",18,2015-06-18 20:47:04 EDT-0400
26,"Does anyone get panic attacks about their health, which leads to nausea, which leads to even more anxiety?","Getting really sick of this. Side note, just got a prescription for Celexa, hopefully that helps. I noticed a painful mass on my sternum last night, and that has led to an anxiety attack of epic proportions. While I know it's most likely nothing too serious, I'm literally worrying myself sick over it, and so far today, I've done nothing but lay in bed. I wish more people would understand what chronic anxiety is, instead of getting annoyed that I never want to do anything, because I always ""feel sick"".",49,2015-06-21 01:33:11 EDT-0400
