,Title,Text,Number of Comments,Date Posted
584,"a friend said to me, ""hey, dude, I think that's just your anxiety talking.""","He's the first person to say something like this to me. While I know that my brain won't revert back to that sentence once I'm having a panic attack, it made me feel normal for a split second. Like, yeah, you're right, that is just my anxiety talking, how I've been interpreting these situations is all false. Hopefully, I can make this a daily mantra as a reminder that my brain is trying to ruin every scenario and then maybe one day I won't take the made-up scenarios of fear as truth. Maybe.  

Thanks, Marc. You the man.",26,2019-09-15 09:16:12 EDT-0400
585,I was having a massive never-ending panic attack and called the suicide prevention hotline,"Today I was triggered and had a massive, and I mean catastrophic panic attack. I couldn’t calm down and for the first time in a very long time, my mind went to some really dark places about not wanting to be here anymore. Desperate for someway to handle the panic, I called the National Suicide Prevention Hotline Just to talk to someone. I talked to a lovely gentleman and explained how I just needed to talk to someone to process and help me ride out these feelings. He listened and was very kind. I felt really odd just rambling and crying to a stranger, but it did ultimately help. My boyfriend came home a few minutes later and so I went to spend time with him. It still took a while to settle down, but I finally was able to. I just want to really advocate using this hotline if you need it. It can really help just to talk it out to a neutral third party who genuinely cares about you. You don’t need to feel ashamed or embarrassed of using this service. It is there for you. Use all resources available to you. Love to my other warriors ♥️

Here’s the number if anyone needs it: 1-800-273-8255",38,2019-09-18 05:35:41 EDT-0400
586,My anxiety is making it hard for me to get to class,[deleted],49,2019-09-18 18:28:01 EDT-0400
587,Does anyone else constantly keep their core tight?,[deleted],55,2019-09-15 16:50:33 EDT-0400
588,My dog is being put down today and he is my best friend.,[deleted],24,2019-09-19 03:10:33 EDT-0400
589,I’m gonna do everything to beat this fucking anxiety.,"2020 will be our year my brothers and sisters, anxiety has been fucking with us all the time now it’s time to hit back and destroy it.",24,2019-09-19 13:23:21 EDT-0400
590,I finally asked my neighbor to turn down his music!,"I finally did it! My downstairs neighbor plays music late at night at ridiculously loud volumes. He doesn’t even do it that often it’s just when he does it’s normally super late, on weeknights, and generally just annoying to listen to this guys music at 11 PM on a Tuesday. I’ve been wanting to ask him to turn it down, but I always chicken out, get scared, overthink it, etc. Tonight was the night though I finally decided I had enough. I went down, I had to knock about 5 times and wait for about 10 min because I think he was just hoping I’d go away. Every minute I wanted to run back to my apt (especially because I kept hearing him rap the n-word which I just don’t like since I already knew he was white), but I stood firm. 

It was the scariest thing when he came out because he was bigger than I expected (I’m tall, but not big) and this guy was like a truck and I just stood there asked him to please turn it down. And he did! And now I’m sitting wondering why I was so scared, like what was he gonna do to me for asking? Anyways this is probably much longer than it needed to be for something so simple, but I’m really excited I did it!",15,2019-09-18 06:54:29 EDT-0400
591,"Read this, please, it's for you","Hi. I'm not here to write about me. I just want to leave you an important message, hoping that it will help you and, maybe, even save your life.

The message is: If you have a problem, specially if it's considerably affecting your life, you should talk about it to someone you trust as soon as possible. I suggest you talk to a parent or a relative, but if you don't feel helped by them, then talk about it to another adult (for example a therapist, a counselor or, if you're in school age, a teacher) or, generally, a friend. I know, you may feel uncomfortable with it, think it's not worth it, think you don't deserve it, think you have to do by yourself, but please, if you are suffering, TALK. You deserve help, no matter what.

Asking for help is NOT a sign of weakness, it's a sign of strength. If you feel it's too much to go through it alone, don't be afraid of seeking help. If you don't get the help you need once, remember that it's not your fault, and look for it somewhere else. Trust me, there's someone who can lessen your burden out there.

And, most of all, be kind to yourself. Other people can take care of you, but you also have to learn how to take care of yourself.

With love, Joodibox",28,2019-09-14 23:33:55 EDT-0400
592,First day at new job after 2 years unemployed,"I have to start at 8:30 but I came a little bit late because I got an anxiety rush that is killing me, I had to puke two times at home and another one on the go... But I'm here, after thinking about quitting before I get started. Now I'll be able to pay a decent therapy and get better.",28,2019-09-18 19:04:10 EDT-0400
593,Is anyone out there also terrified their anxieties will be the downfall of their relationship?,[deleted],45,2019-09-20 19:13:06 EDT-0400
594,Anyone have insomnia cause of anxiety?,"Every time I try to fall asleep, I get this surge of adrenaline and then stay awake for hours. My body wants to sleep but my mind I feel like won’t let it.",37,2019-09-18 08:54:10 EDT-0400
595,Be aware of what you put in your body.,"I heard a girl in my college class complaining about how bad her anxiety is and the fact that she only sleeps 4 hours a night because she can't fall asleep. Amidst the conversation, she continued taking sips of her giant coffee during this 6:30 PM lecture. 

Just a reminder to everyone on here to realize that your anxiety can be caused (or worsened) by the substances that you ingest. Whether it be caffeine, having a hangover, or even taking prescribed/OTC medications - they all can make your more anxious than you would be otherwise.",24,2019-09-20 23:18:21 EDT-0400
596,sometimes I wonder how people without anxiety operate,"I have learned to manage my anxiety to a point where I can live a normal life, go to school, and really be an overall happy person.. but it feels like it will always be lurking in the background for me. 
I’ll be driving, and then I play out scenarios in my head where I get into car accidents, or my loved ones suddenly die from an accident, and I think about what I would feel/think/do. I constantly worry that I have cancer, or some incurable, life altering disease, whenever I have an ache or pain. Or, when nothing is wrong at all. 

Being late is never an option, so I’m always incredibly early to any place I need to go to.. just to be sure that I won’t be anxious about the possibility of being even a minute or two late. I feel anxious about the jobs I’ll be able to get. If I’m good enough for what I want to really do with my education. I worry about my weight and body constantly. I worry about if people secretly harbor bad feelings towards me. I could go on and on and on about all of the dumb shit my mind comes up with on a daily basis. 

I feel like my anxiety is just such an integral part of myself, when by medical standards I’m “better” from the very worst of it that I experienced. I’ve always been an anxious person. My mom has told me things about me when I was a young child where I had behaviors that I still have today, usually all rooted in my anxiety. 

This is a random ramble, but I’m just really tired of always thinking like this. It seems like even though I’m ‘better,’ I’m never going to be like the effortlessly carefree people that I know. Guess I’ll keep learning to cope.",16,2019-09-19 06:28:54 EDT-0400
597,I haven’t felt joy for over a decade. The torturous anxiety has crippled most of my positive emotions. Been through some things. Been going through the life’s motions and have been a responsible father and husband. I couldn’t take it anymore and went and saw a therapist today. I feel some hope.,[deleted],19,2019-09-18 06:03:04 EDT-0400
598,DAE’s intrusive thoughts and anxiety actually disappear in social situations instead of increasing? It’s like my thoughts eat me up the most when I’m alone.,,13,2019-09-15 00:13:44 EDT-0400
599,Congratulations to you,"If you've kept your job for a week, congratulations! I just wanted to say I admire you people with anxiety who could keep up and push yourself to work and be productive.

I just wish I could tell this to myself one day. I just feel so disappointed with myself right now. I think I lost confidence that I can do anything.",15,2019-09-17 19:04:19 EDT-0400
600,'For as long as I remember... As far back as I can tell from my memory... There was no 'before'...'-group?,"((This is my first post ever on Reddit, so I hope I'm doing this right.))

TL;DR: Lifelong anxiety, how to handle, cope, fix or cure? Because I never found someone 'like me'. (Not being arrogant... Don't know how to say it otherwise...)

We all have this same goal; reduce the anxiety to a level at which it's manageable, right? Because really becoming fearless is highly unlikely (and I think not healthy.)
But we all have a different starting point. 
Some had a bad experience 6-7 months ago... 
Some had a trauma 6-7 years ago... 

But there's also a group of people who are suffering from their anxiety as long as they can remember. From 'birth'
I'm one of them, unfortunately. I'm diagnosed with a Generalized Anxiety Disorder with panic attacks which resulted in a deep depression on the side. Served on a plate of Avoidant Personality Disorder. 

People of 'my group', has anyone a working coping mechanism?
I'm just so tired.. 16 years of, different approached cognitive behavioural therapy based, talking.. 10-11 years of swallowing various medication options. 
26 years of exposure in vivo. 
Meditation, walking, exercising, etc. 
And nothing really changed. 

It's also hard to work when you don't have a memory you can fall back on. A memory of how life was without anxiety. Then you have some handles to hold onto. A goal of which you can calculate the distance. 
I just don't know what to expect of life. 
I find that very hard. 

Also I don't have parents to blame. No divorce, alcoholic dad, or emotional  numbed mom
My parents and family are full of love and understanding. And always helping me finding ways to achieve some small successes.
Only problem I see is being raised over-protective. But I find the punishment 'life long anxiety' out proportion. You know what I mean? (Also another thing I find hard to cope with. The guilt my parents feel about me suffering though life.)

For some context:
26 years old, living at home, studying anything and everything that interests me (music, electrical engineering, webdesign, graphic design, Sketchup, literature, health, etc), hardly ever go outside, holidays are awful. No experience in relationships, never had a girlfriend, never had sex, never kissed a girl. Miraculously finished high school. Unemployed - Not searching.  And luckily I got a few good friends left who are empathic and occasionally help me with my exposure objectives. ('Mission 1: get outside'). 
And many more things I can tell, but...

How do you hold on? What technique or therapy really helped you? Or if it's possible, how did you get better? From a life long state of anxiety to a manageable dose.   

Can someone help me out with info? 
Thanks in advance!",4,2019-02-01 03:24:01 EST-0500
601,Sensory overload?,"Do any of you sensory overload easily? I’m starting to think that a lot of my anxiety is because I can’t “turn off” certain inputs such as noises in my surroundings and sensations in my body. I do have health anxiety, but sometimes out of the blue I will feel overwhelmed at work and I think it’s due to noise. So maybe when my brain is saying “something’s wrong” it’s actually saying “I’m in overload”. ",3,2019-02-05 23:56:58 EST-0500
602,Cafeteria is terrifying place,"I am so scared to walk into cafeteria where people at work all make big circle and laugh so hard during lunch hour 
Cafeteria is a terrifying place 😢😢😢 it reminds me how socially inept I am ..",2,2019-02-06 00:03:33 EST-0500
603,Anxiety Getting Worse - Need Advice,"Hello, 

I have been experiencing more anxiety lately within the past month or so, than usual. I am an introvert and highly sensitive person, so I usually have some level of anxiety, but now it feels much worse suddenly. I keep having constant unwanted thoughts about my past negative experiences with men (allowing people to take advantage of me, not respecting myself, random hook-ups that I regret) out of the blue, which I am constantly fighting against in my head, making me feel exhausted. I have also noticed that I am just more anxious about everything in general, especially in social situations (I am shy and introverted already, so it just feels amplified now). 

I also feel like I might be experiencing some depression too. I have had a low mood, lack of interest in my usual hobbies and passions, lack of motivation to exercise and do anything, negative self-esteem and low confidence and overall feelings of sadness and wanting to cry randomly. 

I don't know what's going on with my brain but this anxiety and possible depression is making me even more anxious. 

I have visited my naturopath who prescribed me Vitamin B, Vitamin D, Magnesium, Omega 3s and a herbal treatment with St. John's Wort, Passionflower and Valerian. I have been taking the vitamins consistently for months, but just started the herbal treatment a few days ago and haven't noticed a difference yet. 

I have an appointment set up with my doctor and a therapist early next week. Nothing has really changed in my life recently, except from being in a stressful and overwhelming job, which I started last summer. I have noticed that I have been feeling more stressed since then. 

Does anyone have any advice or suggestions for me? What has worked for you to get the thoughts to stop? ",0,2019-02-01 01:09:24 EST-0500
604,What helps ease your GAD?,"I’ve been on so many medications and tried so many counselor-recommended tricks. My anxiety has only gotten worse if anything.

What medication has helped you? Which professionally recommended tactic has helped you the most?

I am currently on Zoloft. My psychiatrist keeps increasing the dosage — it helps my depression, but only my depression. I’m going to see my psychiatrist tomorrow and I think it may be helpful to come with ideas.",0,2019-02-01 02:28:17 EST-0500
605,Anxiety help,[deleted],0,2019-02-01 04:33:15 EST-0500
606,"Really scared, not comfortable in body",[deleted],3,2019-02-01 04:21:36 EST-0500
607,"Should I go see a doctor about my ""heart issues"" or just try to deal with them?",[removed],0,2019-02-01 00:51:41 EST-0500
608,How a west african shaman helped a Schizophrenic,,0,2019-02-01 02:06:35 EST-0500
609,Anxiety update:,[deleted],1,2019-02-01 00:33:00 EST-0500
610,I want people to degrade me...,[deleted],0,2019-02-01 06:17:58 EST-0500
611,When no one writes you does anyone even thinks about you?,,7,2019-02-01 01:41:01 EST-0500
612,I have a job orientation tomorrow after being unemployed since October!,"Like the title says, I lost my job at a movie theater in October bc we got hit hard by Hurricane Michael and our building took too much damage for anyone to go back to work. I've been too anxious to go back into the work force bc of all the trauma from the storm. 

BUT, my new job at Target is an overnight job! No customer service! My literal dream come true! It's only until April and then they said I can stay with them and do stocking in an early morning shift which I'm also okay with. 👍",1,2019-01-31 21:39:41 EST-0500
613,No get out jail free cards for anxiety.,"I was having a discussion earlier about anxiety in relationships and in society in general, it boiled down to a person suffering from anxiety should not be given a ""free pass"" for their actions due to anxiety if they are not taking proper precautions on their side. Whether it be medication, mediation, or therapy or whatever is needed. I understand it's not something that is completely treatable but if no steps are taken to circumvent their disability than it's incredibly inconsiderate to their partner or society. Thoughts? Mental illnesses are no joke especially if left unchecked.",0,2019-02-01 00:32:13 EST-0500
614,"I'm anxious around people of my own race, but even more so when I'm in a situation where I am a very small minority in a group. My problem is......","I have an opportunity to buy a bread route, which would be nice because I enjoy the owner operator business. I've had several routes in the past. I would buy it, but I'm worried I won't be able to click with any of the store workers I would deal with on a daily basis. It's depressing because it looks like a good route, but I will have to invest big money for this route, 100k, so I can't simply walk away if I feel miserable and have massive anxiety every day. What do you guys think I should do?",0,2019-02-01 00:28:20 EST-0500
615,"I'm powerless, I'm suffering.","A little over a week ago, perhaps 2 weeks ago now my wife got sick in the middle of the night which woke me up. Shortly after I myself started feeling sick so I went downstairs and convinced myself that I was just in my own head. My heart was beating a million beats per second, I was sweating, shaking, and nauseous. After convincing myself I was just being silly I finally calmed down but this took hours and hours of standing in my kitchen trying to calm down. By the time I finally felt comfortable enough to fall asleep it was about 5am and I had to call in to work because I needed to be at work at 8.   


I woke up at about 9 and got very little sleep, I spent that day taking care of my wife trying to make her feel better. I didn't have an appetite the whole day and outside of feeling a bit sleepy I actually felt fine. That night before bed the very same symptoms washed over me and I spent the whole night standing in the kitchen again trying to calm myself down once more. Heart racing, shaking, nauseous, tired. I went to bed around 5am again and again called in sick to work.   


My wife was at this time fully recovered, I hadn't told her what was going on as I didn't want her to worry/think I am weird. When she came down that morning at about 9am to see why I was asleep on the couch I told her I had really bad insomnia and had fallen asleep down there. That night while I felt very nervous about having this happen again I was so tired from lack of sleep that I finally fell asleep at about 9 but I woke up early that morning at about 4am and had to run to the bathroom with horrible diarrhea. After that was done I got worried again and started shaking, I felt like the walls of the house were closing in on me and felt like if I didn't leave the house I was going to be ill. So I went to work very early and told my boss I was just trying to catch up on work that I was behind on from calling in. I lied to my wife and told her that I got an on-call and needed to go in early. (again the thought of her worried about me makes me anxious). I got into my office and much like I would in the kitchen I sat in my office and calmed myself down then felt completely fine. 

&#x200B;

That night rolled around and I started having those extreme feelings of dread wash over me like I was becoming ill again. I had to tell my wife at this point what was going on, so I told her that I just needed to get out of the house for a minute, so I went to Walgreens panicking the whole way there but as soon as I got there I started to feel completely normal. Once I got there I was hoping to buy zzzquil but ended up getting NyQuil to basically force myself to sleep. I took it and fell asleep woke up the next morning feeling GREAT that I had finally gotten a nights sleep.  


Every single day now for going on over a week, I spend the whole day feeling completely fine. As soon as I get home I feel twinges of anxiety but I tell myself if I just take my mind off it I'll be fine so I read and watch TV. Sometimes I'm okay until about 7pm then the very same horrible feelings wash over me, I leave the house and go stand in my office in the middle of the night until I'm calm, then go home drink some NyQuil and go to sleep. Sometimes I'm fine until even later, I wake up at like 2am and start panicking then have to leave the house to calm down at my office some more before going back.  


My wife has been going through a very hard time emotionally with the loss of our pregnancy and being depressed because of work. I want to be able to be there for her, but I spend all night at the office trying to calm down. We went on a date yesterday in hopes that getting out of the house would make me okay and she could tell I was miserable the whole time. This anxiety, wherever it has come from is completely controlling my life. I don't know what to do, I don't know where to look. I'm becoming extremely depressed because I miss my wife, I just want to be able to be home with her in her time of need. The more depressed I get the more anxiety I feel.   


I am completely lost, I've never in my life suffered anxiety.",2,2019-02-01 08:10:10 EST-0500
616,"Today was a scary day, but it was good",,0,2019-02-01 08:50:35 EST-0500
617,Saw this today on the freeway and chuckled xD,[deleted],0,2019-02-01 09:08:11 EST-0500
618,I always feel like I'm going to die soon.,"Hi everyone! I hope my post finds you all well. I was hoping to vent a bit here and maybe get some advice. 

I've been suffering from really terrible anxiety and what started as overwhelming fear of home invasions moved into health anxiety and hypochondria. Anything that I feel physically I immediately make into a fake illness. If I have a stomach ache it's probably a rare illness from those leftovers I had yesterday, if my head hurts it's a tumor, etc. 

It's been putting a strain on my life and I don't know how to make it better. Any advice is welcome! ",2,2019-02-01 04:50:51 EST-0500
619,Should I go to the doctor for my heart issues or not?,[deleted],2,2019-02-01 01:30:46 EST-0500
620,Hospital system just assign me with cute psychiatrist which almost paralyze me.,"I always have problem to act appropriately with women stranger since I broke up with my ex. By appropriate. I mean finding something to talk and thinking straight. I always tell myself that I shouldn’t talk about my ex to any women if she doesn’t ask about it.

Most of the times my psychiatrist is always mens or middle aged lady.

This time, I don’t know how and why hospital just assign me with cute young doctor around my age she wear glasses and have resemble with my ex.

The moment I saw her I say with my self “OH CRAP, RED ALERT HOW CAN I TELL HER ABOUT MY SYMPTOMS” 
“YOU NEED TO TELL HER ABOUT YOUR RECENT DEVELOPMENT AND HOW YOU STILL MISS YOUR EX SO SHE CAN FIND A WAY TO TREAT YOU”

I feel like I can’t talk about my ex in front of her but you need to fake it.

So I talk about my anxiety on my job finding stagnation while my mind scream “TALK ABOUT YOUR EX, SHE IS HERE TO TREAT YOU, TELL HER.”

I notice that my talking speed start to slow down. I find that I keep avoid her eye contact and my mouth hardly move.

Then I tell har about my ex but I find it hard to express aspects that psychiatrist need to know because I feel somewhat attract to her.

Then she ask me “so, are you still looking for girlfriend ?” This question almost break me down. My Id tell that she is flirting with me while my superego tell me she is doing what she supposed to do and also wall of psychiatrist ethics bar her from dating me if she really wish so.

If she really want to date me and really date me it would be nice. but having her as my psychiatrist is making me really uncomfortable and kinda hinder my treatment.

So far I haven’t told my hospital to avoid incident like this, it’s really not her fault too. I want to express this.

Thing is nurse office and department administration is right in front of her office I can’t really tell all the nurse that I find this uncomfortable.

I wish I can tell someone or even her that I find her attractive and make me uncomfortable.

So thank r/anxiety to let me use this space. Thank you
(I still have butterflies in my stomach)",0,2019-02-01 07:19:50 EST-0500
621,How CBD has decreased my anxiety,[removed],0,2019-02-01 06:43:02 EST-0500
