,Title,Text,Number of Comments,Date Posted
555,"I say something ""stupid,"" then endlessly punish myself for it. How do I stop?","WARNING: This might be a bit graphic, so please don't read if descriptions of self harm might upset you. I don't want to upset anybody.

So like the title says, I have a problem where I will say something stupid and then torture myself over it. ""Stupid"" could be anything, depending on how the person I'm having a conversation with reacts. Silence? Laughter? A smile? What was that supposed to really mean? What are they thinking about me?

Then the incident is branded into my memory. I will torture myself by replaying it over and over while audibly, verbally abusing myself. For what ever reason, I replay these incidents in the while in shower more than anywhere else. It's almost like a little temple of self-loathing. I imagine cutting parts of my skin off, or pulling parts out of my body, and the thoughts soothe me. At the worst points, I do end up cutting or burning myself to try and make the embarrassing incidents stop playing in my head. I don't ever really forget them, but they do get to the point where they stop torturing me for a few days or weeks. Then it all starts over.

How do I stop this? Other than by never talking to another person again.  Is this common?",14,2015-03-13 06:04:56 EDT-0400
556,A helpful hand saved me today.,[deleted],8,2015-03-10 05:28:00 EDT-0400
557,"[Help] I broke down in my advisor's office and now I am on academic probation, of sorts. Anxiety is ruining my life. This is going to be long.","Short background: I am a first-year graduate student in a competitive, professional program. I am also a research assistant within my department and am technically employed by my state government. Throwaway for obvious reasons. I have posted here and in the chat before about my grad school issues so someone might recognize me for that, but oh well.

Yesterday, I yelled at my project supervisor during a meeting. 

I was doing a presentation on the work I have been doing this semester, and at the end, she said that it was a ""disappointing presentation"", even though I had presented everything she asked for (or so I thought). Also present at this meeting were 3-4 of my peers and my department advisors. I was obviously upset but I stood there and took the criticism for what I thought was a decent presentation.

My project supervisor mentioned several times during this criticism session that I ""never submitted a final draft"" of my work, that she ""never received a final draft"". Over and over again she said, in front of my peers and superiors, that I didn't do my work. Finally, I had enough, and I clarified that I had, in fact, submitted a final draft of my work last week. I was in her office and she asked me to email her a draft of my work, and I did. Never heard anything back from her until yesterday's meeting.

We got into a back-and-forth argument over whether or not I had submitted my final draft. She kept saying that she had to ""solicit"" my final draft from me, that other people on the project had approached her with printed out copies of their work. I think she meant that she emailed me asking me for my draft, which I emailed back to her. 

My project was 60+ pages long, I wasn't about to print it all out in the office, and I was under the impression that emailing it to her was fine-- considering that she had verbally and via email told me that this is what she wanted.

Finally, my department advisor put an end to what had become a shouting match and carried on with the meeting. I was supremely embarrassed and had to choke back tears. 

Later in the day, my department advisor called me into her office and talked to me about what had happened. She said that both she and my project supervisor (the one I was yelling at) had noticed that ever since January, I seemed disinterested and was having trouble getting work in on time. I'm also behind on work hours. The list went on and on. She said that she ""doesn't like surprises"" and that if there was a problem, I should have come to her about it.

That's when I broke down. I started hysterically crying. I told her everything: how I've felt alone since I started school, how I started medication but had since stopped taking it because it wasn't helping, how I was falling behind with my work but that I still wanted to be in the program. She let me calm down in her office for a little while, and then she told me that I had to call the campus counseling office right there and then, unless I would be asked to leave my position. My anxiety and depression issues were causing problems, as evidenced by my lack of preparation and my outburst in the meeting that morning.

So I called the counseling office. I have an appointment tomorrow afternoon. Next week, I am sitting down with my department advisor and we are going to work out the rest of the semester. I am so scared/nervous/embarrassed/upset/you name it, I feel it. I still need to reo-do my final draft and re-do the presentation so I am trying to just focus on that but I feel like I can never face my advisor, my supervisor, or anyone else in my department ever again.",34,2015-03-12 22:11:07 EDT-0400
558,"Went on a 2 mile walk! May not mean a lot to others, but it's huge progress for me!",http://i.imgur.com/32CISes.jpg,12,2015-03-09 02:48:21 EDT-0400
559,Victory! :) my eyelashes have grow in enough to put mascara on!,"I have a bad habbit of pulling out eyelashes, eyebrows,  and scratching my arms, head, and neck when I'm *really* anxious. I haven't worn makeup beyond thick black eyeliner, eyebrow makeup, and powder for years. But this morning I was finally able to put a bit of mascara on. They're nowhere near as lush as they used to be, but it's a start :)",19,2015-03-14 17:43:52 EDT-0400
560,I'm finally prescribed the right meds and I feel AMAZING!!!,"Hey everyone! I've posted a few times on this sub but mostly I've just been a lurker. But recently went to my psychologist and he gave me the right diagnosis and medicine that actually works with my body and I honestly can't remember the last time I was this carefree and happy. 

I've suffered from really bad anxiety for the past few years. I had a boyfriend, fell in love, got left for another girl, lost my job, and felt like I was burdening everyone with my existence. I was always over thinking things; things had deeper meanings than what they really *were*. And I'd drive myself absolutely insane. One minute, I'd be perfectly fine and then something as tiny as a friend not texting me back would lead me on a roller coaster of emotions, most of the time downhill. And I would always assume I was unwanted.

My life had turned to complete shit. I couldn't get a job because I would have anxiety attacks, hanging out with friends was always a chore because I had assumed they hated me so much, that everything was said to me in vain and I would **always** take things so offensively. 

A few months ago, I started seeing a psychologist. I told him my troubles of anxiety and we went through my vast history of anti-depressants and anxiety medications. I've taken Welbutrin, Prozac, Effexor, Xanax, Ativan and a bunch of other medicines I can't remember the name of. I had quit taking every one of them because I always ended up feeling **numb**, like I couldn't even enjoy life anymore. I would sit and stare off into space for hours just not feeling a thing. It was even worse than what I was feeling before. I was starting to feel discouraged and I thought I had to live the rest of my life with anxiety. 

This is where things finally start to get better. I told him how everything I had taken wasn't working for me; even the ones he prescribed me. Then he told me about this mouth swab test that can test your DNA and tell you what kind of medications will work for you based on your levels of serotonin or whatever. I don't remember exactly what he said, I'm not a doctor. Anyways, I took the mouth swab test and came back 2 weeks later to discuss my medications and how I was doing. 

I told him about how I have mood swings and the littlest things could send me into a deep depression, and he said that I might be bipolar along with having anxiety and I should try a mood stabilizer. He gave me a medicine called Lamictal and holy shit you guys. It fucking worked.

Today was my first day of taking it and I feel like I felt when I was a kid. You know that feeling that you get when you first fall in love and everything is perfect and you're still in the honeymoon phase and *nothing* can bring you down? Yeah, that's how I feel. Like a vacation from my anxiety! I didn't realize that my mood swings were actually the primary cause of my anxiety! I've had a clear head all day. I did things that would cause me to have a panic attack but I've been perfectly calm and handled myself pretty well in all tricky situations today! 

I'm not a huge poster on here, but I can't thank you guys enough for being supportive when I did need you, and for helping me come to my diagnosis as bipolar/anxiety. 

I guess there are a few bits of advice I have: 

**1)** Keep a journal handy at all times. Write down any feelings you have and make sure to mark it with dates and exact times of those feelings. It's extremely important to keep track of your feelings so you can go back and later asses them.

**2)** If you are lucky enough to have a psychologist, please use that to your advantage. I was an idiot for a long time and never told my therapists or psychologists the full truth because I was afraid of them judging me. Remember they are not there to judge you. They literally entered the business because they want to help you be the best you that you can be!

**3)* Also, if you have a psychologist, ask them about the mouth swab test! I'm not sure how common they are, he said it was fairly new but he's got nothing but good reviews from this method. Look around your area and find a psychologist who can do this for you.

**4)** Make sure you have the right diagnosis. I'm not a doctor, but I've been misdiagnosed a bunch of times. This is why it's important for you to keep a journal. A lot of times, anxiety can be triggered by other emotions, so make sure you know what exactly is causing them.

**5)** Lastly, please do not give up hope. I know anxiety is such a hard thing to have. Sometimes you can feel hopeless and engulfed in an endless sea of despair and sadness. I know how shitty it is. I thought I was a hopeless case but I kept trying because I knew I deserved more than a life like that. And so do you. If I can find happiness, I have no doubt that you can, too :)


**EDIT:** OHMYGOSH you guys I forgot another thing that helped me a lot! [this](http://www.amazon.com/The-Secret-Rhonda-Byrne/dp/1582701709) book has been amazing in terms of positive affirmation. Not only was this one of the key things that got me out of my anxiety but it has brought me so much happiness because it made me believe in myself. Which is hard to do when you're always second guessing yourself. If you only read one book this year, please read this book. You will not be sorry!",34,2015-03-08 09:42:18 EDT-0400
561,An app idea to help us all.,"Hello friends.  I've been having a super rough month or so and desperately needed someone to talk to the other day that understood what I was dealing with- I didn't talk to anyone.  I know, there is this subreddit, and there's also the chat room, but a lot of people don't get responses to their questions on the subreddit, and it's not always easy to get to the chat room.  

My idea is to create an app where people can get a hold of someone to talk to within minutes.  Here's how it would work:  You would download the app and create a username (standard stuff).  Afterwords, you would create a profile telling a little bit about yourself.  Lastly, you would indicate if you were available to talk (voice over the phone), or text in the event someone needed you.  Ideally the voice call would take place within the app to secure the privacy of your phone number, but you could give it out to whomever you were talking to if you desire.  

Here's a hypothetical situation to give you a better idea:  My wife and kid are out of the town, and I'm freaking out about some random health situation (I think I have cancer, or I'm having a stroke, or possibly a heart attack).  All I need is someone to talk to and tell me it will be alright and help me cope with it.  I open up my app on my phone and change my status from ""green (available to talk to someone) to either ""yellow (need someone to talk to, but not in any hurry), or to ""red (I need to get someone on the horn right now or I'm gonna lose my shit).  So I changed it to red.  Now, all the users that had selected that they were available to talk will get a notification, one by one, and whoever accepts it first will have the honor of helping someone get through a stressful time.  Let's say I set my status to yellow.  People that are logged on to the app will see that my status is yellow and that I'd like to talk to someone, but it's no rush.  They can choose to accept it-or not.  If no one has accepted it in a user-defined amount of time (maybe the person who needed help selected ""yellow- 1 hour"") then it will be processed through the same notification system as ""red"".  

Obviously this is bare-bones and needs fleshed out a little more, but it's an idea.  This would be free to anyone to use also.  No need to charge people to talk to friends.  Obviously some sort of ad system would have to be integrated in to keep it functional, though.  

I'd like some feedback from you all.  Does it sound like a good idea?  I'm not by any means an app developer or programmer, so if this is popular I would have to go to a 3rd party to develop this.

Lastly, my feelings won't get hurt if you tell me it's stupid.  But I know for people like us, it's nice to have someone in your pocket that you can reach out to at any time, and I also know that while we may have our issue, we never hesitate look after our own when they are in need.  Thanks for reading.

EDIT:  Cake Day! Woo!
",23,2015-03-11 02:46:11 EDT-0400
562,"I have a coffee date with a girl in an hour, I really want to cancel because of my anxiety. Advice?",[deleted],50,2015-03-13 19:21:04 EDT-0400
563,"Do you ever have a crippling fear that whenever you speak, no one cares what you have to say?","I just feel that I'm terribly boring, because usually halfway through my story I look and I feel like no one's interested. Yet, some people will ramble on when no one else is paying attention and not care. Should I just suffer through it and never speak? I can't seem to get past the thought.",11,2015-03-13 00:41:05 EDT-0400
564,Anxiety when walking? am i the only one?,anyone get anxiety when they are walking and people are around you/looking at you?  I feel like im walking weird and than it messes up my walk and i make a weird step/throws my balance off or think i do and its just in my head.  Am i the only one?,31,2015-03-07 23:44:53 EST-0500
565,I went inside KFC to order instead of getting my friend to go through the drive through today.,"It wasn't my choice. The closest KFC had no drive through and I didn't want to annoy my friend by asking him to drive an extra 20 mins through 5PM traffic to get to the other KFC in town.

I had a panic attack and barely managed to order properly. Ordering food is one of my biggest triggers and the guy misheard me the first time (not his fault I was garbling words out of nerves) and I couldn't get the drink machine to work and it was just awful. 

Anyone else hate ordering food/buying stuff over the counter?",15,2015-03-10 02:07:13 EDT-0400
566,[Rant] Walked out on my siblings on my birthday,"I've always been an anxious person. But I don't think I've ever sunk this low before. I've been in the military for the past 6 years, away from home aside from a once a year visit. I love my family dearly and we're very tight knit, even if we don't communicate often.

I'm finally in town for a decent chunk of time, allowing me to actually spend some quality time with them outside of rushed visits. Only a month of being in the same state, catching up with my brother only a third time I end up walking out only a few hours into the evening. On my birthday no less.

I've never felt especially comfortable about my birthday and all the attention felt so overwhelming. Then feeling so out of place because I'm so removed from what goes on in their lives. It all got too much and I just walked out and found myself at a train station holding back tears whilst waiting for the train home. All I offered in text was an ""I'm feeling a bit out of sorts"".

I'm so looking forward to living back home again by the end if this year. But I've never felt so out of place and alien in my life and they're my closest and dearest family. I handled being deployed overseas better for fuck sake.",10,2015-03-14 17:20:32 EDT-0400
567,"up yours, anxiety...","When my heart rate gets elevated, I start having anxiety symptoms. Today I decided ""the hell with it...I'm working out anyway.""

5 glorious minutes on the elliptical, and 15 great minutes on a stationary bike. My heart rate is up (not bad, only 110-120 range) and I am jittery and nervous. But I FREAKIN WORKED OUT TODAY. Usually I pop a Xanax to make the anxiety go away, but today I am going to do all I can to avoid doing that. I want to stand on my own two feet, stare it in the eyes, let it wash over me and then say:

SCREW YOU ANXIETY. I WON THIS ROUND TODAY. ",13,2015-03-10 16:42:36 EDT-0400
568,My girlfriend is missing,[deleted],18,2015-03-10 14:14:57 EDT-0400
569,Can anxiety have an effect on your sexual performance?,"After being single for about 4 years, I finally met a girl patient enough to put up with my ticks due to my anxiety. The problem is whenever we are in bed I have difficulties getting hard with her. I tried the whole no fap thing and still had no luck other than her being able to make me cum through oral. I checked to make sure the pipes were still working a few days ago and have no issues whatsoever getting hard to regular porn.

My question is do any of you have anxiety induced issues when it comes to sexual performance. If so how did you get over them?",19,2015-03-14 07:33:21 EDT-0400
570,"Went on my very first date at age 23, faced my anxieties, and ended up having a great time!",,6,2015-03-14 04:08:02 EDT-0400
571,Finally went to the doctor to get help. Got into an accident on the way home.,"After months of contemplating getting help.. Wednesday I actually looked forward to finally having that conversation with my doctor about my anxiety and panic attacks. I meditated before I left and my mom drove me. For the first time in months I didn't feel anxious in the car, we actually went out of my comfort/safe zone. The appointment went great, my doctor prescribed me some meds to try and we headed back home. I was supposed to stop at the pharmacy and go back to the office get my shot. When we were heading towards our exit it started pouring, my mom could barely see our exit. We hydroplaned and slammed into a big truck in front of us. For the next hour it was a horrible dream and the worst panic attack I couldn't pull myself out of. My ears were ringing and I got out to pull my mom out but she was unconscious. Someone pulled over and helped my mom while I called for help. 

My mom ended up being taken to the hospital in the icu and I refused treatment and my brother brought me home. The accident was just a couple minutes away from our house. I spent the next several hours in the bathroom dry heaving, shaking and weak. Took forever for the shock to wear off. I've never been in an accident before. I still don't feel right, me entire body aches. Or that I'm here. Most of the impact was on my side and I don't understand how I wasn't injured and how I walked away from it. 

I don't know where to go from here. I woke up last night hyperventilating thinking I was still in the car. I can still smell the smoke and dust from the air bags. ",9,2015-03-13 18:10:55 EDT-0400
572,Too scared to even admit my issues to my therapist,[deleted],10,2015-03-09 07:24:14 EDT-0400
573,I like myself but I have no self-esteem. Can anyone relate?,"As a teenager/young adult I struggled with severe anxiety and depression. I eventually sought professional help and those problems are under control now, but I still have some weird self-esteem issues.

It's tough to explain because I feel like I really do like myself. Like anybody I have my share of strengths and weaknesses, but I take my strengths seriously and don't diminish them. I know I'm a smart person. I know I'm talented. People tell me I'm funny frequently enough that I believe it's true. I have a lot of friends and I'm generally well-liked by my coworkers.

But lurking in the back of my mind is this perpetual fear that if I let anybody get too close, they'll find out the truth about me, and the truth is that I'm just not good enough. I feel like I'm inherently unlovable, and as soon as the people I care about figure it out, they'll bail. So I keep pretty much everyone at arm's length.

I was abandoned by a parent when I was little and I feel like there's a relationship between that experience and these feelings. Even though intellectually I know my abandonment wasn't my fault, it's like my brain just doesn't get the message.

Can anyone relate to this?",8,2015-03-11 05:48:11 EDT-0400
574,Exam anxiety is ruining my life and I have no idea what to do.,[deleted],8,2015-03-07 22:42:35 EST-0500
575,Does anyone else experience depression alongside anxiety?,"I swear, it's like once I finally calmed down enough to think, a blanket of depression just settles over my shoulder like a dark cloud on my life. I've been so down.",72,2015-05-27 22:29:18 EDT-0400
576,[Rant ] Someone laughed at me today during class,"I was working up the nerve to participate in class and my voice got really shaky all of a sudden and I felt like I had an attack coming on, so then someone turned around and started snickering at me to her friend while I was still talking. It really sucked but I'm surprised I got over it so quickly and volunteered again (without the shaking this time). Usually this would send me into a shame spiral, so.. small victory! Yay!

Edit: Thanks so much for the kind words.. :"") Nobody in my life would understand what this small thing means to me, so I'm so happy to have such a compassionate and supportive community to share it with.",22,2015-05-27 01:35:08 EDT-0400
577,"I don't like being at home, but I *really* dont like being anywhere else.","Gonna keep this short so you guys can get on with your lives, but I just would like to know if there are others out there like this and if this is just general anxiety.

I'm a normal person, not depressed, but I do stress out a lot with exams and used to have problems with endorphines. 

I HATE leaving my house, and whenever I leave the first thing I think of is when will I come back. As I have matured and become older though, I have started to feel unconfortable at home as it's not 'normal'. Therefore I try to leave my house to the mall or something at least once a day to get that feeling of being 'refreshed' and 'phew, I'm back home'.

Whenever my friends tell me to go out with them, I say yes and go along. But my feelings betray me if they cancel the plans and my heart gives a giant leap and I sink back into my chair.

Something else that could identify what my problem is: I feel like everyone is always judging me. I used to be overweight and unfit, but now I guess my body is neither bad nor good, 15% body fat and not that much muscle but nothing to be ashamed of or proud of. Yet, I still feel nervous around others, the exception being my best friends and family.

Any others out there like me please stand up and tell!",11,2015-05-25 17:45:30 EDT-0400
578,"Does anyone else get ""derealization"" feelings? How do you get rid of them?","BTW derealization is feelings of not being real or existing, like everything is a dream.",34,2015-05-24 17:33:00 EDT-0400
579,do you ever genuinely confuse feeling sick with anxiety side effects?,"last night I had Wendy's with my friends, and today I was supposed to start a new job. 


my anxiety is strongest when it comes to work, it's something I've really been struggling with and trying to overcome - but I felt fine all day yesterday, minimal anxiety about it, I actually felt excited. 


then at around 8 I suddenly felt extremely sick. had to go to the washroom, and felt like throwing up but nothing would come out. I started shaking nonstop and my body heated up, felt disoriented, and honestly could barely tell whether I felt sick from the jalepeno fries or if I was having a spontaneous attack. 


I took an Ativan anyways and fell asleep early. woke up today same thing, went to the washroom and felt sick afterwards and had to ask to come in on Monday instead. but now I'm wondering if this will all repeat on Monday, or if maybe my stomach was just upset mixed with anxiety?


anyways. my post didn't really have a point other than to see if anyone else ever struggles with this! 


there are other times I will feel my stomach going flip flop but I really can't tell if I have to use the washroom or if it's nerves. it's kind of weird. ",15,2015-05-23 16:59:00 EDT-0400
