,Title,Text,Number of Comments,Date Posted
0,"[UPDATE] after almost canceling a job interview due to anxiety, I forced myself to go, went in there, and killed it!!!","I GOT AN OFFER!!!!!!

I went back to pessimism and expecting the worst after a few days of not hearing back, but I did today, and they offered me the job!!!!! Higher pay, almost double the PTO, amazing benefits... I’M JUST SO EXCITED!!!! 

I know on my first day I’m gonna have massive anxiety and second guess everything and wish I stayed in my comfort zone but I don’t even care because this just proves to me that if I push through those nasty feelings I really can do anything!!

Thank you so so so much to everyone that gave such kind words of support and encouragement. This has been a HUGE life changing step for me and it’s amazing to be able to share it with all of y’all.

Edit: I promise I’m done bragging on myself after this but I just negotiated a (slightly, not by much but still!) higher salary as well! I’m over the moon, I can’t believe I’m me and I did this haha. 

Thank y’all, the support in this sub is unbelievable and I’m so glad these posts were able to motivate people. :) every single one of y’all has it in you!",125,2019-07-03 02:52:59 EDT-0400
1,Fuck,[deleted],130,2019-07-05 02:28:18 EDT-0400
2,Anyone else just likes to retreat to bed when things go bad?,"I just love laying in bed i normaly should be doing other stuff but bed makes me comfortable

It’s mostly during times i have to go out and do stuff my body just says NOPE and i want to cuddle down in bed and watch something relaxing.",105,2019-07-06 18:13:40 EDT-0400
3,i went to a bookstore and got a coffee by myself today!,"i have severe anxiety and it is really difficult for me to do things by myself; i like to have someone with me as it helps me feel less pressured. however, i decided to go to barnes and noble (bookstore) alone today, and they have a cafe in there. the first time i ended up leaving the bookstore without getting a coffee because i was too nervous, but i ended up going back twenty minutes later and got one!! it was so easy, and the barista was very friendly which helped so much. i’m so proud of myself, and i’m so happy. i started to feel a little overwhelmed and almost left again but i did it!! i hope you all are able to silence your anxiety like i did today, and if not, there’s always tomorrow 💛",92,2019-07-03 20:45:34 EDT-0400
4,Anyone else’s anxiety make them doubt/ second guess every choice they make/ made?,[deleted],48,2019-07-07 20:21:04 EDT-0400
5,Who else regroups in the bathroom?,"When I'm in panic mode or etc., I find bathrooms to be a useful place to get somewhere alone for a minute to regroup. Only downside? My in-laws think I have bowel issues lol.",72,2019-07-02 05:17:39 EDT-0400
6,Sending you all a virtual hug.,"If you’re reading this, I want you to take it easy on yourself; you’re doing the best you can. 

I made a post here recently and got some really nice replies that helped me a lot. I’m feeling a lot better now, so I thought I would send those good vibes back into the universe. :)",45,2019-07-01 13:24:56 EDT-0400
7,Does posting on Reddit give anyone else anxiety sometimes?,I feel like I have a lot I want to say but sometimes I'm afraid to post anything because I'm worried about criticism or mean comments lol.,106,2019-07-04 12:40:08 EDT-0400
8,"Shoutout to everyone who's to nervous to use the ""ring bell for service"" bells",,38,2019-07-01 02:45:42 EDT-0400
9,Does anyone else feel cringe trying to have a normal conversation?,"no matter what I try and think of saying, I always think it's cringe or just wierd to say even if it isn't.
does anyone else have this problem? and if so how do you get around this thought in your head stopping you from having a conversation or keeping a good one flowing? I just don't know what to say off the top of my head so I need to think what to say but whatever I come up with just doesn't feel like it's either worth saying or just sounds dumb",82,2019-07-07 13:55:06 EDT-0400
10,is anyone else an extreme pushover due to fear of confrontation?,i’m a huge pushover. i don’t ever stand up for myself and i run away from situations instead of confronting them because thinking about how the situation will play out gives me so much anxiety.,42,2019-07-02 02:54:20 EDT-0400
11,This is my exposure exercise. Posting here,,58,2019-07-06 02:31:12 EDT-0400
12,"Been out for the last 10 hours, just waiting to get home. I miss my safe space. Anxiety sucks.",[deleted],22,2019-07-05 21:38:50 EDT-0400
13,Anyone workout at home to avoid seeing people at the gym?,[deleted],82,2019-07-02 18:13:53 EDT-0400
14,Important things I learned in my recovery from anxiety,"About 9 years ago I hit my rock bottom. I was having multiple panic attacks a day. I couldn’t eat or sleep. I was isolated socially. My doctor almost sent me to inpatient. I had to take 6 months off work.  I have come along way since then. I haven’t had a full blown panic attack in years. I work a full time job, attend part time grad school, and am engaged to be married,  anxiety is still a daily part of my life, but I’ve learned how to function better and not let it control me.  

I wanted to share somethings I learned on my journey.  These are things that took time to fully embrace and make habits. I still struggle with some. I don’t expect anyone to read this and it changes then right away. I guess that leads to the first lesson. 
 
1) This is a process. There are no easy answers but putting in the time and effort can result in change. 

2) my brain is trying to trick me. I had to learn when I can trust it and when it’s lying to me. And when I realize it’s lying I know I need to re-evaluate and use coping techniques 

3) I can’t wait until I feel better or less anxious to change my behavior. Changing my behavior is what changes how I feel. My therapist always said: the same behavior leads to the same feelings. 

4) I had to let go of the mindset of fighting the anxiety or trying to make it go away. It feels awful and you want to “fix it” but that only makes it worse. I try to think of it as managing and accepting my anxiety. 

5) avoidance is a drug and my anxiety makes me an addict. Addicts take drugs to temporarily feel better but they aren’t addressing what they are trying to escape and only making the problem worse. That’s how avoidance works. I get temporary relief but then I feel worse and it doesn’t help me learn to manage my anxiety 

6) I have the right to ask for help and for what I need.  This isn’t a problem I have to face on my own. I have the right to ask for help and support from doctors, friends, family, coworkers. 

7) I had to learn to do the opposite of what my anxiety tells me to do. If someone asks me go somewhere and my instinct is to avoid it, that means I should probably do it. That’s how I learned that my brain was lying to me.  This doesn’t mean you have to do things you don’t want to do if you actually don’t want to do it for reasons besides anxiety 

8) I can function even when anxious. The anxiety can’t hurt me. It can make me really uncomfortable but I’m not in danger and I can still do what I need to do. 

9) just because I “feel” something is true doesn’t mean in reality it is actually true. I may feel I embarrassed myself at a social gathering, but in reality no one else thought i did anything embarrassing.  I had to learn how to challenge the feeling with reality based evidence

10) MOST IMPORTANT.  Treat yourself with self compassion. We are the hardest on ourselves and say things to ourselves that we wouldn’t dare say to someone else. Try to change that self talk. You are trying your best. You deserve happiness and love. You have right to make mistakes. You have the right to forgive yourself when you let your anxiety get the best of you, 
Checkout this link for more info:  https://self-compassion.org

If I think of more, I’ll add them. I’m open to questions too

Edit: thanks for the gold!",49,2019-07-04 22:10:40 EDT-0400
15,Does your anxiety get worse after being too social?,"I have a question because I'm not sure if this is just me. I've always had social anxiety, even since I was a really little kid. The farthest back I can remember having anxiety about interacting with people was around 5yo. I remember around 13, I wouldn't be able to walk down the same sidewalk if someone was coming the other way. I'd cross the street so I wouldn't have to interact with them. 

Now for my adult life, I'm still experiencing it I think. I talk to people easily now but I have something I can only describe as a rebound effect. 

I can talk to someone and have a really great conversation but then for the next few days have anxiety and panic attacks because I feel almost like I gave too much of myself away, even if the conversation was totally normal. It's not like I become very vulnerable at all. It's like if anyone knows anything more than bare basics about me or my perspectives or behaviors, I feel like I have to hide from the world. 

Does anyone else experience this? 

I'm definitely going to talk to my therapist about it next time I see him, but I wanted some advice.",27,2019-07-01 04:36:48 EDT-0400
16,“Just trust your gut”,"Pal I have anxiety, my gut is literally always telling me to abort mission",12,2019-07-02 06:10:18 EDT-0400
17,Does anyone here suffer of stronger anxiety around their birthday?,"Up until I was 22/23, birthdays were fun. Since then, I see them as depressing milestones which remind me that I'm getting older. 

I'm turning 33 next week, and I feel increasingly anxious once again. I'm 33 but still single. 

 I'm an anxious person on a daily basis but birthdays make things worse.",30,2019-07-02 17:01:57 EDT-0400
18,Good vibes,I'm struggling today. I just want to send good vibes to everyone and hope that others get through the day the best can.,15,2019-06-30 23:58:07 EDT-0400
19,I just managed to shift from a heart rate of 130 bpm and being completely terrified to a heart rate of 83 bpm and being completely calm simply by doing a 3 minute guided meditation - NO medication! YES!!! ❤️,"This may seem like a small victory or just completely unrelatable to some or maybe even most but this is a huge victory for me so I am just laying here with a big smile on my face feeling extremely grateful. ☀️🦋☀️

☀️Edit☀️ I haven’t had a chance to get back to all of your comments but I want to say thank you so much for all your kind and encouraging words! 🌹 It means a lot! 🙂",14,2019-07-03 20:40:06 EDT-0400
20,I’ve found a way to help my anxiety and it’s the way I didn’t think would ever work.,"I had to take a night job(I have two kids and a husband ) working 8pm-230am. The past week I have been having break through anxiety through my medication. 

Over time I have figured out my anxiety triggers. Lack of sleep, too much caffeine, stress and health anxiety are mine.  Well, working nights and up in the mornings with kids, you sure get exhausted fast. 
I would hate when people would say “give into your anxiety” “ride it out” blah blah. I would tell myself “yeah OK. That doesn’t work” and just continue to freak out, panic and thinking I’m about to die. Because that is obviously better than listening to advice.

Last night, we were slammed at work. I waitress and I had to run back and fourth between about 30 customers and two bottle service tables. Dark lighting, strobe lights, the worst environment for anxiety. While serving one of the tables I could see an ocular migraine starting. (Seeing lights in my vision) 
Usually, I would panic. Freak out. Thinking I was about to have a stroke or a seizure. But I have into my anxiety. I knew I have had this happen before to me and I didn’t die. So I told myself mentally, I wouldn’t die this time. I took a moment to myself in the bathroom and gave into it. I took “ujjayi breathes” which I had learned a few days prior. It means ocean breathing. I suggest googling on how to do it! It’s a life changer. Told myself, “you know what this is. Don’t let it go any further. It’s anxiety. You’re tired, you’re stressed. Don’t let it trigger you to more.” As I calmed my breathing, spoke to myself, the lights in my vision slowly went away. My HR slowly started going back to normal. My body and mind relaxed. I felt calm. And it was over. I rode out my anxiety/panic attack. I felt victorious. I finally felt like I won and I could over come my anxiety. 

I don’t know if anyone will read this or take anything away from it. But I’ve been suffering with anxiety for 16 years and I finally feel like I made a break through on it. Also, I have been listening to a podcast called “the anxiety coaches” and listening to it before work and when I want to calm and relax my body sure has been helping!

Hope this helps ❤️",9,2019-06-30 23:22:09 EDT-0400
21,Hate this,"Can't tell you how many times I turned away from an interview, denied an opportunity, or didn't meet with friends because of my anxiety. This sucks man",13,2019-07-02 21:44:14 EDT-0400
22,WHY CANT THEY CREATE A MEDICATION THAT TREATS ANXIETY INSTANTLY THAT ISN'T ABUSABLE?,[deleted],114,2019-07-05 18:38:29 EDT-0400
23,Anxiety is ruining my life.,"I've had anxiety my entire life, although it only got very serious starting late junior year of high school. As a result of my anxiety I am constantly sick to my stomach, lost 60 pounds in a year by just not being able to eat, and have severe anxiety spikes from literally everything. Even dreaming which used to be a time of peace for me has become a spot for my brain to wake me up, sick from anxiety because of my dreams. I cant go out with friends because the thought of it makes me puke. I cant text my friends because the thought of it makes me puke. I got sick in the car once when I was eight, now the thought of being in a car makes me sick. I dont even know how to deal with this anymore. Almost everything in my life gives me crippling levels of anxiety and I just cant deal with it. 


I apologize for the rant, and for its uncohesiveness, I just needed to vent.",25,2019-07-05 16:20:16 EDT-0400
24,Im afrad and anxious that i might never find someone to love,[deleted],39,2019-07-02 02:41:07 EDT-0400
25,Treatment for anxiety - what works for you?,"Hi, so I'm 18 I've had social anxiety for since i can remember - recently however I've struggled intensely with health anxiety and am curious about what has worked for other people, specifically how antidepressants can help?

I was prescribed antidepressants for anxiety last year but was too anxious to take them lol. I want to try get them again, is it worth it? I'd most likely be on a low dose of citalopram (UK).

I tried therapy (CBT) it did nothing for me. I find it hard to implement the behavioural techniques you learn at therapy.",10,2019-12-10 23:36:29 EST-0500
26,Deep breathing - vagus nerve,Good read - https://www.thecut.com/2019/05/i-now-suspect-the-vagus-nerve-is-the-key-to-well-being.html,0,2019-12-10 20:55:22 EST-0500
27,Just woke up to a shit day,[deleted],0,2019-12-10 23:36:58 EST-0500
28,I've finally realized that's in not my fault.,[deleted],0,2019-12-13 04:31:07 EST-0500
29,I think I might try to start keeping a record of every major in-school freakout I have.,"I am in middle school currently. Occasionally, I end up having a bit of a, I don't know how to word this, ""freakout."" Like I get frustrated or something, overly stressed, other things. Occasionally I can keep myself under enough control that I can stay in the classroom. Sometimes I have to leave for a few minutes to calm down. Well, my parents know that they happen, its been a problem for as long as I can remember, but I never tell them nowadays when it happens, so I think I might start making a log of ever major time it happens(like today, where I got way too frustrated during History and had to leave for a few minutes to calm down).

PS see  [https://www.reddit.com/r/Anxiety/comments/e7ypk5/what\_would\_you\_say\_about\_this/](https://www.reddit.com/r/Anxiety/comments/e7ypk5/what_would_you_say_about_this/)",4,2019-12-10 23:03:21 EST-0500
30,"I’m tired of having this small, lonely, repetitive life","I’m tired of having this small, lonely, repetitive life. And if I have no life you’d think that would mean less to be exposed to, so less to be anxious about. But I’m scared of everything, even my own thoughts, and yet I’m just in my own home. It really saddens me. Im not even asking to enjoy life, I just at least want to feel safe..",4,2019-12-10 22:24:46 EST-0500
31,How do you deal with the regret that anxiety has made you 'miss out'?,"So I've been dealing with really intense regret the last few years. Some quick background:

Moved out of my parents house in my 3rd year of uni and lived by myself for the first time. Had my first panic attack one night, that spiralled into constant anxiety symptoms, depression, chest pain, crying. Got diagnosed with GAD soon afterwards, and have been dealing with it since. This has taken the form of therapy, meds and group therapy.

I'm 33 now and I've spent loads of the past 13 years fighting against my anxiety. Once my anxiety came on in my early 20s, it became harder to make friends. It really destroyed my self-esteem and made me feel so unlikeable. I feel I always have a guard up and find it difficult to make meaningful connections. The severe anxiety took a toll of the way I acted and many of my friendships in college fell apart. I'm envious of seeing my friends with their circles of close friends, having fun, and I just feel like I'm too old and anxious to really make a change. Even at work, I feel my coworkers are much closer with eachother and I'm kind of the misfit. I missed out on partying/socializing in my 20s because I was just too busy dealing with my anxiety. I don't travel because I'm terrified of airplanes. I have awful health anxiety which really limits what I allow myself to do out of fear. I didn't drink until I was 25 because I was scared of alcohol and what could happen. And now, I can no longer drink because of the anti-depressants so that social lubricant I enjoyed is gone.

I just keep thinking about how so many people got to really enjoy their 20s and foster friendships with others. I try so hard not to wallow in regret because I know it's a waste of time, but it's hard not to beat up on myself and feel lonely and hopeless. I know I should be grateful for what I have, and part of my problem is that I am deeply pessimistic. But I figure others here can relate - How do you deal with these thoughts and feelings?",13,2019-12-13 03:28:21 EST-0500
32,How Has Anxiety Impacted Your Career?,"Hey all,

I am working with a professor at a local university to write an opinion piece about the ""hidden costs"" of anxiety. A lot of academic research has focused on the costs of seeking treatment for anxiety, but less has been about how anxiety impacts career choices. Curious to hear from this community...how has it impacted yours? Have you declined opportunities for advancement, felt like anxiety affected job performance, left the workforce altogether, etc?",7,2019-12-10 22:26:03 EST-0500
33,"I've always been this way, but it's gotten worse.",[deleted],1,2019-12-12 11:38:00 EST-0500
34,Inderal,"Anyone take inderal for anxiety ? I just got prescribed 10mg today. Did you have bad side effects? Did it even work? I’ve taken lexapro, Wellbutrin, Xanax Valium etc. currently take adderall (have for 10 years now so it’s not causing anxiety), trazadone as needed for sleep.",0,2019-12-13 00:29:45 EST-0500
35,Made the decision to get back on the tablets,[deleted],0,2019-12-13 01:05:43 EST-0500
36,I avoid social media when I'm anxious and I hate it,[deleted],0,2019-12-12 17:08:27 EST-0500
37,Does anyone else shake anxiety hits?,[deleted],0,2019-12-12 19:22:53 EST-0500
38,I'm Going to Public School After Winter Break,[deleted],0,2019-12-12 19:35:29 EST-0500
39,To what extent can anxiety cause shortness of breath?,[deleted],4,2019-12-12 16:25:33 EST-0500
40,Overwhelmed,"More often than not these days, I have so many thoughts, ideas and tasks up my mind that one moment they come, next moment they gone and I can’t recall it. Makes me feel even more pathetic. And when I do recall by chance, there’s another anxious feeling that I shall forget it or won’t do anything about it.
And when i do, i mostly end up burned out soon. 
I feel like all the anxiety over years might be affecting my cognition. Or maybe not,  because this thing comes and goes.",0,2019-12-12 20:38:27 EST-0500
41,Anxiety moment even when it's just a stupid reason..,[deleted],0,2019-12-12 18:53:59 EST-0500
42,I need help trying to calm down,"Every time I hear my name (it it is a very rare one)
I feel like my heart drops and I start breathing heavily
And I start shaking. Any advice?",2,2019-12-12 18:36:30 EST-0500
43,23M starting university in new year,"I'm 23M from South africa. Going back to university next year full time for a degree im passionate about . 
Worried about being too old and still dependent 
Been to university for 2 years previously  and dropped as I got sick and that's when anxiety and depression set it . Am on medication for clinical depression and anxiety and doing great actually. 
However I left my full time job to pursue this and in my gut I know it's right.  I'm living with my parents comfortably , have my own car, go to gym- will feel a bit of guilt considering I'm gonna he leaching for a few years . ( the degree I'm gonna complete will allow me to get a better salary significantly and is quiet easy to get a job with)

Now the advise needed- 
- I start college in late JAN , what do I do with my time until then and my mind races and i get headaches at times from overstressing. 
- I've isolated myself from friends and actually don't  enjoy going out with them. Enjoy being hy myself or one friend somewhere quiet and not busy",0,2019-12-12 21:04:07 EST-0500
44,I guess I just need to be grateful.,"So much in my personal life is causing my anxiety to explode. And yet at work I'm making huge strides, completing huge projects and getting adulation from my bosses.

I guess I need to have gratitude where its warranted. I've come so far on this journey through GAD. I need to love myself and be grateful for all my progress. And yet it's so hard to forgive myself for all I've let my anxiety taint.

I'm not sure I can ever forgive myself. But I'm working on it every day.",2,2019-12-12 03:17:36 EST-0500
45,Having major night anxiety,Has anyone decided to fully quit their job because of their anxiety? I’m starting to wonder if it’s right for me... I suffer from horrible night anxiety but only especially if I can’t sleep and then I’m laying there “ugh 7 hours... 6 hours until my alarm” and making yourself miserable over it even though it’s not a big deal to go a little tired sometimes.,3,2019-12-12 03:54:32 EST-0500
46,I can’t make big plans. I panic. I then get anxious about the fact that my life won’t change if I can’t make big plans.,[deleted],0,2019-12-12 05:55:02 EST-0500
47,Life is hard.,"I’m currently coming down from an anxiety uproar...  I tried to make things right today but it just seemed like everything I did made things worse. Details : 1 son oldest is from one ex. Other kids I live with (unfortunately their mother as well until lease is up)

1. Had to deal with my anti-vaxxing ex today at my daughters physical.
2. Phone wasn’t working properly so gf who also has anxiety/depression wasn’t able to FaceTime me.
3. Picked up my son ,When I did talk to gf, she gets disappointed to the point I feel guilty, that I can’t come visit her (45 min drive she comes down every weekend).
4. Went to cash check, deposit small amount into gfs account (same small bank) because she’s 45 mins away and can’t get her check until Friday and needed groceries (we work at the same place) . She get angry I messed with her account at all (even though I was given 0 access to her account. Just was able to deposit because the banker knows us both.)
5. Apologize and have an anxiety flair because I’m messaging gfs roommate/sister about how I screwed up and how to rectify it.
6. Proceed to freak out all night and not enjoy my kids at all and ask ex to watch kids to go see gf, she proceeds to message gf to make sure everything is ok...
7. Am now feeling stuck with kids and a mild anxiety level... all because I can’t deal.... I hate this feeling of being on the verge of crying 

Tried grounding technique of ice on my neck but not feeling confident.",0,2019-12-12 05:12:16 EST-0500
48,I’m undiagnosed and I don’t like saying I have anxiety.,"I don’t actually bring up my anxiety a lot at all. When I’m anxious, I say I’m stressed out, because I feel like if I call it being anxious I’m just trying to get attention. When I want to say that I have anxiety, I say that I can’t do things without freaking out or panicking. I’ve told my friends that I have anxiety, but I don’t like bringing it up because I feel like I’m faking it for attention without even realizing it. I wish I could get diagnosed, but I’m not old enough to pay for a diagnosis myself and my mom can’t afford it. I don’t like people who constantly bring up their mental disorders, especially if they’re lying about them, because it just seems like they want attention and I don’t want to be like that, so I always try to refrain from saying that I have anxiety. Is this good or bad? What can I do about it? Is it normal? Is there an alternate way for me to get diagnosed?",2,2019-12-12 05:09:35 EST-0500
