,Title,Text,Number of Comments,Date Posted
298,"I got 'Oinked' at in the subway, and now I can't bare the thought of going outside again.","Okay look, I'm a bit overweight. No getting away from that. But I carry it fairly well, and my overall physical appearance has not altogether bothered me *too* much until now. But after months and months of barely being able to leave my house, I put on some good clothes today, and decided I was ready to go and do something useful. Actually it was to go and view a new apartment, because I've been thinking I need to get out of my comfort zone - new apartment, new life, right? Well, maybe. But as I was coming out of the ticket booths on the train some guy literally oinked in my face. He leaned across from me in the turnstiles and properly pig-oinked. I didn't actually notice  it was towards me at first, but once we'd buzzed through he looked back at me and oinked again three times. It was the middle of the day, there was absolutely no reason for it, but it just.. it absolutely floored me. Maybe I'm worse than I thought? Maybe it was a huge mistake even leaving my house in the first place? Jesus, I just wanted to turn right around and go home.

I managed to make it to the house viewing, and I liked the apartment, and I may well take it, but this is all I can think about. I want to sink into the floor. I want to utterly disappear. Of all the things that I disliked about myself, of all the issues I have had with myself, my exterior has been 'okay'. But even that's gone, now. I need to just get over this, right?

Edit: I woke up this morning so some really wonderful comments, and I just want to say a big thank you. There are some crappy people in this world, but whenever I feel it getting to me, I'm going to come back and re-read your kind words.",33,2019-09-26 21:44:25 EDT-0400
299,I took a big step in tackling my anxiety today.,[deleted],11,2019-09-26 07:16:36 EDT-0400
300,Posting to Reddit is scary,"I'm scared to post anything here. I can't count the number of times I've had an entire post/comment written out, and I delete it because I get scared. Getting downvoted is terrifying to me. If I have an opinion that might be umpopular, delete. It's not that I don't know how to express myself, I'm just scared to.",97,2019-07-25 12:57:05 EDT-0400
301,"Hey, Can I have a moment of your time?","Thank you for reading this. I would just like to let you know that you are a wonderful, amazing person. You can do anything as long as you put your mind to it! If anyone of you reading ever need to talk, know that I am here for you. I believe in you! Have a great day and don't forget to smile!

Edit: Thank you so much for all the kindness! I never thought that this post would become this popular! And thank you friend for the gold! It is highly appreciated! Love you all and have a good night for some of you, good day to the rest, and remember to keep a smile!

Edit 2: I have no words for how happy you all made me! These are my first ever awards! Thank you all so much!",113,2019-07-26 03:12:05 EDT-0400
302,DAE get nervous to return to work or school after you've been away for a little while?,"For me, it doesn't seem to matter how comfortable I am somewhere (though it is worse at newer/less familiar places), but if I get sick or something and skip a few days of class or work, I get really anxious to go back. Particularly when I've been sick because I'm afraid I won't be totally better and I'll have to come home or it'll cause a lot of problems. Right now, I'm returning to work after leaving sick last week and I'm really anxious about it.",79,2019-07-24 03:29:22 EDT-0400
303,Does anyone ever get an attack—when NOTHING is happening?,[deleted],150,2019-07-22 13:52:13 EDT-0400
304,I finally did it!,"For lunch today I went out to my local McDonald’s, and I actually sat down and ate my food inside, without any friends or family there! 

My main thing is I hate going places alone because I feel like everyone is watching me, but when I was eating I just focused on eating and texting my friends. I’ve been meaning to apply for a job, but I don’t know if I’ll be able to walk into the store to ask about it.",152,2019-07-24 20:32:01 EDT-0400
305,Ever feel overwhelmed by the amount of evil in the world?,"I'm a bit of a history buff, and I made the mistake of watching some documentaries on the fascists of the early 20th century recently. Naturally they discussed things like the Holocaust, the Red Terror, and other atrocities of that era.  That shit really gets to me, and lately I've found myself being overly sensitive to every terrible thing on the news as a result.  A college girl goes missing, a boy is murdered by his step-dad, etc; you get the drift.  It can be a little over whelming sometimes.  I just don't understand how human beings are capable of doing such horrible things to one another.

Does anyone else struggle to process this stuff, and how do you deal with it?

**EDIT: I've been reading all of your comments for the last day, and I just wanted to thank everyone.  You tend to *assume* people feel the same way you do on common sense issues like this, but actually seeing individual responses and everyone's different ways of coping is very therapeutic.  It's nice to know I'm not alone.**",83,2019-07-27 00:12:28 EDT-0400
306,I got a job!,"I have lived with crippling anxiety since I was 17 (I am now 22).
This caused me to become so ill I couldn’t even leave my house without being sick, I was put on medication when I was 19 which has helped me immensely
I never thought I would have a job but here I am
It feels so surreal 
I’m proud of myself :)",44,2019-07-27 20:40:58 EDT-0400
307,"Have a positive day, you’re stronger than you know","Just sending positive vibes to everyone here. We all know how frustrating and exhausting anxiety can be, don’t let that discourage you. You’re so much stronger and you have so much more life in you than anxiety will ever tell you. It’ll discourage you from living your life today. Live your life anyway! 

I get bored at work so if anyone is having trouble feel free to comment/dm and I’ll at least send my regards even if I have no answers for you.",36,2019-07-28 16:14:43 EDT-0400
308,DAE trigger anxiety simply because your brain was like hey remember you have anxiety?,"I was chilling on my couch, sort of relaxed (which has been really hard this past week). Then suddenly my brain was like ""WOW! Almost forgot that we usually have this sinking feeling in our chest! Aahhh shit here we go again!""

Anyone else feel this way? This is sort of just a rant. I definitely want to fix this shit.

Edit: Wow! So much feedback overnight. Thanks guys <3 Being able to relate really helps me keep fighting. Hope this helped some of you as well. We got this! :)",48,2019-07-28 05:32:12 EDT-0400
309,Getting out of bed is hard,[deleted],36,2019-07-26 17:34:45 EDT-0400
310,I survived my first week of work !,"Last week i survived my first week of work, it was really stressfull, i was jumpy and really not myself at all. I think my symptoms all came rushing all at once, even if i knew i did everything right. I was afraid of everything and everyone, dread talking to people. Friday i was basically mentally exhausted.

Then came the weekend, i slept a LOT, evacuated everything with tennis and a lot of food and alcohol, cried a lot. Then yesterday was better, my apetite and my emotions came back. Im taking baby steps and doing a lot of breathing exercices and self-talk and for the first time in months, i feel like im making progress on controlling my anxiety and im proud of me ! It does get better.

Have a good day everyone.

Edit : Wow, i didnt think it would blow up this much ! Will try to respond to everyone if possible xxx",29,2019-07-23 16:10:28 EDT-0400
311,To all the people w anxiety that work customer service...,Y’all are so strong. Customer service is so shitty even for the healthiest people. Keep your heads up,50,2019-07-22 01:54:25 EDT-0400
312,One of the worst parts of anxiety,"Is being right. When you worry for days on end about something, something you really don’t want to be true. Then you find out you were right, and it seems like justification for the stress and overthinking you’ve gone through. In my opinion it’s one of the worst things that can happen.",31,2019-07-26 21:02:37 EDT-0400
313,Anyone get anxious with heart beats?,"I’m usually not anxious over the fact there’s something medically wrong with my heart. It’s just I can’t sit still, and I get an uneasy feeling when I hear my resting heartbeat. I get uneasy hearing it on movies, or hearing other people’s hearts,too. I’ve looked this up and I have barely found anything on the subject. I also get uneasy with talk about tendons, muscles, and veins. It freaks me out and I can’t relax. I’m not sure why.",98,2019-07-23 02:26:24 EDT-0400
314,I have no personality outside of my anxiety,"The title is pretty much it. I don’t have any hobbies or interests, I don’t really feel, think, or talk about anything other than my anxiety and depression. That’s probably the reason that my circle of friends is down to about four people that I barely interact with. Idk, I know anxiety can really become like a personality trait, but I wish it wasn’t the sole contributor to my personality, ya know?",38,2019-07-24 17:47:10 EDT-0400
315,Does anyone else’s anxiety increase after too little sleep?,[deleted],44,2019-07-22 15:15:42 EDT-0400
316,My anxiety is about anxiety - I get super anxious thinking I'm always going to feel anxious for the rest of my life. Anyone else?,"I was sitting in my chair at work writing an email when I got a HUGE surge of anxiety for no reason whatsoever.  It ended up being that I was anxious that I was ""stuck"" in this anxious mode.  It felt like I was going to die, and that's all I was anxious about.

&#x200B;

Anxious about my anxiety.  The fuck?""",24,2019-07-23 00:31:33 EDT-0400
317,I picked up the phone from an unknown number :D,"not sure if i qualify for this sub, but i think it's the best place to share 😅

so i usually freeze up when my phone rings and it's not a close family member/an unknown caller, but i still answered this time! it felt great too :D

alas, it was just a salesperson thingy. i wished her a good day and hung up and threw my phone off the window.

next time i'll try breathing really hard into the mic to see what happens.",11,2019-07-27 15:36:05 EDT-0400
318,Does anyone else here just cry for no apparent reason?,^^ I’ve cried more this week than in a long time idk what’s going on. What are some ways that people deal with this?,18,2019-07-23 05:29:59 EDT-0400
319,Please help me get help,"I'm so afraid of posting things that even after years of using reddit I only recently made an account so I can upvote things. I feel like what i'm doing is wrong, and part of the reason I'm posting this here, on r/anxiety, is because it's such a large subreddit that hopefully nobody sees it, I would hate to waste someone's time. I want to post things on r/adhd and ocd very badly, but I need reassurance that what I'm doing ok and isn't a complete waste of time. And if it is, please downvote it so less people would see it. I know I'm going to regret posting this and I'm already very angry at myself for how long this post is getting, so sorry, my deepest condolences. Have a nice day.

Edit: Thank you to every one that replied and upvoted, I read every single comment at least twice and am very grateful for all of them. I never realized how many people would see this, let alone take their time to respond with reassurance and advice. I don't know how to respond other than I'm doing even better after reading these, and will probably go post something on a smaller subreddit later today! Probably.. Most likely.. :')

Thank you!",11,2019-07-22 10:08:25 EDT-0400
320,This is a long shot but does anyone else suffer from diarrhea and anxiety?,"I get *really* bad diarrhea like once or twice a month and sometimes it corresponds with when I'm feeling anxious. 

I don't know for sure if it's related. It's possible that it could be a gut disorder, but I'm wondering if anyone else who has anxiety experiences this.",54,2019-07-27 00:59:00 EDT-0400
321,I finished therapy two weeks ago and I have a job interview tomorrow.,"I dont have much more to say, I'm just really proud. Its been a hard five years but i finally see the light at the end of the tunnel. I'm doing it folks! 😊",8,2019-07-22 05:15:57 EDT-0400
322,"Do you ever have a great conversation with someone, and then when you walk away you think ""They probably we're faking everything and are now talking about how annoying I am"".","This is why I have no friends and even when I could form relationships, I could never keep any because of it.

\*\*\* It should be ""were"" in the title, but i don't know how to change it.",11,2019-07-28 10:00:37 EDT-0400
323,"I know it sounds dumb, but my whole anxiety relies on my room being my ""safe space"". And now I moved...","My anxiety is pretty high most of the time and my only relief is knowing that my bed awaits me at home. My room, my bed, my safe space where nothing bad happens. Even when I am away for weeks on holidays, as long as I have my own room, I am fine. I need to know that I have my own place I can flee to. But now I had to move, and I have a new room. Usually ANY room would do it, but this one just doesn't feel right. I'm not sure why. I think it's ""too open"". I can hear the people outside, my neighbors, everything. I don't feel like inside ""my tiny cave"". 
I don't know how to survive like that. I feel so overly stressed since I'm here.",16,2019-07-23 23:41:00 EDT-0400
324,“LoOkS lIkE sOmEoNe cAmE oUt Of ThEiR lItTle DeN,[deleted],6,2019-07-26 02:46:04 EDT-0400
325,My anxiety has been permanently cured!,[deleted],191,2019-04-01 18:34:40 EDT-0400
326,"I’m a young kid with really terrible death anxiety. For the first time, I’m visiting my grandfather’s grave. Grabbed some ice cream on the way... feeling very nervous but wish me luck, going with a smile for him! :)",,89,2019-04-07 03:47:19 EDT-0400
327,Decided to face my fears head on! Went on my first flight since getting PTSD. Was quite concerned about how I’d cope. But used a new technique. Not so big and scary anymore are ya panic attacks!! Didn’t panic and feeling so much more confident for the next trip!,,112,2019-04-06 04:22:18 EDT-0400
328,"Most people are accepting of you having an anxiety disorder, but an unfortunate amount of people expect you to only have symptoms in private.","A stigma that I’ve noticed in the mental health community... so many people are happy to talk about it and embrace your differences, but oh no.. don’t have a panic attack in front of them, don’t seek re-assurance from today’s anxious thoughts and jitters. 

This is something that needs changing. It is more than ok for someone with diabetes to be comforted even when their their blood sugar gets too low and it affects their work. Even if the circumstances of the blip in their health was due to poor diet or a rough week (I had a co-worker that had this happen at work) but when I struggled with low mood I was told ‘we all have days like that’ ... ‘don’t let customers see you unhappy or uncomfortable’ 

This is an issue with how subjective everyday anxiety and a chronic mental health issue is, if someone does not understand the effort it takes to behave normally they will default to judging you based on how they deal with it. 

Of course it’s not all bad, I’m lucky to have family and a handful of friends that have seen me go though treatments and recovery so know the full spectrum of my issues and do not judge or baby me. 

I felt like sharing this little rant to hear your thoughts on if you’ve been accepted or told to ‘hide’ symptoms from the public to spare THEIR discomfort... like your doing it on purpose. ",117,2019-04-04 20:26:58 EDT-0400
329,Can someone wish me a happy birthday?,"I don't really have any friends in school or in general because I'm very anxious and socially awkward so therefore nobody wished me a happy birthday today, so I was wondering could anyone wish me a happy birthday here, it would be really appreciated!

Thanks.

Update: I went bowling and had a nice day in the end, everyone's kind words, support and advice really made it a lot brighter! Thanks to everyone!",634,2019-04-02 20:57:14 EDT-0400
330,Sometimes I refuse to open a email because I'm afraid of it's content,[deleted],95,2019-04-06 16:22:28 EDT-0400
331,I got rid of Facebook and Instagram today after 8 years.,"I couldn't feel better, it's like a weight has been lifted off me and alot of stressful ties cut. Now I can live in the real world without being too sucked into my phone, and the only people that can contact me are the people I want to be able to. For years I lived a very bad life, and now I feel safer it won't come back to bite me.",104,2019-04-07 20:31:24 EDT-0400
332,I hate calling people,"Especially when it's people who call asking for information (doctor, insurance, etc.)

&#x200B;

If I tell them I don't know, they seem to get frustrated at me. Sorry that I don't know everything.",74,2019-04-04 01:20:10 EDT-0400
333,"After social interactions, namely at work, I get a lot of anxiety thinking about what I said and people’s reaction to it. Keeps me up at night (like now it’s 3am). Specifically I think about how stupid a comment I made was, how desperate I must have seemed,and other negative things. Why is this??",,64,2019-04-05 11:09:24 EDT-0400
334,Is anyone else just realising their anxiety isn’t normal?,[deleted],77,2019-04-04 14:15:19 EDT-0400
335,Why does nobody like me? Please tell me someone else feels this way.,[deleted],89,2019-04-03 14:32:59 EDT-0400
336,Does anyone repeat TV shows or movies to sooth anxiety?,"Lately I've been watching Star Trek Discovery... It's only got 2 seasons but Ive rewatches both at least a dozen times all the way through... It's like my routine... While I'm at woke or when I wake up or at night I can't help but rewatch the same episodes I've already seen before....

There's something soothing about watching something familiar over and over again.

Does anyone else do this? ",200,2019-04-04 17:55:08 EDT-0400
337,"Anyone else have those nights where you end up just lying here, questioning your skills and capabilities?","Of course it has to be the night before coming back from spring break. It's nearly 3AM now and I have already written today off. Fortunately I only have a 7:30AM class and a 3PM class. Planning E-mailing my professors, slipping in my homework around 6AM and just staying up the whole day so I can, for sure, crash out 'tonight'.

For the past three hours I have been tossing and turning, wide awake, deeply and critically questioning myself.

This week off killed me. I feel as if I should NOT have taken a break from my studies. I know by next lab I am going to feel like I am square one again and I am stressing out.

I start to look at all of the time that I am not studying or practicing was just time wasted. I could have written programs, applied my in-class learning to my own projects.. heck I could have built something for my long-term.

Does all this need completed before I get some null time? I haven't proved myself incapable (yet) but holy heck I always feel like I am hanging on by a thread and talking myself out of doing something productive is becoming more and more persuasive.

I didn't want to talk myself out of missing the first day back of lectures, but there is no way in heck I will be able to operate on <=3 hours of sleep. Though only two classes, I work an internship on campus between those for a total of 8 hours straight. It will be the first day I miss and the professor in charge is understanding. I'm just going to be straight up... this first day back is really siking me out. Going into my 3rd year of college I should be well over this petty freshman mentality. Yikes.",9,2019-04-01 13:56:12 EDT-0400
338,MY ANXIETY AND DEPRESSION HAS MADE ME MISS A MONTH AND A HALF OF COLLEGE,"English isn't my first language so if its a bit bad i'm sorry

A little backstory i moved from Asia to Europe for my college degree(comp.sci) , i have never really lived alone and I've always had people i know around me and never felt alone before, I don't really have anyone to talk to or get closure so i thought i might as well post here and get some advice and maybe how knows i might even feel a bit better

As i said i moved from Asia to Europe I've been here for nearly a year (still a first year) and my first semester was a decent semester i got good grades 8/10s in most of my classes except for calculus which i failed even though i tried my best (not really good at math) i guess that's when it happened i had my first real panic attack mind you i have failed in classes many times in high-school failing wasn't the issue facing my parents was, for nearly a week i didn't attend any calls from my mom or my dad or my sister, they were really upset obviously i lied to them and that i was on a trip with friends and i haven't used my phone because i was having ""fun"" with my friends and i dodged the question for a couple more days and eventually told them and clearly they were upset but was understanding they knew that was pretty bad in math they told me it was alright and told me to do better when i retake the class i felt a bit better i guess, but that was just the starting of the problems i started to have like a pit in my stomach even if i  just wanted to go outside to get food or do anything normal i felt like this for nearly a month but i still was stubborn about it and the second semester started, the nail in the coffin for my anxiety to just go out of control i was just about to go to enter my class when i heard the supposed people i called my friends were talking about me they were calling all kinds of bad things talking about how ugly i looked (i already had issues with how i looked because i was bullied about how i looked through out middle school right untill i finished highschool so that really hit me hard) and how they were trying to get rid of me but i was bit clingy, i just froze i didn't know what to do they hadn't seen me so i just turned back and just bolted home trying not to cry and just shut myself off from everything i couldn't even sleep without crying i couldn't even try to go to class just the thought of it makes me feel like i want to die

And that leaves me here right now i can't even talk to my parents or my sister and i'm really down right now and i don't really know what to do coupled with the fact that i have missed almost every test and assignment given untill now i'm most likely gonna get fucked by the end of the semester so yeah i just wanna get this off my chest so i can feel a bit better i guess

&#x200B;",19,2019-04-02 16:43:18 EDT-0400
339,"Finally finished- my little meditation space! A little ""place"" for me to go when my anxiety is getting a bit much.",,26,2019-04-02 03:53:43 EDT-0400
340,"Anyone else spend too much time typing up a sentence, only to delete it all at the end?","My timid personality isn't just reflected outside the house but also here on reddit! My worst fear when writing essays is that I won't have time finishing it all because of how slow I type my sentences. I always fear that my grammar and use of vocabulary will be judged negatively, which is why I tend to spend a lot of time thinking of what I should say, only to lose confidence at the end and delete everything.

&#x200B;

I have\* spent 2 minutes writing this short paragraph. I have no regrets, but does anyone else suffer from this? It's come to the point that it's affecting my studies, and I'm deathly sick of this!

&#x200B;

EDIT: Wow, this is the first time my post went over 200 votes! Thanks everyone :)",28,2019-04-04 13:57:02 EDT-0400
341,I have something to say,"AAAAAAAAAAAAAAAAAAAAAAAAAAAAAAAA AAAAAAAAAAAAAAAAAAAAAAAAAAAAAAAA AAAAAAAAAAAAAAAAAAAAAAAAAAAAAAAA AAAAAAAAAAAAAAAAAAAAAAAAAAAAAAAA AAAAAAAAAAAAAAAAAAAAAAAAAAAAAAAA AAAAAAAAAAAAAAAAAAAAAAAAAAAAAAAA AAAAAAAAAAAAAAAAAAAAAAAAAAAAAAAA AAAAAAAAAAAAAAAAAAAAAAAAAAAAAAAA AAAAAAAAAAAAAAAAAAAAAAAAAAAAAAAA AAAAAAAAAAAAAAAAAAAAAAAAAAAAAAAA AAAAAAAAAAAAAAAAAAAAAAAAAAAAAAAA AAAAAAAAAAAAAAAAAAAAAAAAAAAAAAAA AAAAAAAAAAAAAAAAAAAAAAAAAAAAAAAA AAAAAAAAAAAAAAAAAAAAAAAAAAAAAAAA AAAAAAAAAAAAAAAAAAAAAAAAAAAAAAAA AAAAAAAAAAAAAAAAAAAAAAAAAAAAAAAA AAAAAAAAAAAAAAAAAAAAAAAAAAAAAAAA AAAAAAAAAAAAAAAAAAAAAAAAAAAAAAAA AAAAAAAAAAAAAAAAAAAAAAAAAAAAAAAA AAAAAAAAAAAAAAAAAAAAAAAAAAAAAAAA

Thanks I really needed that",19,2019-04-04 19:58:04 EDT-0400
342,I want to be a kid again...,...so I could not give a shit about life and just play with my action figures.,17,2019-04-04 20:14:13 EDT-0400
343,Just a thank you to a kind stranger,"Had a horrible panic attack this morning on the subway. I felt it coming, my chest tightened, my vision started blackening and eventually fully went out. I was getting wobbly to a point I felt i might fall over and started moaning/making noises without meaning to trying to calm myself as a sweat broke out over my whole body. A sweet woman noticed I wasn't feeling well and helped me off at the next stop. Walked me out of the station to a bench outside and sat with me until I could speak and tell her I was okay. 

&#x200B;

It's been a long time since I've had such a bad attack and my first time in such a crowded place as the NYC subway during morning rush hour, so your kindness was beyond helpful and appreciated. 

&#x200B;

Still feeling very foggy and strange but I don't think I should leave work. Anxiety is a bitch.",8,2019-04-03 18:14:32 EDT-0400
344,I am manually breathing out of fear of breathing too loudly in class send help,[deleted],21,2019-04-03 17:03:09 EDT-0400
