,Title,Text,Number of Comments,Date Posted
274,Does anyone get huge waves of anxiety that wash over you from head to toe?,"When my body has tried everything it possibly can to tell me to get the hell out of a situation i'm in (sweating ,twitching ,balance issues ,racing thoughts ,chest pains ,dizziness ,lightheadedness.) I get to the point were I know that I'm just going to faint and I close my eyes and instead of fainting I feel a huge roller coaster drop/adrenaline rush travel all through out my body. It scares the shit out of me and it's only happened twice once when driving on the interstate and once during jury duty when an attorney started questioning me.

Thanks in advance 

also does anybody get the weird balance issues? Like I'll step on my gas pedal and I'll miss it and get a ""falling in a chair backwards sensation"". That sensation also happens when I lean on something and it gives a little. 

",5,2015-10-13 19:12:18 EDT-0400
275,A simple metaphor that really spoke to me and will hopefully bring you some peace.,"I met with my Psychologist the other day and he said something that really spoke to me.
He said to think of anxiety like a rain storm. They come and go, and eventually, you learn the signs to know when to expect them. Sometimes they turn into thunderstorms and become a little more uncomfortable. Sometimes they may even spawn a tornado. But after a little while, they pass and it's over. 
I don't know why I'm holding onto this but it's really helped me. Hopefully it can do the same for someone else.",17,2015-06-14 17:04:51 EDT-0400
276,For anyone with low self-esteem on reddit today...,"Especially those with ED, hang in there.",66,2015-06-11 22:22:48 EDT-0400
277,"It sort of sucks when you consider actually getting out of bed a ""victory"".",[deleted],28,2015-06-11 00:48:26 EDT-0400
278,I gave a presentation in front of 40 people today,"Public speaking has been my biggest trigger for anxiety and panic attacks for as long as I can remember. I failed a communications class in college because I had to run out of the room to vomit in the middle of my speech. 

Over the years, it has gradually gotten easier, but it was still a struggle, and any time I had to speak in front of more than two or three people, my face would be on fire and my voice would shake. 

Two weeks ago, my manager asked for volunteers to present during an important meeting with high level executives. As scary as it sounded to me, I feel like I need to start stepping out of my comfort zone if I want to move up in my career. I volunteered.

I had help creating the presentation, and met with my manager and ran it through with my husband to make sure I was fully prepared. I delivered my presentation this morning to a room full of people, including high level executives, including the president of our business segment.

I did great! I was nervous leading up to it (which led to me spilling my coffee all over a co-worker and then running to the bathroom to cry because I felt so bad), but when it was time to get up there, I was confident, poised, and completely prepared. I spoke clearly (I have issues with projecting my voice and I tend to speak very quietly), didn't stumble over my words, and my hands were steady as a rock. I got compliments from all the higher-ups, and I feel so great about it.

I wanted to share this story with all of you, because I never thought I'd be able to do this without passing out or worse. But I did it, and I did it well, and I feel so positive about future public speaking.

Yay!",30,2015-06-09 23:57:42 EDT-0400
279,There is nothing wrong with you.,"As the title says there is nothing wrong with you and it never was. Your body works just as it should if there was a danger at hand. The limbic system initiates the fight/flight response if it thinks you are in danger, and it cant tell the difference between a real danger and a made up one. The limbic system makes conclusions from how you behave and respond to different things. If you are avoiding normal activities the limbic system will observe and conclude there is a danger thus initiating the fight/flight response. If you constantly think there is something wrong with you and you search for an exit the limbic system concludes that there is a problem and initiates the fight/flight response. Stop using avoidance techniques and stop thinking there is something wrong with you, there is nothing wrong with you it never was. Anxiety should be called protection circle as it is just your body trying to protect you. Dont be afraid of the symptons, as it is the bodys way of getting ready to fight/flight. Even when you throw up it is a way to make you lighter to move faster. So you accept that there is nothing wrong with you, now what? The nice thing is that the limbic system reprogramms itself. You need to do the things you have been avoiding, you need to act normal when you feel anxious. You need to live your life like a person that never was trapped in this protection circle. When you act normal even tho you are anxious the limbic system concludes that there is no problem and initiates the rest/digest response instead. The limbic system will reprogramm, it wont happen over night. It will steadily get better, and eventually the rest/digest response will be initiated most of the time. It might be hard to act normal when you feel anxious, remember that the limbic system always observes what you do. It will conclude that there is no danger when you act normal when feeling anxious. Remember there is nothing wrong with you, it never was.



Edit : Bit more explained.

What occurs in an anxiety disorder is the following:

1) You use avoidance techniques

2) Your Limbic System has access to your senses.

3) It watches you perform an avoidance action in response to a fear sensation/symptom.

4) It concludes there must be a danger purely by analyzing your actions/choices.

5) It initiates the fight/flight response to keep you safe.

6) You feel the fear it produces.

7) You use avoidance techniques.


In other words you create the disorder by avoiding perfectly normal and healthy bodily functions. If you keep avoiding, the Limbic System concludes that there must be a disorder, and it keeps you on alert!!!!


What happens in anxiety removal is the following:


1) You do not avoid or escape, instead you understand that the fear not required and you do not react regardless of the presence of the fear sensation/symptom

2) Your Limbic System has access to your senses.

3) It watches you not reacting in relation to your fear sensation/symptom

4) Itconcludes that there is no danger.

5) It initiates the rest digest response

6) You feel the relaxation it produces.

7) You no longer feel compelled to avoid or escape.

Stop Avoiding.


",35,2015-06-13 04:28:23 EDT-0400
280,Hi fellow anxious ones - does anyone else get unreasonably angry for no apparent reason ?,"I woke up today and was just plain shitty - I get all tizzy and wound up and easily irritated.

Thanks in advance


EDIT - WOW - I was clutching straws to work out why I feel the way I do - especially in the mornings.  Maybe it *is* anxiety after all that makes me feel like this.

Problem is that my nasty cynical impatient side comes out ( and lemme tell you Armageddon's got NOTHING on me when I get rolling).  People telling me to 'calm down and relax' infuriates me more.   FML",47,2015-06-10 16:19:56 EDT-0400
281,Do you ever unintentionally lie when your anxiety acts up?,I ask cuz I notice I do it. Whenever my anxiety acts up I don't think and unintentionally lie it sucks.,39,2015-06-09 15:47:33 EDT-0400
282,Does anyone else hate making last minute social plans?,[deleted],23,2015-06-14 00:50:01 EDT-0400
283,Survey for r/anxiety to update the one done 3 years ago!,"#Attention - Please Read!?!?!

 - The form was 'deactivated' lets see here it's 6:10AM PST - I'm only doing this so I can tally and produce results which if we all cross our fingers and toes should up up later today. In theory I'm going to break it up at first taking out the bottom questions where people gave input (so I can go through those without feeling rushed so much) and will post the majority of the results later today sometime - again fingers and toes here people :)    
The bottom part of the survey I intend on sorting though, reading everyone's suggestions & thoughts and making an attempt to then create another graph that represents that information. Sssooo here we go - wish me luck hah :)    I have no clue why I'm so nervous about this I hope it comes out well!!    

ri0t
     
--------------------------------------------------   

~~##Greetings my wonderful /r/Anxiety peeps~~   

~~Back in 2012 a user posted up a survey and a good number of people participated - the results can be **[viewed here](http://i.imgur.com/CPb6p.png)** for anybody interested. It's been a while so I thought it might be nice to do this again, with a few alterations to the previous one posted. I figure I'll keep it up a few weeks and then post the results - maybe even do a side by side compare if anybody would be interested in seeing that.~~    

~~[I've de-actived form but if you want to look here you go](https://docs.google.com/forms/d/1BaWY8eQD2_cxM0DNBEOw0IQc_eAB0fkjrjGiA22GOfg/viewform)~~   

## So pretty please go take the survey - and at the bottom if you could give your thoughts/suggestions it would be much appreciated!! If you have suggestions of questions to add to the form please reply to this post, or pm me, /u/ri0tnrrd

##Thanks :)

#ri0t

######(edited for formatting)",21,2015-06-14 21:23:44 EDT-0400
284,I'm never going back to caffeine.,"When I was a kid, I drank Mountain Dew a lot. Too much actually. I wish I hadn't as it's terrible for your health. I felt amazing when I drank it, but I am now 26 years old, and over the last 3 years I have developed an extreme sensitivity to caffeine. I now get absolutely zero of the side effects people drink it for. Instead, I am filled with the sense of an impending doom. I feel like the ship is going under and I have one last breath to savor. It gnaws at that spot, just below the solar plexus.  It fills my head with terrible thoughts. 

A few weeks ago, the person I wanted to spend the rest of my life with broke up with me. To say that I was and am devastated wouldn't do the feeling justice. I have been absolutely miserable. Coincidentally, I had quit caffeine just beforehand. It is one of the best decisions I have ever made. I believe I would be unable to function if I would have continued drinking caffeine.

I went on quite the bender this weekend to try to distract from my broken heart. Walking into work this morning was difficult. I had a very important meeting with our CEOs wife and his right hand. I had to have caffeine, even knowing what was going to happen. I had a quarter of a cup of black coffee. More than enough to set things in motion. I felt a little better half way through the meeting. Cheerful even.  That feeling was quickly replaced with intense anxiety. It hasn't been this bad since last time I drank caffeine, even with my life crumbling around me. 

I can never go back to that. I still have anxiety, and I try to deal with it, but when I was addicted to caffeine, it was on a whole other level. ",40,2015-06-09 00:58:47 EDT-0400
285,DAE become anxious or stressed out when watching a movie with conflict or stressful situations?,[deleted],23,2015-06-09 09:31:38 EDT-0400
286,Anyone else tend to get panic attacks several hours or days AFTER something stressful occurs?,"It happens to me all the damned time, and I feel crappy for plowing through my xanax because of it.

I've posted here before while having a panic attack, and I'm sitting here having another one now. What drives me nuts is that my most predictable panic attacks occur after the fact.

Today, my younger brother (16) had a big dance performance at our local city theater. He rocked it and I couldn't be more proud of him. I was so amped sitting there watching him shake it like the proverbial polaroid photograph.

After his performance, my family decided to go and celebrate at our favorite restaurant. We ate, talked, laughed, and celebrated, and my brother went to bed smiling. All in all, it was a great day. I powered through a nice steak and mashed potatoes and went to bed full.

And, 3 hours later, I woke up shaking, sweating bullets, and just about to revisit that $30 filet mignon. I'm waiting on my xanax to kick in and occupying my mind by contributing and commenting in some of this sub's other threads. I'm not terribly panicked, just sick (that's how my episodes always are) and unsurprised. After a big, stressful day - even if it's a good-stressful like going to a big show - I can almost count on waking up later that night shaking like a spastic colon, WITH a spastic colon, cold sweats, and nearly puking up my toenails.",12,2015-06-08 12:37:33 EDT-0400
287,For anyone on Reddit who's afraid of going out alone. Studies show it's perfectly alright and natural to do so.,,3,2015-06-13 23:03:37 EDT-0400
288,Does anybody else hate unexpected visits from guests/friends/family?,"Hey everyone, Just want to know if anyone else experiences anything similar. I get a lot of anxiety, which manifests in anger/frustration/annoyance when my husband springs it on me that one of his friends is coming over. My home is like my safety bubble and I think it mallets me anxious. Does anyone else experience this?",29,2015-06-11 02:45:25 EDT-0400
289,I am a Liar. I can't help it.,"Anxiety is at the core of who I am today. I grew up afraid, anxious, and alone. I lied as a way to escape reality. However the reason I lie today isn't to escape but to avoid getting close to the truth. I get to personal way to quick. I have so much on my shoulders and I wish I had a friend to help with the load but everyone is dealing with there own shit too. So the few times I have opened up I was shut down. They walked away because it was to much and I regret it. So I lie so others won't get near ""me"". Telling the truth makes me feel vulnerable 

I am not afraid of being abandoned because I have never been supported and I would never turn down a helping hand. The thing is no one ever offers.

I am not a good liar. I like lying(I am weird). It's one of the few things I like about myself. The reason I love the internet is because I can lie here and most people could never tell I was. So I don't lie that way when someone doubts me I know I am telling the truth.

I wanted to write a post about asking for help on staying focused. I lose sight of my goals everyday. I blame part on my adhd, part on my anxiety and the rest on me. However I know the answer but can't move towards it because I am afraid. I am stuck.

tl;dr I lie because I am afraid if people knew the truth they wouldn't like me or want to be near me. I am stuck and hate my life. My problem is me. The answer is me.",14,2015-06-08 04:28:28 EDT-0400
290,[Rant] I remembered a really painful memory and I'm having trouble dealing with it,"Some background- I have depression, generalized anxiety, and social anxiety disorder.  I'm 21 and live on my own with my boyfriend, but my parents pay for my rent.  I live in a different state than them.  
My parents, my mom in particular have very high expectations for me.  They're pretty wealthy/successful, and I often get the impression that my main purpose in life in their eyes is to give them something to brag about.  When I was in elementary school, they would scold me for getting an A- instead of an A+, etc.  They constantly told me that I was lucky to be their kid.  Things like that I guess.  
Anyway, My mom recently came to visit my apartment and ended up going in my bathroom for a few minutes.  I didn't know she'd be coming so I didn't really have time to tidy up, and I didn't really want her going in there in the first place- I knew it was messy and I was embarrassed.  She didn't say anything about it so I was relieved and figured I was just being too hard on myself.  But yesterday (a week later) she sent me a long email ranting about how I needed to clean my bathroom and that I should be ashamed, it's gross, how could I let anyone see it that way, my living state is the reason i have mental health issues, etc etc.  It made me feel humiliated and disgusting.  My apartment is honestly not that bad; it's probably cleaner than all of my friends'. It's very VERY difficult for me to gather the motivation to clean however because of mental health problems, and it's something that really gets me down every day.   
BUT HERE'S THE BIG PART that's bothering me now.  I was reminded that a year ago, I was at my parents' home looking for something in their bedroom.  I ended up stumbling upon my mom's diary (invasion of privacy, i know, I shouldn't have) and flipped through it.  It was FILLED with pages and pages of negative things about me. It talked about how she didn't want me to come home because I was too depressing to be around, that I was a know-it-all, that I looked terrible and sick (I had lost 20 pounds because of a multiple-year-long IBS flareup), and just dozens of other things.  Just big long negative entries about me.  This entire journal was seriously just talking about things she dislikes about me and I don't think anything has ever made me feel worse in my life. But now I can't stop thinking about it- I feel like the harsh judgements I put upon myself are all true because of this.  I feel like a worthless disappointment and failure.  I just wish I never saw this and I don't know how I can ever get over it because it's certainly not something I can ever discuss with either of my parents.  Idk
",16,2015-06-12 20:07:35 EDT-0400
291,I am not okay.,[deleted],16,2015-06-08 20:17:16 EDT-0400
292,"Vertigo, Anxiety, and Earwax Buildup","I had been having constant off balance/dizziness/vertigo for the last four days. I blamed a lot of it on anxiety.

Today though, I realized it might be something else since it wasn't really going away. Plus three nights ago, I remember sticking a bobby pen in my ear to help clear some earwax and remember hitting my eardrum. That was dumb of me I know.

Fast forward to today. I went to the doctor, and he couldn't see my eardrums because there was so much wax buildup.

After washing it all out, he noticed I had swimmer's ear in my left ear and an infection in the other that was causing my vertigo and dizziness.

I felt so much better after having them cleaned. As in, my anxiety has gone way down. I have to put drops in both ears and take a round of antibiotics to clear the infection.

I just wanted to let this sub know that if you have earwax problems, that could be a potential source of anxiety. Doesn't hurt to check.",8,2015-06-13 21:09:34 EDT-0400
293,Singing helps to reduce anxiety!,"I've been anxious all day and everything seemed hopeless. My stomach hurt, everything hurt. I thought I would die. It was yet another anxiety attack.

I couldn't function at all, I just decided to sing. I played my favourite songs from fleet foxes and sang for an hour or two. I sang all of their discography and it felt so amazing, I was filled with happiness. I am even thinking of studying now and being productive. This is insane!",3,2015-06-11 15:37:42 EDT-0400
294,Because of my anxiety I quit drinking caffeine about a year ago.,"It was not super difficult at the time, but now that I am working almost 40 hours a week and I just started going back to school I am way more tired than usual and could use a pick me up throughout the day. I sleep normal hours but my diet could be a bit better. I know that a lot of lifestyle changes will help me improve in the long run, but I'm about to start work now could use some energy.


Does anyone have any suggestions for an alternative to coffee/other caffeinated drinks?",25,2015-06-11 17:48:15 EDT-0400
295,"[Help] [Rant] Anyone else have job anxiety, but are currently unemployed due to their condition, which may prevent getting one?","Basically, I'm in a position where I need a job, and would like a decent one, but the anxiety is really crippling.

For example, I know it would be a good idea to volunteer. I've picked out an organization that does things similar to my interests that could help build useful skills (which I also feel I lack) and I know the e-mail address where I could send my inquiry about open positions, but I can't seem to bring myself to do it. I'm looking for any advice as to how I can stop feeling so anxious and scared at doing something new and different.

I was able to hold a job before. I sold cars off and on again from 2012-2015 (I quit in January), but the anxiety got to me since its such a high pressure job where management treats you like garbage and so do the customers. Plus all the other salespeople hated the job, so the negative atmosphere didn't help. It got to the point where I'd see a car pull in to the parking lot and get anxiety because it meant that I might have to talk to them, and they could be mean, rude, or I could get yelled at by my boss for saying the wrong thing.

I'm not stupid. I have a master's degree. But sitting here unemployed while literally everyone I know is at least on a decent career track continues to chip away at me on a daily basis. Any type of help you guys and gals can provide would be much appreciated.",5,2015-06-09 23:35:00 EDT-0400
296,Do you smoke Marijuana with anxiety?,"Greetings, 

I'm wondering about Marijuana usage and it's affect on individuals with anxiety. I used to smoke no problem a couple years back with no affect on my anxiety levels. Which was great. But now I'm finding it that it increases my anxiety while high as well as sober. 
I've recently cut back to once or twice a month and I've been feeling tons better. 

Have you guys noticed any similar effects on your end? Or does your usage not effect your anxiety levels?",26,2015-06-09 03:26:21 EDT-0400
297,really losing the will to live anymore...i want to end my life,[deleted],13,2015-06-09 18:04:17 EDT-0400
298,Constant irrational thoughts about jinxes.,"so sometimes I will get these dumb irrational thoughts like ""things are going to well right now something bad is going to happen"" or ""that would never happen to me but did I just jinx my self by saying that? Now that thing is going to happen to me.""  Even someone saying drive safe or Goodbye to me gets me anxious since I feel like something bad could happen. I know some of these thoughts are un-logical but sometimes they have happen to me in the past which kinda makes me nervous. How do I remind myself that there is no such things as jinxes or evil supernatural voodoo. ",7,2015-06-13 18:32:25 EDT-0400
299,Scared that I'm alone,[deleted],22,2015-06-12 16:37:01 EDT-0400
300,I've developed a free app to try and help with anxiety and depression. Feel free to check it out :),"*if this isnt allowed feel free to remove it*

*backstory*

As someone who has suffered from depression and anxiety (and still do) and watched close family and friends suffer also, I decided to search for an app to help with depression and anxiety. Except the ones I found were all expensive or unappealing (to me). So I decided to make one myself.

So this is my app, What's Up?, the product of about 8 months work. It includes over 60 simple grounding techniques to help keep you grounded, thinking patterns and metaphors to help you keep your thoughts in check, and a diary and habit tracker. It also has a few different themes if you see the screenshots and aren't a fan of the colors. Any sort of feedback is appreciated, so feel free to let me know what you think and make suggestions :)

Links:  
Android: https://play.google.com/store/apps/details?id=com.jacksontempra.apps.whatsup  

iOS: https://itunes.apple.com/us/app/whats-up/id968251160?ls=1&amp;mt=8  

  
EDIT: If you can't get the iOS version in your app store, try replacing the 'us' in the link with your countries code or whatever for example gb or au

EDIT 2: I just wanted to say a massive thankyou to all the support you guys are giving me. It honestly means the world to me that you'll be able to make use of the app. As I said previously, as someone who has been through depression and still faces anxiety, it's incredible to be able to use the knowledge I've gained to help others get through tough times.
 Thank you all so much <3

EDIT 3: It's called What's Up? because I forgot to say the name of it and added the name in the post

EDIT 4: Not sure if people are still viewing but if you are, I've read every single comment and released a massive update (2.0) which adds lots of things that were requested including being able to backup and sync data between devices :) Hope everyone is doing good :)",191,2015-03-17 12:18:07 EDT-0400
301,Did anyone else have a dysfunctional family growing up & think this has something to do with your anxiety issues?,"I am the youngest in my dysfunctional family (dad, mom, 2 older sisters, older half-brother). My earliest memories are of my parents fighting, like big fights. To be honest, everyone in my family fought. We were never close - no hugs, no saying ""I love you"". We always pretended to be the perfect family, when in fact we were anything but. 

I think this has followed me my whole life. I hate confrontation, I hate showing my true emotions, I hate letting people get close, so I have no close friends. This makes me anxious. All. The. Time. 

Am I alone, or does anyone else think the way they grew up has impacted their life and made their anxiety worse? ",85,2015-03-16 17:43:14 EDT-0400
302,How Uncertainty Fuels Anxiety - An inability to live with life's unknowns can lead to worry and distress,,13,2015-03-18 21:41:06 EDT-0400
