,Title,Text,Number of Comments,Date Posted
873,My bunny passed away and my thesis is due in six days,"I’m currently completing an honours degree in biomedical science. I have made amazing progress this year with my anxiety and am on track to graduate with first class honours. If I keep up my grades I am eligible for a PhD scholarship, which will cover my uni fees and give me a decent income while I work on my doctorate. This is all I’ve ever really wanted to do. 

When I started my bachelor degree I was overwhelmed with anxiety and depression. The stress of exams and assignments drove me to constant panic attacks and I wasn’t eating. My mum noticed I was struggling and brought me a tiny black bunny to keep me company. He was the most beautiful companion I could have ever asked for. I named him Vince and I owe everything to that sweet little man. I suffer with narcolepsy as well, and every time I fell asleep on the floor he would run over to me and either lick my cheek or sit with me until I woke up. If I broke down or had a panic attack he would sit with me for hours on end and kiss my face as I cried. Nothing could calm me down like his sweet little nuzzles. 

He had a lot of health problems in the last few years. I swore I would do anything I could if there was a chance he could still live a happy pain free life. We made it through two big scares after many sleepless nights and thousands of dollars at the vet (literally the best money I have ever spent). And luckily I got another two amazing years with him, even if his head was a bit wonky. 

After six and a half wonderful years, Vince unexpectedly passed away in my arms two days ago. He made the most awful scream as I clutched him and ran to the car to rush to the vet and I realised he was gone. 

I am beyond broken at the moment. My final thesis is due in 6 days and even though I’m almost done, I just can’t think straight at the moment. I’m starting to panic again and I’m not sure if I can stay in control of it right now. I’m so scared I’m going to throw away everything I’ve worked for if I don’t get this finished on time. I’ve lost my best friend and the one who used to help me through these things and Don’t know what to do

Update:
Thank you to everyone for the overwhelming support. I wanted to write back to everyone individually but I have been far too busy writing, yayy.

 I absolutely love the idea of dedicating my thesis to Vince. I will definitely be doing this and have started writing a little dedication statement to honour just how amazing he was. 
I’m still heartbroken, but all of you’re encouragement has made me realise I need to keep going. I’m working well at the moment and am making a lot more progress. My anxiety still isn’t great but at least it’s dropped down to my normal level of uni stress and I don’t feel as close to breaking. Thank you all again for being there and wish me luck in these last few days!!",10,2019-10-18 13:56:56 EDT-0400
874,I did it!,"I just went too a concert of the Dublin legends, no panick attacks!

Woohoo",17,2019-10-17 00:20:10 EDT-0400
875,Psychoanalysis or cognitive-behavioral therapy?,"I've been doing psychoanalysis for about 2 years, but still struggle with anxiety, from time to time it really gets me, so I'm thinking about changing to a cbt therapist, should I stay and give more time to the psychoanalysis or should I change to cbt? Which one gets the best results for short and long term??",3,2019-01-07 19:40:10 EST-0500
876,Anxie-tips. Or not really. Just a story of my anxiety and how im not taking shit from it anymore,[deleted],10,2019-01-06 23:46:47 EST-0500
877,My story,[deleted],5,2019-01-06 23:40:31 EST-0500
878,I just got home from Uber driving on New Years.. I feel amazing.,"Over a year ago I started driving for Uber because we very seriously needed any extra money. I had to stop almost immediately because my anxiety wouldn’t allow me to in good conscious drive others around. I felt devastated. I felt like a failure. I felt like shit, I couldn’t help my family when the time needed it. 

I recently picked up where I left off because his work gave a hefty heads up that they were taking off for the holidays for way too much time and it was unpaid. I’ve been doing decent with it. I’ve helped make enough to help us stay afloat and was able to help make sure Christmas was still magical for our kids.

I knew tonight (or last night) would be a big deal, good money. All the time leading up to New Years I’ve been debating if I wanted to put myself through it with my anxiety. I’ve been doing OK but what if it was too much on me? 

I fucking nailed it. I made more in one night/morning than I’d made the whole week combined. I was sociable! I freaking went places I’ve never driven before. I don’t know. I feel so on top of the world. I remember feeling my throat tightening in between one ride and thinking “it’s just roads sunny. Just roads” and was able to calm myself down. I’ve NEVER been able to calm myself down. In fact by the end of the night I was eager for new rides and I was calm. 

Flipping calm, a word I never ever thought I’d used to describe myself ever.  I don’t know how long this high will last but.. I’m glad I can share it with you all. Happy New Years! 

Also, for anyone wondering. I’m medicated and in therapy and just got out of IOP, I know it doesn’t always help everyone but I put a lot of it into that. Me getting help. ",4,2019-01-01 12:55:43 EST-0500
879,Panic attack at work.,"I've dealt with anxiety my whole life and recently it has been worse than usual but manageable. 

I can usually manage my symptoms through exercise and breathing exercises and (I don't like admitting it) alcohol.

I occasionally get anxious at work but I can manage by going on a walk or going into the bathroom for some breathing exercises. 

Today was the worst. I turned my head too fast and became extremely dizzy (world spinning, never felt like this before). I sat down and tried to regain my composure but with the dizziness it set off the worst panic attack I've ever had. I couldn't breathe, my heart was racing, I was shaking to the point of tremors. I told my co worker I thought I was gonna pass out. He sat next to me and tried to calm me down and I then asked him to take me to the ER. He did and I was diagnosed with vertigo which had thrown me into an anxiety attack.

Now I still feel im recovering from both the vertigo and my anxiety. And I'm horrified to go back to work. What if just being there throws me into another attack? I'm so embarrassed about this happening in front of all my co workers. What if I start spinning again? The ER dr shrugged off my anxiety and basically said to just deal with it. I plan on calling a psychiatrist tomorrow for an appointment to talk about potential medications. Is there anything else I can do to ease my anxiety for work tomorrow?

Also thanks for reading, I also really needed to vent about this.",3,2019-01-03 02:46:12 EST-0500
880,Anxiety and cyberstalking! Please help!,"Unknown people found my address. Send it for other people and they come and knock on my flat about 12 hours a lot of different people. they say that I give free tv or fridge, It was on October. I did screenshots, audio and etc. gave it to police... no answer. Now they began again! Please give advice how to stop it and keep calm! Please! I live alone on the 1st floor. Without parents. I am a girl. They play and want my reaction, but I try to ignore it. And I have an anxiety disorder many years. That’s not easy for me to smile on this situation! ",6,2019-01-03 04:10:07 EST-0500
881,You just gotta do it,"Sometimes, if you wanna get better, you just gotta jump on out of your situation regardless of how you feel. Or you  will always feel how you feel right now. You just gotta get up and get going, if anxiety comes, just say ""go ahead, do what you want to do, I don't give a fuck."" Get moving!!!!! Don't look back and just go.",0,2019-01-03 12:54:57 EST-0500
882,Going to work,[deleted],0,2019-01-03 14:00:06 EST-0500
883,i get anxiety to play even a single player game because i fear failing to measure up to my past self,"how stupid is that. i get so avoidant and anxious that i dont even play a game, because if i see myself doing worse, ill see myself as having become worse as a person somehow.  i know rationally its ridiculous, but its still how i feel.  ",2,2019-01-03 08:52:38 EST-0500
884,Somebody please help me.,"So yesterday I made a post about conquering my fear of 17 years of throwing up. I caught a stomach bug that made me sick and threw up twice yesterday. Once at 6 am and again at noon. I haven't thrown up since, but now my mom got the exact same thing but way worse, intense stomach pain, and was throwing up way more, way more frequently, and violently, all within the span of 3 hours. She was taken to the hospital, but hearing her violently throw up while she was here just made me so scared just like it always does when she gets these things. I'm still recovering myself which makes me so scared. I don't want to get it again but worse this time like she had, and that makes me feel awful feeling that way because I was the one who got her sick and I want her to get better. But I'm just so scared again to the point that I taped the door to my room so that way I can isolate myself as much as possible from the rest of the house. Now it's night time and I hate night time in the winter, it makes me feel trapped, scared, and alone, because I've always had this feeling like everything bad happens at night like this. I don't know if I'm just panicking or if I'm still sick, but I feel like I'm gonna throw up again, and now I don't have anyone here to comfort me again if I do and I'm freaking out. How am I ever going to get over / control this fear? I can't take this anymore, my heart is always racing, I'm always scared, It's affecting my health really badly and I just want it to end. Someone, anyone, please, help me.
 ",3,2019-01-03 10:45:34 EST-0500
885,Does anyone else keep googling questions and symptoms but can never find any answers?,[deleted],1,2019-01-03 10:21:20 EST-0500
886,How do I stop myself from feeling guilty when I am having fun?,"If I take even a day off to have fun, my anxiety kicks in and I keep thinking about all the work I have to do. This happens even when I have nothing important to do and is genuinely keeping me from enjoying my life. ",1,2019-01-03 13:07:13 EST-0500
887,I feel so akward when trying to talk to a stranger...,"Is there a right way to talk to strangers?

*Awkward",1,2019-01-03 14:26:46 EST-0500
888,Is this panic attack just anxiety or something else?,[deleted],0,2019-01-03 15:14:47 EST-0500
889,Does anyone else feel better when they delete their social media accounts?,"I remember deleting my FB account a while back and feeling much better after doing that. and i'm kinda considering doing that again with other social media very soon. i mean, social media is just trash, honestly. i see all of these people living their lives, having great experiences, and getting a lot of attention, but meanwhile i'm here rotting in my home just waiting for someone to check on me, or for a chance to get away from my current life... as pathetic as it may seem, they just make me hate my current circumstances and anxiety a lot more than i already do, and i don't think i need that 100%

What about you guys?",4,2019-01-03 03:54:02 EST-0500
890,Will stopping Prozac cause a return in anxiety and depression?,[deleted],6,2019-01-04 16:09:09 EST-0500
891,"For those who have anxiety like I do, pretend you are here. You are safe, warm and secluded. No one can hurt you here.",[deleted],0,2019-01-04 19:52:46 EST-0500
892,Does anyone else mistake the urge to use the restroom for anxiety?,Whenever I have to use the restroom I feel like it’s an anxiety attack coming on but really I just need to go to the bathroom (sorry if this is TMI). I was wondering if anyone else shared the same experience.,1,2019-01-04 20:53:46 EST-0500
893,Wisdom teeth removal anxiety,[deleted],3,2019-01-03 14:41:45 EST-0500
894,Nervous to ask for an ESA,"So I took a teaching job 4 hours from home (which for me is pretty far.) My first semester, I was so busy with teaching and coaching one act I had no time nor energy to socialize. Once one act season ended, I have been slowly but surely trying to get out more. However the town I live in is extremely small, like 800 people, so there's hardly any sort of volunteer opportunities. I've tried reaching out to coworkers, but they are all married and/or with kids and busy. 

My landlady is extremely nice, but the Tennant before me  had a cat that torn the place to hell now there's a no pets policy. She did say I could have a reptile or bird and I did get a fish, but it's not the same. A repitle or bird would be too high maintenance for me to care for, a cat would probably be the best for me. I know that b/c of my ADHD and anxiety I could probably qualify for an ESA, but I feel like it wouldn't be fair to my landlady. She's very good to me, and I don't want to look like ""that person"". I do have an appointment to speak with a doctor here so on, but I just wanted to to get some other opinions as well. 

Do I try to find a new place to live that allows pets or do I try to go for getting an ESA?",3,2019-01-03 22:46:01 EST-0500
895,Do you ever get that feeling,[deleted],18,2019-01-03 19:35:27 EST-0500
896,My coworker found out about my self-harm issues and it's making me nauseous,"Background:
Coworker A and me have been friendly since I work here (4 months) and he's occasionally flirty, but even Though I was anxious at first I just ignored his approaches.
So today I was talking to Coworker B who mentioned how surprised she is by my attitude, I always sounded so weird when CW A talked about me. Apparently A has been telling B a lot about me and, even though I don't know any details, most of it wasn't exactly nice.
CW B also told me that A texted her saying that he thinks I'm 'a cutter' and how that totally turned him off.
Especially this made me extremely anxious, I'm nauseous and dizzy and took the long way to my Office to avoid running into A.

I don't know why him being 'turned off' by my scars is so hard for me. I really, really don't want a relationship with A but I feel so abnormal and somehow freaky. To encounter how judgemental people are just scares me because how many others will think the same of me? I've made an effort not to let anyone at work know about my  mental health issues because of stuff like this.
The talking behind my back thing just worsens the situation.

I feel so shitty avoiding him And I know I should talk to him but just thinking about bringing the subject up makes me shaky.

Has anyone experienced something similar and has advice for situations like this?
Thanks for reading.",4,2019-01-04 14:24:46 EST-0500
897,"I can let go of my worries to feel better, but not really",[deleted],0,2019-01-04 19:45:08 EST-0500
898,Too Late to Call Someone.. Need to Talk,"I just woke up from a terrible dream where I died in a car accident. That was enough to wake me up with my heart pumping fast. I tried brushing it off and falling back asleep but it didn’t quite work. 

I then texted my boyfriend about it thinking getting it out might be nice and relieve from stress. 

But now I’m just thinking about things that aren’t really related. I recently just started living by myself temporarily. But I’ve been so anxious about it. Making sure I locked the door. I just am unrealistically imagining someone coming in to hurt me but I know that isn’t going to happen. I know I’m being irrational but I can’t stop. 

I just want to sleep. Forget about it all. And wake in the morning so there is some distance to the feeling I have now. 
",3,2019-01-04 12:46:03 EST-0500
899,CBD for anxiety?,[removed],1,2019-01-03 00:01:24 EST-0500
900,Does anyone else hate when people watch you do things?,[deleted],137,2019-04-19 17:13:16 EDT-0400
901,"If you see this, you better have a good fucking day!","And always remember, fuck anxiety, it’s all energy! Embrace it!


Edit: first silver ever!  Thanks kind stranger. 

I suffer from anxiety all the time. As I’ve gotten older I try to focus on the anxiety as energy moving throughout my body.  If I have anxiety and I feel it in my stomach, I zone in on how my stomach is feeling, pay attention to the anxiety moving throughout my body and it helps to relieve it eventually, don’t ignore it as it’s there for your attention, something about your mental thinking or the physical world is causing this energy to enter your body, find out what it is, pay attention, don’t ignore it.",41,2019-04-19 00:25:31 EDT-0400
902,Tonight I finally asked the guy in the next apartment over to stop yelling to people over the computer to all hours of the night after about 3 months of trouble sleeping because of the noise.,"I was shaking the whole time but I said what I meant to and this is a major win for me. Of course I’m going to ruminate on the situation now and have trouble sleeping for that reason tonight but hopefully tomorrow night will be better. And yeah, the yelling was really that bad.",46,2019-04-18 09:49:31 EDT-0400
903,"Have you ever felt anxious because everything in your life is going on perfectly, but you are worried about something wrong that might be happening without you realize it?","It's a period in my life when everything is fine. I didn't quarrel with my boyfriend in years, I am passing all my exams, my parents are strangely nice and comprehensive with me, I didn't even catch a cold and I am surrounded by lovely people... I am used to living an unpleasant life, bearing problems all the day and feeling nervous at night and deeply unhappy. However, now I COULD live the perfect life, but I keep asking myself why is everything fine, what's going to happen, if I have any disease, what terrifying destiny is going to punch me in the face. Because of this, my hypochondria is getting worse, I sometimes am convinced that it's not possible for me not to have problems in life, so I must have some deadly disease and every signal my body give to me makes me want to run to the doctor... Sometimes I can't sleep at night because I fear that my house will burn while I sleep, or that some thief will break into my home to steal something (even though we don't own anything valuable!) and doing bad to my family... Have you ever felt that way or am I just an idiot to feel even more anxious because I literally have NOTHING to worry about?",48,2019-04-21 01:23:03 EDT-0400
904,I GOT A JOB!,"The past 6 months my agoraphobia had gotten so bad that I avoided leaving my house completely. A few days ago I decided to start applying for jobs. I had an interview today and after having 2 panic attacks about it and fighting my fears for hours, I went. 

The interview went so well that they wanted me to fill a different position that would be way more interesting, pay more, and I’d have my own office. I was hired on the spot. 

Needed to share this with somewhere. Don’t have a lot of friends lol:)

Update: 
Thank you for the silver❤️ I had my first day today and it was awesome. My manager is great.",74,2019-04-17 06:30:02 EDT-0400
905,Does anyone else lose their appetite when anxious?,"I’ve been anxious since I was a kid. It’s been pretty consistent my whole life but in times of stress it gets considerably worse. 
I 
just graduated college, which was a massive accomplishment for me, but I have been very high stress the last couple of months due to the anxiety of starting my “adult life”. Something that correlates with that is my loss of appetite to the point where all I can eat all day is one bagel, sometimes even less. Anything more and I either feel extremely nauseous or I start gagging when trying to eat. 

These last few months I have dropped quite a bit of weight and people keep commenting on it, telling me I look good. Which only makes me feel more anxious, mostly due to the fact that I know it’s an unhealthy consequence of my anxiety that I have no idea how to deal with. 

My question is, does anyone else ever feel this way? And if so what do you do about it?",161,2019-04-16 06:49:52 EDT-0400
906,"I did all my laundry, cleaned my room, and turned in all my assignments today.","Obviously what normal people can do on a regular basis, and I'll probably be withdrawn from law school for absences, but today I am doing ok. Love u all and wish the best for you.",25,2019-04-17 02:46:15 EDT-0400
907,does anyone else watch TV/youtube to hear/see other people without actually socializing?,i’m introverted and agoraphobic. but i still like being connected with humanity and “interacting” with other people indirectly makes me feel less cripplingly alone and isolated. sometimes i’ll just put something on in the background while i do other things. i just want to hear human voices without the anxiety of being around other people,72,2019-04-17 19:55:02 EDT-0400
908,I PRESENTED TODAY!!!,"I was nervous and had an anxiety attack before class and on my way. I took deep breaths, got up there and DID IT! I was a little shaky, but I did it and I passed! I feel so accomplished today. I even went out of my comfort zone and raised me hand to answer a question in class when the rest of the students didn't. My answer was for the most part correct ... regardless i am still proud because i didn't have much knowledge on the topic !!! yay!

EDIT: Thank you all so much for the positivity and support. You've all put such an enormous smile on my face. I haven't smiled in a long time, since I just lost my fishy friend and got dumped recently, so again thank you!!! I appreciate every single one of you <3

EDIT: thank you for the silver kind stranger!!",43,2019-04-16 18:40:06 EDT-0400
909,I can tell when my anxiety is high when I start making silly bets with myself.,"Sometimes I'll think I'm having a normal day when, almost without thinking, I'll crumple up the paper towel I've just used and say to myself, ""If I make this shot in the trash can it'll be okay."", or ""If this red light turns green in the next 3 seconds then -insert random fear- won't happen."" I'm wondering if I'm the only one that does this. I did it all the time when I was a kid and it still persists. It's one of the ways I  become aware of just how stressed out I am.

Edit: Knowing that I'm not the only one who experiences this is very comforting!",56,2019-04-20 12:23:59 EDT-0400
910,Anyone else feel like they are waiting?,[deleted],62,2019-04-16 21:22:50 EDT-0400
911,"Is ""Im just tired"" your excuse to people too?",,59,2019-04-20 05:17:38 EDT-0400
912,I hate the sun,I honestly can’t stand summer. I hate this time of the year when the sun starts to make an appearance. It’s most people happy time but not mine. My anxiety always seems to increase around this time. I just hate being indoors when it’s sunny I always feel this pressure to go out and do something and feel guilty for sitting at home being in bed. Anyone relate?,98,2019-04-21 20:12:15 EDT-0400
913,Does anyone else feel fragile?,"I'm constantly afraid of something going wrong or that I'm on the verge of another panic attack. Most days I don't even wanna leave the house because I feel like something could happen and suddenly I'd get my horrible pains in my chest, difficult breathing, feeling like I'll faint, it's like my body is made of fragile glass and anything could destroy me. I hate living like this. I could reassure myself a hundred times daily that the human body is resilient, but it never helps.",44,2019-04-15 19:11:40 EDT-0400
914,Does anyone else use a shower for anxiety relief?,"I've realized that I've been taking a shower when I get too much anxiety. When I was a teenager I would take up to 4 in a day just to feel better and I couldn't understand why. Now as an adult I've learned that as soon as I get too overwhelmed, I start daydreaming about showering and it kicks up my anxiety when I can't. Does anybody else use showers as a coping mechanism?


EDIT: Thank you guys a ton for the responses! Nobody in my life has ever heard of it and I was starting to feel like I was crazy! Makes me feel way better about it.",49,2019-04-16 22:36:18 EDT-0400
915,I just drove by myself for the first time in more than a month!,"The last time I drove before this was with my ex girlfriend who spent the entire time making fun of me and inducing panic, I haven’t been able to drive since then but I finally bit the bullet today. It’s not much, but it’s in the right direction.",15,2019-04-18 23:31:59 EDT-0400
916,Made a phone call,I made a phone call to someone I didn't know for work and didn't panic! Winning!,26,2019-04-19 16:00:47 EDT-0400
917,What if you knew that everything was going to be okay?,"Not thought, wished, or hoped... but KNEW for a 100% fact that everything is going to be okay? Could you then enjoy this moment that you are living in right now? Could you relax in the sunshine? Could you play with your kids without your mind spinning in the background? Could you get out of your head well enough to un-vacate that stare, and see the person you’re talking to?

I know we can’t know, but what if you knew? How much more pleasant would your life be?

EVERYTHING IS GOING TO BE OKAY.",35,2019-04-15 12:28:56 EDT-0400
918,Anyone else feel nauseous when anticipating socializing?,Or even during?,19,2019-04-17 17:06:36 EDT-0400
