,0
Error-Sensor: Mining Information from HTTP Error Traffic for Malware Intelligence,"Malware often encounters network failures when it launches malicious activities, such as connecting to compromised servers that have been already taken down, connecting to malicious servers that are blocked based on access control policies in enterprise networks, or scanning/exploiting vulnerable web pages. To overcome such failures and improve the resilience in light of such failures, malware authors have employed various strategies, e.g., connecting to multiple backup servers or connecting to benign servers for initial network connectivity checks. These network failures and recovery strategies lead to distinguishing traits, which are newly discovered and thoroughly studied in this paper. We note that network failures caused by malware are quite different from the failures caused by benign users/software in terms of their failure patterns and recovery behavior patterns.In this paper, we present the results of the first large-scale measurement study investigating the different network behaviors of both benign user/software and malware in light of HTTP errors. By inspecting over 1 million HTTP logs generated by over 16,000 clients, we identify strong indicators of malicious activities derived from error provenance patterns, error generation patterns, and error recovery patterns. Based on the insights, we design a new system, Error-Sensor, to automatically detect traffic caused by malware from only HTTP errors and their surrounding successful requests. We evaluate Error-Sensor on a large scale of real-world web traces collected in an enterprise network. Error-Sensor achieves a detection rate of 99.79% at a false positive rate of 0.005% to identify HTTP errors generated by malware, and further, spots surreptitious malicious traffic (e.g., malware backup behavior) that was not caught by existing deployed intrusion detection systems."
Generic Black-Box End-to-End Attack Against State of the Art API Call Based Malware Classifiers,"In this paper, we present a black-box attack against API call based machine learning malware classifiers, focusing on generating adversarial sequences combining API calls and static features (e.g., printable strings) that will be misclassified by the classifier without affecting the malware functionality. We show that this attack is effective against many classifiers due to the transferability principle between RNN variants, feed forward DNNs, and traditional machine learning classifiers such as SVM. We also implement GADGET, a software framework to convert any malware binary to a binary undetected by malware classifiers, using the proposed attack, without access to the malware source code."
Next Generation P2P Botnets: Monitoring Under Adverse Conditions,"The effects of botnet attacks, over the years, have been devastating. From high volume Distributed Denial of Service (DDoS) attacks to ransomware attacks, it is evident that defensive measures need to be taken. Indeed, there has been a number of successful takedowns of botnets that exhibit a centralized architecture. However, this is not the case with distributed botnets that are more resilient and armed with countermeasures against monitoring. In this paper, we argue that monitoring countermeasures, applied by botmasters, will only become more sophisticated; to such an extent that monitoring, under these adverse conditions, may become infeasible. That said, we present the most detailed analysis, to date, of parameters that influence a P2P botnet’s resilience and monitoring resistance. Integral to our analysis, we introduce BotChurn (BC) a realistic and botnet-focused churn generator that can assist in the analysis of botnets. Our experimental results suggest that certain parameter combinations greatly limit intelligence gathering operations. Furthermore, our analysis highlights the need for extensive collaboration between defenders. For instance, we show that even the combined knowledge of 500 monitoring instances is insufficient to fully enumerate some of the examined botnets. In this context, we also raise the question of whether botnet monitoring will still be feasible in the near future."
Malicious IoT Implants: Tampering with Serial Communication over the Internet,"The expansion of the Internet of Things (IoT) promotes the roll-out of low-power wide-area networks (LPWANs) around the globe. These technologies supply regions and cities with Internet access over the air, similarly to mobile telephony networks, but they are specifically designed for low-power applications and tiny computing devices. Forecasts predict that major countries will be broadly covered with LPWAN connectivity in the near future. In this paper, we investigate how the expansion of the LPWAN infrastructure facilitates new attack vectors in hardware security. In particular, we investigate the threat of malicious modifications in electronic products during the physical distribution process in the supply chain. We explore to which extent such modifications allow attackers to take control over devices after deployment by tampering with the serial communication between processors, sensors, and memory. To this end, we designed and built a malicious IoT implant, a small electronic system that can be inserted in arbitrary electronic products. In our evaluation on real-world products, we show the feasibility of leveraging malicious IoT implants for hardware-level attacks on safety- and security-critical products."
Before Toasters Rise Up: A View into the Emerging IoT Threat Landscape,"The insecurity of smart Internet-connected or so-called “IoT” devices has become more concerning than ever. The existence of botnets exploiting vulnerable, often poorly secured and configured Internet-facing devices has been known for many years. However, the outbreak of several high-profile DDoS attacks sourced by massive IoT botnets, such as Mirai, in late 2016 served as an indication of the potential devastating impact that these vulnerable devices represent. Since then, the volume and sophistication of attacks targeting IoT devices have grown steeply and new botnets now emerge every couple of months. Although a lot of research is being carried out to study new spurs of attacks and malware, we still lack a comprehensive overview of the current state of the IoT thread landscape. In this paper, we present the insights gained from operating low- and high-interaction IoT honeypots for a period of six months. Namely, we see that the diversity and sophistication of IoT botnets are both growing. While Mirai is still a dominating actor, it now has to coexist with other botnets such as Hajime and IoT Reaper. Cybercriminals also appear to be packing their botnets with more and more software vulnerability exploits targeting specific devices to increase their infection rate and win the battle against the other competing botnets. Finally, while the IoT malware ecosystem is currently not as sophisticated as the traditional one, it is rapidly catching up. We thus believe that the security community has the opportunity to learn from passed experience and act proactively upon this emerging threat."
Statistical Similarity of Critical Infrastructure Network Traffic Based on Nearest Neighbor Distances,"Industrial control systems (ICSs) operate a variety of critical infrastructures such as waterworks and power plants using cyber physical systems (CPSs). Abnormal or malicious behavior in these critical infrastructures can pose a serious threat to society. ICS networks tend to be configured such that specific tasks are performed repeatedly. Further, for a specific task, the resulting pattern in the ICS network traffic does not vary significantly. As a result, most traffic patterns that are caused by tasks that are normally performed in a specific ICS have already occurred in the past, unless the ICS is performing a completely new task. In such environments, anomaly-based intrusion detection system (IDS) can be helpful in the detection of abnormal or malicious behaviors. An anomaly-based IDS learns a statistical model of the normal activities of an ICS. We use the nearest-neighbor search (NNS) to learn patterns caused by normal activities of an ICS and identify anomalies. Our method learns the normal behavior in the overall traffic pattern based on the number of network packets transmitted and received along pairs of devices over a certain time interval. The method uses a geometric noise model with lognormal distribution to model the randomness on ICS network traffic and learns solutions through cross-validation on random samples. We present a fast algorithm, along with its theoretical time complexity analysis, in order to apply our method in real-time on a large-scale ICS. We provide experimental results tested on various types of large-scale traffic data that are collected from real ICSs of critical infrastructures."
PostScript Undead: Pwning the Web with a 35 Years Old Language,"PostScript is a Turing complete page description language dating back to 1982. It is supported by most laser printers and for a long time it had been the preferred file format for documents like academic papers. In this work, we show that popular services such as Wikipedia, Microsoft OneDrive, and Google Mail can be attacked using malicious PostScript code. Besides abusing legitimate features of the PostScript language, we systematically analyzed the security of the most popular PostScript interpreter – Ghostscript. Our attacks include information disclosure, file inclusion, and remote command execution. Furthermore, we present methods to obfuscate PostScript code and embed it within legitimate PDF files to bypass security filters. This allows us to create a hybrid exploit that can be used to attack web applications, clients systems, print servers, or printers. Our large-scale evaluation reveals that 56% of the analyzed web applications are vulnerable to at least one attack. In addition, three of the top 15 Alexa websites were found vulnerable. We provide different countermeasures and discuss their advantages and disadvantages. Finally, we extend the scope of our research considering further targets and more advanced obfuscation techniques."
Identifying Key Leakage of Bitcoin Users,"We study key leakage in the context of cryptocurrencies. First, we consider the problem of explicit key leakage occurring on open-source intelligence platforms. To do this, we monitor the Pastebin feed from Sep 2017–Mar 2018 to find exposed secret Bitcoin keys, revealing that attackers could have stolen 22.40 BTC worth roughly $178,000 given current exchange rates. Then, we focus on implicit key leakage by exploiting the wrong usage of cryptographic primitives and scan Bitcoin’s blockchain for ECDSA nonce reuse. We systematically outline how an attacker can use duplicate r values to leak nonces and secret keys, which goes beyond the simple case where the same nonce and the same key have been used in conjunction more than once. Our results show that ECDSA nonce reuse has been a recurring problem in the Bitcoin ecosystem and has already been exploited by attackers. In fact, an attacker could have exploited nonce reuse to steal 412.80 BTC worth roughly $3.3 million."
Furnace: Self-service Tenant VMI for the Cloud,"Although Virtual Machine Introspection (VMI) tools are increasingly capable, modern multi-tenant cloud providers are hesitant to expose the sensitive hypervisor APIs necessary for tenants to use them. Outside the cloud, VMI and virtualization-based security’s adoption rates are rising and increasingly considered necessary to counter sophisticated threats. This paper introduces Furnace, an open source VMI framework that outperforms prior frameworks by satisfying both a cloud provider’s expectation of security and a tenant’s desire to run their own custom VMI tools underneath their cloud VMs. Furnace’s flexibility and ease of use is demonstrated by porting four existing security and monitoring tools as Furnace VMI apps; these apps are shown to be resource efficient while executing up to 300x faster than those in previous VMI frameworks. Furnace’s security properties are shown to protect against the actions of malicious tenant apps."
ShadowMonitor: An Effective In-VM Monitoring Framework with Hardware-Enforced Isolation,"Virtual machine introspection (VMI) is one compelling technique to enhance system security in clouds. It is able to provide strong isolation between untrusted guests and security tools placed in guests, thereby enabling dependability of the security tools even if the guest has been compromised. Due to this benefit, VMI has been widely used for cloud security such as intrusion detection, security monitoring, and tampering forensics. However, existing VMI solutions suffer significant performance degradation mainly due to the high overhead upon frequent memory address translations and context-switches. This drawback limits its usage in many real-world scenarios, especially when fine-grained monitoring is desired. In this paper, we present ShadowMonitor, an effective VMI framework that enables efficient in-VM monitoring without imposing significant overhead. ShadowMonitor decomposes the whole monitoring system into two compartments and then assigns each compartment with isolated address space. By placing the monitored components in the protected compartment, ShadowMonitor guarantees the safety of both monitoring tools and guests. In addition, ShadowMonitor employs hardware-enforced instructions to design the gates across two compartments, thereby providing efficient switching between compartments. We have implemented ShadowMonitor on QEMU/KVM exploiting several hardware virtualization features. The experimental results show that ShadowMonitor could prevent several types of attacks and achieves 10     speedup over the existing method in terms of both event monitoring and overall application performance."
KASR: A Reliable and Practical Approach to Attack Surface Reduction of Commodity OS Kernels,"Commodity OS kernels have broad attack surfaces due to the large code base and the numerous features such as device drivers. For a real-world use case (e.g., an Apache Server), many kernel services are unused and only a small amount of kernel code is used. Within the used code, a certain part is invoked only at runtime while the rest are executed at startup and/or shutdown phases in the kernel’s lifetime run. In this paper, we propose a reliable and practical system, named KASR, which transparently reduces attack surfaces of commodity OS kernels at runtime without requiring their source code. The KASR system, residing in a trusted hypervisor, achieves the attack surface reduction through a two-step approach: (1) reliably depriving unused code of executable permissions, and (2) transparently segmenting used code and selectively activating them. We implement a prototype of KASR on Xen-4.8.2 hypervisor and evaluate its security effectiveness on Linux kernel-4.4.0-87-generic. Our evaluation shows that KASR reduces the kernel attack surface by 64% and trims off 40% of CVE vulnerabilities. Besides, KASR successfully detects and blocks all 6 real-world kernel rootkits. We measure its performance overhead with three benchmark tools (i.e., SPECINT, httperf and bonnie++). The experimental results indicate that KASR imposes less than 1% performance overhead (compared to an unmodified Xen hypervisor) on all the benchmarks."
