,0
Proteus: Detecting Android Emulators from Instruction-Level Profiles,"The popularity of Android and the personal information stored on these devices attract the attention of regular cyber-criminals as well as nation state adversaries who develop malware that targets this platform. To identify malicious Android apps at a scale (e.g., Google Play contains 3.7M Apps), state-of-the-art mobile malware analysis systems inspect the execution of apps in emulation-based sandboxes. An emerging class of evasive Android malware, however, can evade detection by such analysis systems through ceasing malicious activities if an emulation sandbox is detected. Thus, systematically uncovering potential methods to detect emulated environments is crucial to stay ahead of adversaries. This work uncovers the detection methods based on discrepancies in instruction-level behavior between software-based emulators and real ARM CPUs that power the vast majority of Android devices. To systematically discover such discrepancies at scale, we propose the Proteus system. Proteus performs large-scale collection of application execution traces (i.e., registers and memory) as they run on an emulator and on accurate software models of ARM CPUs. Proteus automatically identifies the instructions that cause divergent behavior between emulated and real CPUs and, on a set of 500K test programs, identified 28K divergent instances. By inspecting these instances, we reveal 3 major classes of root causes that are responsible for these discrepancies. We show that some of these root causes can be easily fixed without introducing observable performance degradation in the emulator. Thus, we have submitted patches to improve resilience of Android emulators against evasive malware."
BabelView: Evaluating the Impact of Code Injection Attacks in Mobile Webviews,"A Webview embeds a fully-fledged browser in a mobile application and allows that application to expose a custom interface to JavaScript code. This is a popular technique to build so-called hybrid applications, but it circumvents the usual security model of the browser: any malicious JavaScript code injected into the Webview gains access to the custom interface and can use it to manipulate the device or exfiltrate sensitive data. In this paper, we present an approach to systematically evaluate the possible impact of code injection attacks against Webviews using static information flow analysis. Our key idea is that we can make reasoning about JavaScript semantics unnecessary by instrumenting the application with a model of possible attacker behavior—the BabelView. We evaluate our approach on 25,000 apps from various Android marketplaces, finding 10,808 potential vulnerabilities in 4,997 apps. Taken together, the apps reported as problematic have over 3 billion installations worldwide. We manually validate a random sample of 50 apps and estimate that our fully automated analysis achieves a precision of 81% at a recall of 89%."
Defeating Software Mitigations Against Rowhammer: A Surgical Precision Hammer,"With software becoming harder to compromise due to modern defenses, attackers are increasingly looking at exploiting hardware vulnerabilities such as Rowhammer. In response, the research community has developed several software defenses to protect existing hardware against this threat. In this paper, we show that the assumptions existing software defenses make about memory addressing are inaccurate. Specifically, we show that physical address space is often not contiguously mapped to DRAM address space, allowing attackers to trigger Rowhammer corruptions despite active software defenses. We develop RAMSES, a software library modeling end-to-end memory addressing, relying on public documentation, where available, and reverse-engineered models otherwise. RAMSES improves existing software-only Rowhammer defenses and also improves attacks by orders of magnitude, as we show in our evaluation. We use RAMSES to build Hammertime, an open-source suite of tools for studying Rowhammer properties affecting attacks and defenses, which we release as open-source software."
Reading Between the Lines: Content-Agnostic Detection of Spear-Phishing Emails,"Spear-phishing is an effective attack vector for infiltrating companies and organisations. Based on the multitude of personal information available online, an attacker can craft seemingly legit emails and trick his victims into opening malicious attachments and links. Although anti-spoofing techniques exist, their adoption is still limited and alternative protection approaches are needed. In this paper, we show that a sender leaves content-agnostic traits in the structure of an email. Based on these traits, we develop a method capable of learning profiles for a large set of senders and identifying spoofed emails as deviations thereof. We evaluate our approach on over 700,000 emails from 16,000 senders and demonstrate that it can discriminate thousands of senders, identifying spoofed emails with 90% detection rate and less than 1 false positive in 10,000 emails. Moreover, we show that individual traits are hard to guess and spoofing only succeeds if entire emails of the sender are available to the attacker."
"Backdoors: Definition, Deniability and Detection","Detecting backdoors is a difficult task; automating that detection process is equally challenging. Evidence for these claims lie in both the lack of automated tooling, and the fact that the vast majority of real-world backdoors are still detected by labourious manual analysis. The term backdoor, casually used in both the literature and the media, does not have a concrete or rigorous definition. In this work we provide such a definition. Further, we present a framework for reasoning about backdoors through four key components, which allows them to be modelled succinctly and provides a means of rigorously defining the process of their detection. Moreover, we introduce the notion of deniability in regard to backdoor implementations which permits reasoning about the attribution and accountability of backdoor implementers. We show our framework is able to model eleven, diverse, real-world backdoors, and one, more complex backdoor from the literature, and, in doing so, provides a means to reason about how they can be detected and their deniability. Further, we demonstrate how our framework can be used to decompose backdoor detection methodologies, which serves as a basis for developing future backdoor detection tools, and shows how current state-of-the-art approaches consider neither a sound nor complete model."
RWGuard: A Real-Time Detection System Against Cryptographic Ransomware,"Ransomware has recently (re)emerged as a popular malware that targets a wide range of victims - from individual users to corporate ones for monetary gain. Our key observation on the existing ransomware detection mechanisms is that they fail to provide an early warning in real-time which results in irreversible encryption of a significant number of files while the post-encryption techniques (e.g., key extraction, file restoration) suffer from several limitations. Also, the existing detection mechanisms result in high false positives being unable to determine the original intent of file changes, i.e., they fail to distinguish whether a significant change in a file is due to a ransomware encryption or due to a file operation by the user herself (e.g., benign encryption or compression). To address these challenges, in this paper, we introduce a ransomware detection mechanism, RWGuard, which is able to detect crypto-ransomware in real-time on a user’s machine by (1) deploying decoy techniques, (2) carefully monitoring both the running processes and the file system for malicious activities, and (3) omitting benign file changes from being flagged through the learning of users’ encryption behavior. We evaluate our system against samples from 14 most prevalent ransomware families to date. Our experiments show that RWGuard is effective in real-time detection of ransomware with zero false negative and negligible false positive (    0.1%) rates while incurring an overhead of only     1.9%."
DNS Unchained: Amplified Application-Layer DoS Attacks Against DNS Authoritatives,"We present DNS Unchained, a new application-layer DoS attack against core DNS infrastructure that for the first time uses amplification. To achieve an attack amplification of 8.51, we carefully chain CNAME records and force resolvers to perform deep name resolutions—effectively overloading a target authoritative name server with valid requests. We identify 178 508 potential amplifiers, of which 74.3% can be abused in such an attack due to the way they cache records with low Time-to-Live values. In essence, this allows a single modern consumer uplink to downgrade availability of large DNS setups. To tackle this new threat, we conclude with an overview of countermeasures and suggestions for DNS servers to limit the impact of DNS chaining attacks."
Control Plane Reflection Attacks in SDNs: New Attacks and Countermeasures,"Software-Defined Networking (SDN) continues to be deployed spanning from enterprise data centers to cloud computing with emerging of various SDN-enabled hardware switches. In this paper, we present Control Plane Reflection Attacks to exploit the limited processing capability of SDN-enabled hardware switches. The reflection attacks adopt direct and indirect data plane events to force the control plane to issue massive expensive control messages towards SDN switches. Moreover, we propose a two-phase probing-triggering attack strategy to make the reflection attacks much more efficient, stealthy and powerful. Experiments on a testbed with physical OpenFlow switches demonstrate that the attacks can lead to catastrophic results such as hurting establishment of new flows and even disruption of connections between SDN controller and switches. To mitigate such attacks, we propose a novel defense framework called SWGuard. In particular, SWGuard detects anomalies of downlink messages and prioritizes these messages based on a novel monitoring granularity, i.e., host-application pair (HAP). Implementations and evaluations demonstrate that SWGuard can effectively reduce the latency for legitimate hosts and applications under Control Plane Reflection Attacks with only minor overheads."
Proof-of-Blackouts? How Proof-of-Work Cryptocurrencies Could Affect Power Grids,"With respect to power consumption, cryptocurrencies have been discussed in a twofold way: First, the cost-benefit ratio of mining hardware in order to gain revenue from mining that exceeds investment and electricity costs. Second, the overall electric energy consumption of cryptocurrencies to estimate the environmental effects of Proof-of-Work. In this paper, we consider a complementary aspect: The stability of the power grids themselves. Power grids have to continuously maintain an equilibrium between power supply and consumption; extended periods of imbalance cause significant deviation of the utility frequency from its nominal value and destabilize the power grid, eventually leading to large-scale blackouts. Proof-of-Work cryptocurrencies are potential candidates for creating such imbalances as disturbances in mining can cause abrupt changes in power demand. The problem is amplified by the ongoing centralization of mining hardware in large mining pools. Therefore, we investigate power consumption characteristics of miners, consult mining pool data, and analyze the amount of total power consumption as well as its worldwide distribution of two major cryptocurrencies, namely Bitcoin and Ethereum. Thus, answering the question: Are Proof-of-Work based cryptocurrencies a threat to reliable power grid operation?."
Characterizing Eve: Analysing Cybercrime Actors in a Large Underground Forum,"Underground forums contain many thousands of active users, but the vast majority will be involved, at most, in minor levels of deviance. The number who engage in serious criminal activity is small. That being said, underground forums have played a significant role in several recent high-profile cybercrime activities. In this work we apply data science approaches to understand criminal pathways and characterize key actors related to illegal activity in one of the largest and longest-running underground forums. We combine the results of a logistic regression model with k-means clustering and social network analysis, verifying the findings using topic analysis. We identify variables relating to forum activity that predict the likelihood a user will become an actor of interest to law enforcement, and would therefore benefit the most from intervention. This work provides the first step towards identifying ways to deter the involvement of young people away from a career in cybercrime."
SybilBlind: Detecting Fake Users in Online Social Networks Without Manual Labels,"Detecting fake users (also called Sybils) in online social networks is a basic security research problem. State-of-the-art approaches rely on a large amount of manually labeled users as a training set. These approaches suffer from three key limitations: (1) it is time-consuming and costly to manually label a large training set, (2) they cannot detect new Sybils in a timely fashion, and (3) they are vulnerable to Sybil attacks that leverage information of the training set. In this work, we propose SybilBlind, a structure-based Sybil detection framework that does not rely on a manually labeled training set. SybilBlind works under the same threat model as state-of-the-art structure-based methods. We demonstrate the effectiveness of SybilBlind using (1) a social network with synthetic Sybils and (2) two Twitter datasets with real Sybils. For instance, SybilBlind achieves an AUC of 0.98 on a Twitter dataset."
GuidedPass: Helping Users to Create Strong and Memorable Passwords,"Password meters and policies are currently the only tools helping users to create stronger passwords. However, such tools often do not provide consistent or useful feedback to users, and their suggestions may decrease memorability of resulting passwords. Passwords that are difficult to remember promote bad practices, such as writing them down or password reuse, thus stronger passwords do not necessarily improve authentication security. In this work, we propose GuidedPass – a system that suggests real-time password modifications to users, which preserve the password’s semantic structure, while increasing password strength. Our suggestions are based on structural and semantic patterns mined from successfully recalled and strong passwords in several IRB-approved user studies [30]. We compare our approach to password creation with creation under NIST [12] policy, Ur et al. [26] guidance, and zxcvbn password-meter. We show that GuidedPass outperforms competing approaches both in password strength and in recall performance."
Fine-Pruning: Defending Against Backdooring Attacks on Deep Neural Networks,"Deep neural networks (DNNs) provide excellent performance across a wide range of classification tasks, but their training requires high computational resources and is often outsourced to third parties. Recent work has shown that outsourced training introduces the risk that a malicious trainer will return a backdoored DNN that behaves normally on most inputs but causes targeted misclassifications or degrades the accuracy of the network when a trigger known only to the attacker is present. In this paper, we provide the first effective defenses against backdoor attacks on DNNs. We implement three backdoor attacks from prior work and use them to investigate two promising defenses, pruning and fine-tuning. We show that neither, by itself, is sufficient to defend against sophisticated attackers. We then evaluate fine-pruning, a combination of pruning and fine-tuning, and show that it successfully weakens or even eliminates the backdoors, i.e., in some cases reducing the attack success rate to 0% with only a  0.4   drop in accuracy for clean (non-triggering) inputs. Our work provides the first step toward defenses against backdoor attacks in deep neural networks."
Dictionary Extraction and Detection of Algorithmically Generated Domain Names in Passive DNS Traffic,"Automatic detection of algorithmically generated domains (AGDs) is a crucial element for fighting Botnets. Modern AGD detection systems have benefited from the combination of powerful advanced machine learning algorithms and linguistic distinctions between legitimate domains and malicious AGDs. However, a more evolved class of AGDs misleads the aforementioned detection systems by generating domains based on wordlists (also called dictionaries). The resulting domains, Dictionary-AGDs, are seemingly benign to both human analysis and most of AGD detection methods that receive as input solely the domain itself. In this paper, we design and implement method called WordGraph for extracting dictionaries used by the Domain Generation Algorithms (DGAs) solely DNS traffic. Our result immediately gives us an efficient mechanism for detecting this elusive, new type of DGA, without any need for reverse engineering to extract dictionaries. Our experimental results on data from known Dictionary-AGDs show that our method can extract dictionary information that is embedded in the malware code even when the number of DGA domains is much smaller than that of legitimate domains, or when multiple dictionaries are present in the data. This allows our approach to detect Dictionary-AGDs in real traffic more accurately than state-of-the-art methods based on human defined features or featureless deep learning approaches."
OTTer: A Scalable High-Resolution Encrypted Traffic Identification Engine,"Several security applications rely on monitoring network traffic, which is increasingly becoming encrypted. In this work, we propose a pattern language to describe packet trains for the purpose of fine-grained identification of application-level events in encrypted network traffic, and demonstrate its expressiveness with case studies for distinguishing Messaging, Voice, and Video events in Facebook, Skype, Viber, and WhatsApp network traffic. We provide an efficient implementation of this language, and evaluate its performance by integrating it into our proprietary DPI system. Finally, we demonstrate that the proposed pattern language can be mined from traffic samples automatically, minimizing the otherwise high ruleset maintenance burden."
Hardware Assisted Randomization of Data,"Data-oriented attacks are gaining traction thanks to advances in code-centric mitigation techniques for memory corruption vulnerabilities. Previous work on mitigating data-oriented attacks includes Data Space Randomization (DSR). DSR classifies program variables into a set of equivalence classes, and encrypts variables with a key randomly chosen for each equivalence class. This thwarts memory corruption attacks that introduce illegitimate data flows. However, existing implementations of DSR trade precision for better run-time performance, which leaves attackers sufficient leeway to mount attacks. In this paper, we show that high precision and good run-time performance are not mutually exclusive. We present HARD, a precise and efficient hardware-assisted implementation of DSR. HARD distinguishes a larger number of equivalence classes, and incurs lower run-time overhead than software-only DSR. Our implementation achieves run-time overheads of just 6.61% on average, while the software version with the same protection costs 40.96%."
MicroStache: A Lightweight Execution Context for In-Process Safe Region Isolation,"In this work we present, MicroStache, a specialized hardware mechanism and new process abstraction for accelerating safe region security solutions. In the safe region paradigm, an application is split into safe and unsafe parts. Unfortunately, frequent mixing of safe and unsafe operations stresses memory isolation mechanisms. MicroStache addresses this challenge by adding an orthogonal execution domain into the process abstraction, consisting of a memory segment and minimal instruction set. Unlike alternative hardware, MicroStache implements a simple microarchitectural memory segmentation scheme while integrating it with paging, and also extends the safe region abstraction to isolate data in the processor cache, allowing it to protect against cache side channel attacks. A prototype is presented that demonstrates how to automatically leverage MicroStache to enforce security polices, SafeStack and CPI, with 5% and 1.2% overhead beyond randomized isolation. Despite specialization, MicroStache enhances a growing and critical programming paradigm with minimal hardware complexity."
CryptMe: Data Leakage Prevention for Unmodified Programs on ARM Devices,"Sensitive data (e.g., passwords, health data and private videos) can be leaked due to many reasons, including (1) the misuse of legitimate operating system (OS) functions such as core dump, swap and hibernation, and (2) physical attacks to the DRAM chip such as cold-boot attacks and DMA attacks. While existing software-based memory encryption is effective in defeating physical attacks, none of them can prevent a legitimate OS function from accidentally leaking sensitive data in the memory. This paper introduces CryptMe that integrates memory encryption and ARM TrustZone-based memory access controls to protect sensitive data against both attacks. CryptMe essentially extends the Linux kernel with the ability to accommodate the execution of unmodified programs in an isolated execution domain (to defeat OS function misuse), and at the same time transparently encrypt sensitive data appeared in the DRAM chip (to defeat physical attacks). We have conducted extensive experiments on our prototype implementation. The evaluation results show the efficiency and added security of our design."
PartiSan: Fast and Flexible Sanitization via Run-Time Partitioning,"Sanitizers can detect security vulnerabilities in C/C++ code that elude static analysis. Current practice is to continuously fuzz and sanitize internal pre-release builds. Sanitization-enabled builds are rarely released publicly. This is in large part due to the high memory and processing requirements of sanitizers.We present PartiSan, a run-time partitioning technique that speeds up sanitizers and allows them to be used in a more flexible manner. Our core idea is to partition the execution into sanitized slices that incur a run-time overhead, and “unsanitized” slices running at full speed. With PartiSan, sanitization is no longer an all-or-nothing proposition. A single build can be distributed to every user regardless of their willingness to enable sanitization and the capabilities of their host system. PartiSan enables application developers to define their own sanitization policies. Such policies can automatically adjust the amount of sanitization to fit within a performance budget or disable sanitization if the host lacks sufficient resources. The flexibility afforded by run-time partitioning also means that we can alternate between different types of sanitizers dynamically; today, developers have to pick a single type of sanitizer ahead of time. Finally, we show that run-time partitioning can speed up fuzzing by running the sanitized partition only when the fuzzer discovers an input that causes a crash or uncovers new execution paths."
[equation] CFI: Type-Assisted Control Flow Integrity for x86-64 Binaries,"Programs aiming for low runtime overhead and high availability draw on several object-oriented features available in the C/C++ programming language, such as dynamic object dispatch. However, there is an alarmingly high number of object dispatch (i.e., forward-edge) corruption vulnerabilities, which undercut security in significant ways and are in need of a thorough solution. In this paper, we propose    {  {CFI}} , an extended control flow integrity (CFI) model that uses both the types and numbers of function parameters to enforce forward- and backward-edge control flow transfers. At a high level, it improves the precision of existing forward-edge recognition approaches by considering the type information of function parameters, which are directly extracted from the application binaries. Therefore,    {  {CFI}}  can be used to harden legacy applications for which source code may not be available. We have evaluated    {  {CFI}}  on real-world binaries including Nginx, NodeJS, Lighttpd, MySql and the SPEC CPU2006 benchmark and demonstrate that    {  {CFI}}  is able to effectively protect these applications from forward- and backward-edge corruptions with low runtime overhead. In direct comparison with state-of-the-art tools,    {  {CFI}}  achieves higher forward-edge caller-callee matching precision."
Trusted Execution Path for Protecting Java Applications Against Deserialization of Untrusted Data,"Deserialization of untrusted data is an issue in many programming languages. In particular, deserialization of untrusted data in Java can lead to Remote Code Execution attacks. Conditions for this type of attack exist, but vulnerabilities are hard to detect. In this paper, we propose a novel sandboxing approach for protecting Java applications based on trusted execution path used for defining the deserialization behavior. We test our defensive mechanism on two main Java Framework JBoss and Jenkins and we show the effectiveness and efficiency of our system. We also discuss the limitations of our current system on newer attacks strategies."
