,0
Verifying the Safety of User Pointer Dereferences - IEEE Conference Publication,"Operating systems divide virtual memory addresses into kernel space and user space. The interface of a modern operating system consists of a set of system call procedures that may take pointer arguments called user pointers. It is safe to dereference a user pointer if and only if it points into user space. If the operating system dereferences a user pointer that does not point into user space, then a malicious user application could gain control of the operating system, reveal sensitive data from kernel space, or crash the machine. Because the operating system cannot trust user processes, the operating system must check that the user pointer points to user space before dereferencing it. In this paper, we present a scalable and precise static analysis capable of verifying the absence of unchecked user pointer dereferences. We evaluate an implementation of our analysis on the entire Linux operating system with over 6.2 million lines of code with false alarms reported on only 0.05% of dereference sites."
Expressive Declassification Policies and Modular Static Enforcement - IEEE Conference Publication,"This paper provides a way to specify expressive declassification policies, in particular, when, what, and where policies that include conditions under which downgrading is allowed. Secondly, an end-to-end semantic property is introduced, based on a model that allows observations of intermediate low states as well as termination. An attacker's knowledge only increases at explicit declassification steps, and within limits set by policy. Thirdly, static enforcement is provided by combining type-checking with program verification techniques applied to the small subprograms that carry out declassifications. Enforcement is proved sound for a simple programming language and the extension to object-oriented programs is described."
Civitas: Toward a Secure Voting System - IEEE Conference Publication,"Civitas is the first electronic voting system that is coercion-resistant, universally and voter verifiable, and suitable for remote voting. This paper describes the design and implementation of Civitas. Assurance is established in the design through security proofs, and in the implementation through information-flow security analysis. Experimental results give a quantitative evaluation of the tradeoffs between time, cost, and security."
Fable: A Language for Enforcing User-defined Security Policies - IEEE Conference Publication,"This paper presents FABLE, a core formalism for a programming language in which programmers may specify security policies and reason that these policies are properly enforced. In FABLE, security policies can be expressed by associating security labels with the data or actions they protect. Programmers define the semantics of labels in a separate part of the program called the enforcement policy. FABLE prevents a policy from being circumvented by allowing labeled terms to be manipulated only within the enforcement policy; application code must treat labeled values abstractly. Together, these features facilitate straightforward proofs that programs implementing a particular policy achieve their high-level security goals. FABLE is flexible enough to implement a wide variety of security policies, including access control, information flow, provenance, and security automata. We have implemented FABLE as part of the LINKS web programming language; we call the resulting language SELlNKS. We report on our experience using SELlNKS to build two substantial applications, a wiki and an on-line store, equipped with a combination of access control and provenance policies. To our knowledge, no existing framework enables the enforcement of such a wide variety of security policies with an equally high level of assurance."
Saner: Composing Static and Dynamic Analysis to Validate Sanitization in Web Applications - IEEE Conference Publication,"Web applications are ubiquitous, perform mission- critical tasks, and handle sensitive user data. Unfortunately, web applications are often implemented by developers with limited security skills, and, as a result, they contain vulnerabilities. Most of these vulnerabilities stem from the lack of input validation. That is, web applications use malicious input as part of a sensitive operation, without having properly checked or sanitized the input values prior to their use. Past research on vulnerability analysis has mostly focused on identifying cases in which a web application directly uses external input in critical operations. However, little research has been performed to analyze the correctness of the sanitization process. Thus, whenever a web application applies some sanitization routine to potentially malicious input, the vulnerability analysis assumes that the result is innocuous. Unfortunately, this might not be the case, as the sanitization process itself could be incorrect or incomplete. In this paper, we present a novel approach to the analysis of the sanitization process. More precisely, we combine static and dynamic analysis techniques to identify faulty sanitization procedures that can be bypassed by an attacker. We implemented our approach in a tool, called Saner, and we applied it to a number of real-world applications. Our results demonstrate that we were able to identify several novel vulnerabilities that stem from erroneous sanitization procedures."
Secure Web Browsing with the OP Web Browser - IEEE Conference Publication,"Current Web browsers are plagued with vulnerabilities, providing hackers with easy access to computer systems via browser-based attacks. Browser security efforts that retrofit existing browsers have had limited success because the design of modern browsers is fundamentally flawed. To enable more secure web browsing, we design and implement a new browser, called the OP Web browser, that attempts to improve the state-of-the-art in browser security. Our overall design approach is to combine operating system design principles with formal methods to design a more secure Web browser by drawing on the expertise of both communities. Our overall design philosophy is to partition the browser into smaller subsystems and make all communication between subsystems simple and explicit. At the core of our design is a small browser kernel that manages the browser subsystems and interposes on all communications between them to enforce our new browser security features. To show the utility of our browser architecture, we design and implement three novel security features. First, we develop novel and flexible security policies that allows us to include plugins within our security framework. Our policy removes the burden of security from plugin writers, and gives plugins the flexibility to use innovative network architectures to deliver content while still maintaining the confidentiality and integrity of our browser, even if attackers compromise the plugin. Second, we use formal methods to prove that the address bar displayed within our browser user interface always shows the correct address for the current Web page. Third, we design and implement a browser-level information-flow tracking system to enable post-mortem analysis of browser-based attacks. If an attacker is able to compromise our browser, we highlight the subset of total activity that is causally related to the attack, thus allowing users and system administrators to determine easily which Web site lead to the compromise and to assess the damage of a successful attack. To evaluate our design, we implemented OP and tested both performance and filesystem impact. To test performance, we measure latency to verify OP's performance penalty from security features are be minimal from a users perspective. Our experiments show that on average the speed of the OP browser is comparable to Firefox and the audit log occupies around 80 KB per page on average."
Automated Formal Analysis of a Protocol for Secure File Sharing on Untrusted Storage - IEEE Conference Publication,"We study formal security properties of a state-of-the-art protocol for secure file sharing on untrusted storage, in the automatic protocol verifier ProVerif. As far as we know, this is the first automated formal analysis of a secure storage protocol. The protocol, designed as the basis for the file system Plutus, features a number of interesting schemes like lazy revocation and key rotation. These schemes improve the protocol's performance, but complicate its security properties. Our analysis clarifies several ambiguities in the design and reveals some unknown attacks on the protocol. We propose corrections, and prove precise security guarantees for the corrected protocol."
