,0
Advanced Network Fingerprinting,"Security assessment tasks and intrusion detection systems do rely on automated fingerprinting of devices and services. Most current fingerprinting approaches use a signature matching scheme, where a set of signatures are compared with traffic issued by an unknown entity. The entity is identified by finding the closest match with the stored signatures. These fingerprinting signatures are found mostly manually, requiring a laborious activity and needing advanced domain specific expertise. In this paper we describe a novel approach to automate this process and build flexible and efficient fingerprinting systems able to identify the source entity of messages in the network. We follow a passive approach without need to interact with the tested device. Application level traffic is captured passively and inherent structural features are used for the classification process. We describe and assess a new technique for the automated extraction of protocol fingerprints based on arborescent features extracted from the underlying grammar. We have successfully applied our technique to the Session Initiation Protocol (SIP) used in Voice over IP signalling."
On Evaluation of Response Cost for Intrusion Response Systems,In this work we present a structured and consistent methodology for evaluating cost of intrusion responses. The proposed approach provides consistent basis for response evaluation across different systems while incorporating security policy and properties of specific system environment. The advantages of the proposed cost model were evaluated via simulation process.
WebIDS: A Cooperative Bayesian Anomaly-Based Intrusion Detection System for Web Applications (Extended Abstract),"This paper presents WebIDS, a learning-based anomaly detection system for Web applications aiming at improving the decision process, reducing the number of false positives, and achieving distributed detection."
Evading Anomaly Detection through Variance Injection Attacks on PCA,"Whenever machine learning is applied to security problems, it is important to measure vulnerabilities to adversaries who poison the training data. We demonstrate the impact of variance injection schemes on PCA-based network-wide volume anomaly detectors, when a single compromised PoP injects chaff into the network. These schemes can increase the chance of evading detection by sixfold, for DoS attacks."
Anticipating Hidden Text Salting in Emails,"Salting is the intentional addition or distortion of content, aimed to evade automatic filtering. Salting is usually found in spam emails. Salting can also be hidden in phishing emails, which aim to steal personal information from users. We present a novel method that detects hidden salting tricks as visual anomalies in text. We solely use these salting tricks to successfully classify emails as phishing (F-measure >90%)."
Improving Anomaly Detection Error Rate by Collective Trust Modeling,"Current Network Behavior Analysis (NBA) techniques are based on anomaly detection principles and therefore subject to high error rates. We propose a mechanism that deploys trust modeling, a technique for cooperator modeling from the multi-agent research, to improve the quality of NBA results. Our system is designed as a set of agents, each of them based on an existing anomaly detection algorithm coupled with a trust model based on the same traffic representation. These agents minimize the error rate by unsupervised, multi-layer integration of traffic classification. The system has been evaluated on real traffic in Czech academic networks."
Database Intrusion Detection and Response,"Why is it important to have an intrusion detection (ID) mechanism tailored for a database management system (DBMS)? There are three main reasons for this. First, actions deemed malicious for a DBMS are not necessarily malicious for the underlying operating system or the network; thus ID systems designed for the latter may not be effective against database attacks. Second, organizations have stepped up data vigilance driven by various government regulations concerning data management such as SOX, GLBA, HIPAA and so forth. Third, and this is probably the most relevant reason, the problem of insider threats is being recognized as a major security threat; its solution requires among other techniques the adoption of mechanisms able to detect access anomalies by users internal to the organization owning the data."
An Empirical Approach to Identify Information Misuse by Insiders (Extended Abstract),"Rogue employees with access to sensitive information can easily abuse their access to engage in information theft. To help differentiate malicious from benign behavior, this study measures how participants, given a common search topic, seek information. This study uses double-blind procedures, a stratified sample, and carefully designed control and experimental conditions. We seek to validate previously identified network indicators (ELICIT), find new host-based behaviors, and consider other human attributes that affect the information-use of malicious insiders by comparing their behavior to equivalent non-malicious users."
Page-Based Anomaly Detection in Large Scale Web Clusters Using Adaptive MapReduce (Extended Abstract),"While anomaly detection systems typically work on single server, most commercial web sites operate cluster environments, and user queries trigger transactions scattered through multiple servers. For this reason, anomaly detectors in a same server farm should communicate with each other to integrate their partial profile. In this paper, we describe a real-time distributed anomaly detection system that can deal with over one billion transactions per day. In our system, base on Google MapReduce algorithm, an anomaly detector in each node shares profiles of user behaviors and propagates intruder information to reduce false alarms. We evaluated our system using web log data from www.microsoft.com. The web log data, about 250GB in size, contains over one billion transactions recorded in a day."
Automating the Analysis of Honeypot Data (Extended Abstract),"We describe the on-going work towards further automating the analysis of data generated by a large honeynet architecture called Leurre.com and SGNET. The underlying motivation is helping us to integrate the use of honeypot data into daily network security monitoring. We propose a system based on two automated steps: i) the detection of relevant attack events within a large honeynet traffic data set, and ii) the extraction of highly similar events based on temporal correlation."
Anomaly and Specification Based Cognitive Approach for Mission-Level Detection and Response,"In 2005 a survivable system we built was subjected to red-team evaluation. Analyzing, interpreting, and responding to the defense mechanism reports took a room of developers. In May 2008 we took part in another red-team exercise. During this exercise an autonomous reasoning engine took the place of the room of developers. Our reasoning engine uses anomaly and specification-based approaches to autonomously decide if system and mission availability is in jeopardy, and take necessary corrective actions. This extended abstract presents a brief summary of the reasoning capability we developed: how it categorizes the data into an internal representation and how it uses deductive and coherence based reasoning to decide whether a response is warranted."
Monitoring the Execution of Third-Party Software on Mobile Devices,"The current security model for a third-party application running on a mobile device requires its user to trust that application’s vendor and whilst mechanisms exist to mediate this relationship, they cannot guarantee complete protection against the threats posed. This work introduces a security architecture that prevents a third-party application deviating from its intended behaviour, defending devices against previously unseen malware more effectively than existing security measures."
Streaming Estimation of Information-Theoretic Metrics for Anomaly Detection (Extended Abstract),"Information-theoretic metrics hold great promise for modeling traffic and detecting anomalies if only they could be computed in an efficient, scalable way. Recent advances in streaming estimation algorithms give hope that such computations can be made practical. We describe our work in progress that aims to use streaming algorithms on 802.11a/b/g link layer (and above) features and feature pairs to detect anomalies."
Bots Behaviors vs. Human Behaviors on Large-Scale Communication Networks (Extended Abstract),"In this paper we propose a hierarchical framework for detecting and characterizing any types of botnets on a large-scale WiFi ISP network. In particular, we first analyze and classify the network traffic into different applications by using payload signatures and the cross-associations for IP addresses and ports. Then based on specific application community (e.g. IRC, HTTP, or Peer-to-Peer), we present a novel temporal-frequent characteristic of flows that leads the differentiation of malicious behaviors created by bots from normal network traffic generated by human beings. We evaluate our approach with over 160 million flows collected over five consecutive days on a large-scale network and preliminary results show the proposed approach successfully detects the IRC botnet flows from over 160 million flows with a high detection rate and an acceptable low false alarm rate."
Anomalous Taint Detection,"We propose anomalous taint detection, an approach that combines fine-grained taint tracking with learning-based anomaly detection. Anomaly detection is used to identify behavioral deviations that manifest when vulnerabilities are exercised. Fine-grained taint-tracking is used to target the anomaly detector on those aspects of program behavior that can be controlled by an attacker. Our preliminary results indicate that the combination increases detection accuracy over either technique, and promises to offer better resistance to mimicry attacks."
Deep Packet Inspection Using Message Passing Networks,"We propose a solution based on message passing bipartite networks, for deep packet inspection, which addresses both speed and memory issues, which are limiting factors in current solutions. We report on a preliminary implementation and propose a parallel architecture."
System Call API Obfuscation (Extended Abstract),"We claim that attacks can evade the comprehension of security tools that rely on knowledge of standard system call interfaces to reason about process execution behavior. Our attack, called Illusion, will invoke privileged operations in a Windows or Linux kernel at the request of user-level processes without requiring those processes to call the actual system calls corresponding to the operations. The Illusion interface will hide system operations from user-, kernel-, and hypervisor-level monitors mediating the conventional system-call interface. Illusion will alter neither static kernel code nor read-only dispatch tables, remaining elusive from tools protecting kernel memory."
