,0
Guest-Transparent Prevention of Kernel Rootkits with VMM-Based Memory Shadowing,"Kernel rootkits pose a significant threat to computer systems as they run at the highest privilege level and have unrestricted access to the resources of their victims. Many current efforts in kernel rootkit defense focus on the detection of kernel rootkits – after a rootkit attack has taken place, while the smaller number of efforts in kernel rootkit prevention exhibit limitations in their capability or deployability. In this paper we present a kernel rootkit prevention system called NICKLE which addresses a common, fundamental characteristic of most kernel rootkits: the need for executing their own kernel code. NICKLE is a lightweight, virtual machine monitor (VMM) based system that transparently prevents unauthorized kernel code execution for unmodified commodity (guest) OSes. NICKLE is based on a new scheme called memory shadowing, wherein the trusted VMM maintains a shadow physical memory for a running VM and performs real-time kernel code authentication so that only authenticated kernel code will be stored in the shadow memory. Further, NICKLE transparently routes guest kernel instruction fetches to the shadow memory at runtime. By doing so, NICKLE guarantees that only the authenticated kernel code will be executed, foiling the kernel rootkit’s attempt to strike in the first place. We have implemented NICKLE in three VMM platforms: QEMU+KQEMU, VirtualBox, and VMware Workstation. Our experiments with 23 real-world kernel rootkits targeting the Linux or Windows OSes demonstrate NICKLE’s effectiveness. Furthermore, our performance evaluation shows that NICKLE introduces small overhead to the VMM platform."
Countering Persistent Kernel Rootkits through Systematic Hook Discovery,"Kernel rootkits, as one of the most elusive types of malware, pose significant challenges for investigation and defense. Among the most notable are persistent kernel rootkits, a special type of kernel rootkits that implant persistent kernel hooks to tamper with the kernel execution to hide their presence. To defend against them, an effective approach is to first identify those kernel hooks and then protect them from being manipulated by these rootkits. In this paper, we focus on the first step by proposing a systematic approach to identify those kernel hooks. Our approach is based on two key observations: First, rootkits by design will attempt to hide its presence from all running rootkit-detection software including various system utility programs (e.g., ps and ls). Second, to manipulate OS kernel control-flows, persistent kernel rootkits by their nature will implant kernel hooks on the corresponding kernel-side execution paths invoked by the security programs. In other words, for any persistent kernel rootkit, either it is detectable by a security program or it has to tamper with one of the kernel hooks on the corresponding kernel-side execution path(s) of the security program. As a result, given an authentic security program, we only need to monitor and analyze its kernel-side execution paths to identify the related set of kernel hooks that could be potentially hijacked for evasion. We have built a proof-of-concept system called HookMap and evaluated it with a number of Linux utility programs such as ls, ps, and netstat in RedHat Fedora Core 5. Our system found that there exist 35 kernel hooks in the kernel-side execution path of ls that can be potentially hijacked for manipulation (e.g., for hiding files). Similarly, there are 85 kernel hooks for ps and 51 kernel hooks for netstat, which can be respectively hooked for hiding processes and network activities. A manual analysis of eight real-world rootkits shows that our identified kernel hooks cover all those used in them."
"Tamper-Resistant, Application-Aware Blocking of Malicious Network Connections","Application-level firewalls block traffic based on the process that is sending or receiving the network flow. They help detect bots, worms, and backdoors that send or receive malicious packets without the knowledge of users. Recent attacks show that these firewalls can be disabled by knowledgeable attackers. To counter this threat, we develop VMwall, a fine-grained tamper-resistant process-oriented firewall. VMwall’s design blends the process knowledge of application-level firewalls with the isolation of traditional stand-alone firewalls. VMwall uses the Xen hypervisor to provide protection from malware, and it correlates TCP or UDP traffic with process information using virtual machine introspection. Experiments show that VMwall successfully blocks numerous real attacks—bots, worms, and backdoors—against a Linux system while allowing all legitimate network flows. VMwall is performant, imposing only a 0–1 millisecond delay on TCP connection establishment, less than a millisecond delay on UDP connections, and a 1–7% slowdown on network-bound applications. Our attack analysis argues that with the use of appropriate external protection of guest kernels, VMwall’s introspection remains robust and helps identify malicious traffic."
A First Step towards Live Botmaster Traceback,"Despite the increasing botnet threat, research in the area of botmaster traceback is limited. The four main obstacles are 1) the low-traffic nature of the bot-to-botmaster link; 2) chains of “stepping stones;” 3) the use of encryption along these chains; and 4) mixing with traffic from other bots. Most existing traceback approaches can address one or two of these issues, but no single approach can overcome all of them. We present a novel flow watermarking technique to address all four obstacles simultaneously. Our approach allows us to uniquely identify and trace any IRC-based botnet flow even if 1) it is encrypted (e.g., via SSL/TLS); 2) it passes multiple intermediate stepping stones (e.g., IRC server, SOCKs); and 3) it is mixed with other botnet traffic. Our watermarking scheme relies on adding padding characters to outgoing botnet C&C messages at the application layer. This produces specific differences in lengths between randomly chosen pairs of messages in a network flow. As a result, our watermarking technique can be used to trace any interactive botnet C&C traffic and it only requires a few dozen packets to be effective. To the best of our knowledge, this is the first approach that has the potential to allow real-time botmaster traceback across the Internet.We have empirically validated the effectiveness of our botnet flow watermarking approach with live experiments on PlanetLab nodes and public IRC servers on different continents. We achieved virtually a 100% detection rate of watermarked (encrypted and unencrypted) IRC traffic with a false positive rate on the order of 10− 5. Due to the message queuing and throttling functionality of IRC servers, mixing chaff with the watermarked flow does not significantly impact the effectiveness of our watermarking approach."
A Layered Architecture for Detecting Malicious Behaviors,"We address the semantic gap problem in behavioral monitoring by using hierarchical behavior graphs to infer high-level behaviors from myriad low-level events. Our experimental system traces the execution of a process, performing data-flow analysis to identify meaningful actions such as “proxying”, “keystroke logging”, “data leaking”, and “downloading and executing a program” from complex combinations of rudimentary system calls. To preemptively address evasive malware behavior, our specifications are carefully crafted to detect alternative sequences of events that achieve the same high-level goal. We tested eleven benign programs, variants from seven malicious bot families, four trojans, and three mass-mailing worms and found that we were able to thoroughly identify high-level behaviors across this diverse code base. Moreover, we effectively distinguished malicious execution of high-level behaviors from benign by identifying remotely-initiated actions."
A Study of the Packer Problem and Its Solutions,"An increasing percentage of malware programs distributed in the wild are packed by packers, which are programs that transform an input binary’s appearance without affecting its execution semantics, to create new malware variants that can evade signature-based malware detection tools. This paper reports the results of a comprehensive study of the extent of the packer problem based on data collected at Symantec and the effectiveness of existing solutions to this problem. Then the paper presents a generic unpacking solution called Justin (Just-In-Time AV scanning), which is designed to detect the end of unpacking of a packed binary’s run and invoke AV scanning against the process image at that time. For accurate end-to-unpacking detection, Justin incorporates the following heuristics: Dirty Page Execution, Unpacker Memory Avoidance, Stack Pointer Check and Command-Line Argument Access. Empirical testing shows that when compared with SymPack, which contains a set of manually created unpackers for a collection of selective packers, Justin’s effectiveness is comparable to SymPack for those binaries packed by these supported packers, and is much better than SymPack for binaries packed by those that SymPack does not support."
Gnort: High Performance Network Intrusion Detection Using Graphics Processors,"The constant increase in link speeds and number of threats poses challenges to network intrusion detection systems (NIDS), which must cope with higher traffic throughput and perform even more complex per-packet processing. In this paper, we present an intrusion detection system based on the Snort open-source NIDS that exploits the underutilized computational power of modern graphics cards to offload the costly pattern matching operations from the CPU, and thus increase the overall processing throughput. Our prototype system, called Gnort, achieved a maximum traffic processing throughput of 2.3 Gbit/s using synthetic network traces, while when monitoring real traffic using a commodity Ethernet interface, it outperformed unmodified Snort by a factor of two. The results suggest that modern graphics cards can be used effectively to speed up intrusion detection systems, as well as other systems that involve pattern matching operations."
Predicting the Resource Consumption of Network Intrusion Detection Systems,"When installing network intrusion detection systems (NIDSs), operators are faced with a large number of parameters and analysis options for tuning trade-offs between detection accuracy versus resource requirements. In this work we set out to assist this process by understanding and predicting the CPU and memory consumption of such systems. We begin towards this goal by devising a general NIDS resource model to capture the ways in which CPU and memory usage scale with changes in network traffic. We then use this model to predict the resource demands of different configurations in specific environments. Finally, we present an approach to derive site-specific NIDS configurations that maximize the depth of analysis given predefined resource constraints. We validate our approach by applying it to the open-source Bro NIDS, testing the methodology using real network data, and developing a corresponding tool, nidsconf, that automatically derives a set of configurations suitable for a given environment based on a sample of the site’s traffic. While no automatically generated configuration can ever be optimal, these configurations provide sound starting points, with promise to significantly reduce the traditional trial-and-error NIDS installation cycle."
High-Speed Matching of Vulnerability Signatures,"Vulnerability signatures offer better precision and flexibility than exploit signatures when detecting network attacks. We show that it is possible to detect vulnerability signatures in high-performance network intrusion detection systems, by developing a matching architecture that is specialized to the task of vulnerability signatures. Our architecture is based upon: i) the use of high-speed pattern matchers, together with control logic, instead of recursive parsing, ii) the limited nature and careful management of implicit state, and iii) the ability to avoid parsing large fragments of the message not relevant to a vulnerability.We have built a prototype implementation of our architecture and vulnerability specification language, called VESPA, capable of detecting vulnerabilities in both text and binary protocols. We show that, compared to full protocol parsing, we can achieve 3x or better speedup, and thus detect vulnerabilities in most protocols at a speed of 1 Gbps or more. Our architecture is also well-adapted to being integrated with network processors or other special-purpose hardware. We show that for text protocols, pattern matching dominates our workload and great performance improvements can result from hardware acceleration."
Swarm Attacks against Network-Level Emulation/Analysis,"It is always assumed that if the attackers can achieve their goal by exploiting a vulnerability once, they won’t exploit it twice. This assumption shapes our view of what attacks look like, and affects the design of many security systems. In this work, we propose the swarm attack, in which the attacker deliberately exploits the same vulnerability multiple times, each intended to carry out only a small part of the attack goal. We have studied eight systems that detect attacks using network-level emulation/analysis, and find them surprisingly vulnerable to attacks based on this strategy."
Leveraging User Interactions for In-Depth Testing of Web Applications,"Over the last years, the complexity of web applications has grown significantly, challenging desktop programs in terms of functionality and design. Along with the rising popularity of web applications, the number of exploitable bugs has also increased significantly. Web application flaws, such as cross-site scripting or SQL injection bugs, now account for more than two thirds of the reported security vulnerabilities.Black-box testing techniques are a common approach to improve software quality and detect bugs before deployment. There exist a number of vulnerability scanners, or fuzzers, that expose web applications to a barrage of malformed inputs in the hope to identify input validation errors. Unfortunately, these scanners often fail to test a substantial fraction of a web application’s logic, especially when this logic is invoked from pages that can only be reached after filling out complex forms that aggressively check the correctness of the provided values.In this paper, we present an automated testing tool that can find reflected and stored cross-site scripting (XSS) vulnerabilities in web applications. The core of our system is a black-box vulnerability scanner. This scanner is enhanced by techniques that allow one to generate more comprehensive test cases and explore a larger fraction of the application. Our experiments demonstrate that our approach is able to test more thoroughly these programs and identify more bugs than a number of open-source and commercial web vulnerability scanners."
Model-Based Covert Timing Channels: Automated Modeling and Evasion,"The exploration of advanced covert timing channel design is important to understand and defend against covert timing channels. In this paper, we introduce a new class of covert timing channels, called model-based covert timing channels, which exploit the statistical properties of legitimate network traffic to evade detection in an effective manner. We design and implement an automated framework for building model-based covert timing channels. Our framework consists of four main components: filter, analyzer, encoder, and transmitter. The filter characterizes the features of legitimate network traffic, and the analyzer fits the observed traffic behavior to a model. Then, the encoder and transmitter use the model to generate covert traffic and blend with legitimate network traffic. The framework is lightweight, and the overhead induced by model fitting is negligible. To validate the effectiveness of the proposed framework, we conduct a series of experiments in LAN and WAN environments. The experimental results show that model-based covert timing channels provide a significant increase in detection resistance with only a minor loss in capacity."
"Optimal Cost, Collaborative, and Distributed Response to Zero-Day Worms - A Control Theoretic Approach",Collaborative environments present a happy hunting ground for worms due to inherent trust present amongst the peers. We present a novel control-theoretic approach to respond to zero-day worms in a signature independent fashion in a collaborative environment. A federation of collaborating peers share information about anomalies to estimate the presence of a worm and each one of them independently chooses the most cost-optimal response from a given set of responses. This technique is designed to work when the presence of a worm is uncertain. It is unique in that the response is dynamic and self-regulating based on the current environment conditions. Distributed Sequential Hypothesis Testing is used to estimate the extent of worm infection in the environment. Response is formulated as a Dynamic Programming problem with imperfect state information. We present a solution and evaluate it in the presence of an Internet worm attack for various costs of infections and response.A major contribution of this paper is analytically formalizing the problem of optimal and cost-effective response to worms. The second contribution is an adaptive response design that minimizes the variety of worms that can be successful. This drives the attacker towards kinds of worms that can be detected by other means; which in itself is a success. Counter-intutive results such as leaving oneself open to infections being the cheapest option in certain scenarios become apparent with our response model.
On the Limits of Payload-Oblivious Network Attack Detection,"We introduce a methodology for evaluating network intrusion detection systems using an observable attack space, which is a parameterized representation of a type of attack that can be observed in a particular type of log data. Using the observable attack space for log data that does not include payload (e.g., NetFlow data), we evaluate the effectiveness of five proposed detectors for bot harvesting and scanning attacks, in terms of their ability (even when used in conjunction) to deter the attacker from reaching his goals. We demonstrate the ranges of attack parameter values that would avoid detection, or rather that would require an inordinately high number of false alarms in order to detect them consistently."
Determining Placement of Intrusion Detectors for a Distributed Application through Bayesian Network Modeling,"To secure today’s computer systems, it is critical to have different intrusion detection sensors embedded in them. The complexity of distributed computer systems makes it difficult to determine the appropriate configuration of these detectors, i.e., their choice and placement. In this paper, we describe a method to evaluate the effect of the detector configuration on the accuracy and precision of determining security goals in the system. For this, we develop a Bayesian network model for the distributed system, from an attack graph representation of multi-stage attacks in the system. We use Bayesian inference to solve the problem of determining the likelihood that an attack goal has been achieved, given a certain set of detector alerts. We quantify the overall detection performance in the system for different detector settings, namely, choice and placement of the detectors, their quality, and levels of uncertainty of adversarial behavior. These observations lead us to a greedy algorithm for determining the optimal detector settings in a large-scale distributed system. We present the results of experiments on Bayesian networks representing two real distributed systems and real attacks on them."
A Multi-Sensor Model to Improve Automated Attack Detection,"Most intrusion detection systems available today are using a single audit source for detection, even though attacks have distinct manifestations in different parts of the system. In this paper we investigate how to use the alerts from several audit sources to improve the accuracy of the intrusion detection system (IDS). Concentrating on web server attacks, we design a theoretical model to automatically reason about alerts from different sensors, thereby also giving security operators a better understanding of possible attacks against their systems. Our model takes sensor status and capability into account, and therefore enables reasoning about the absence of expected alerts. We require an explicit model for each sensor in the system, which allows us to reason about the quality of information from each particular sensor and to resolve apparent contradictions in a set of alerts.Our model, which is built using Bayesian networks, needs some initial parameter values that can be provided by the IDS operator. We apply this model in two different scenarios for web server security. The scenarios show the importance of having a model that dynamically can adapt to local transitional traffic conditions, such as encrypted requests, when using conflicting evidence from sensors to reason about attacks."
Monitoring SIP Traffic Using Support Vector Machines,We propose a novel online monitoring approach to distinguish between attacks and normal activity in SIP-based Voice over IP environments. We demonstrate the efficiency of the approach even when only limited data sets are used in learning phase. The solution builds on the monitoring of a set of 38 features in VoIP flows and uses Support Vector Machines for classification. We validate our proposal through large offline experiments performed over a mix of real world traces from a large VoIP provider and attacks locally generated on our own testbed. Results show high accuracy of detecting SPIT and flooding attacks and promising performance for an online deployment are measured.
The Effect of Clock Resolution on Keystroke Dynamics,"Keystroke dynamics—the analysis of individuals’ distinctive typing rhythms—has been proposed as a biometric to discriminate legitimate users from impostors (whether insiders or external attackers). Anomaly detectors have reportedly performed well at this discrimination task, but there is room for improvement. Detector performance might be constrained by the widespread use of comparatively low-resolution clocks (typically 10–15 milliseconds).This paper investigates the effect of clock resolution on detector performance. Using a high-resolution clock, we collected keystroke timestamps from 51 subjects typing 400 passwords each. We derived the timestamps that would have been generated by lower-resolution clocks. Using these data, we evaluated three types of detectors from the keystroke-dynamics literature, finding that detector performance is slightly worse at typical clock resolutions than at higher ones (e.g., a 4.2% increase in equal-error rate). None of the detectors achieved a practically useful level of performance, but we suggest opportunities for progress through additional, controlled experimentation."
A Comparative Evaluation of Anomaly Detectors under Portscan Attacks,"Since the seminal 1998/1999 DARPA evaluations of intrusion detection systems, network attacks have evolved considerably. In particular, after the CodeRed worm of 2001, the volume and sophistication of self-propagating malicious code threats have been increasing at an alarming rate. Many anomaly detectors have been proposed, especially in the past few years, to combat these new and emerging network attacks. At this time, it is important to evaluate existing anomaly detectors to determine and learn from their strengths and shortcomings. In this paper, we evaluate the performance of eight prominent network-based anomaly detectors under malicious portscan attacks. These ADSs are evaluated on four criteria: accuracy (ROC curves), scalability (with respect to varying normal and attack traffic rates, and deployment points), complexity (CPU and memory requirements during training and classification,) and detection delay. These criteria are evaluated using two independently collected datasets with complementary strengths. Our results show that a few of the anomaly detectors provide high accuracy on one of the two datasets, but are unable to scale their accuracy across the datasets. Based on our experiments, we identify promising guidelines to improve the accuracy and scalability of existing and future anomaly detectors."
